CN102014000084968,20140310,CN103812110B8,20170322,H02J3/01;H01F17/02;H01F27/40;,哈尔滨理工大学,朱东柏,数字滤波空心电力电抗器,黑龙江省哈尔滨市学府路52号电气学院,150080
CN102014000466639,20140912,CN104257315B8,20170322,A47K10/48;,青岛玉兰祥商务服务有限公司,顾祥茂,一种红外线自动干手器电路,山东省青岛市李沧区九水东路320号,266199
CN201510542586.9,20150831,CN105058655B8,20170322,B29C37/02;B26D1/36;B26D7/26;B26D7/02;,温岭市创嘉信息科技有限公司,郭嘉川,一种衣架的修边装置,浙江省台州市温岭市泽国镇泽楚路889号温岭汽贸商务城9幢二单元708室,317523
CN102015000580551,20150914,CN105027859B8,20170322,A01F15/00;A01F15/14;,温岭市创嘉信息科技有限公司,郭嘉川,一种高效率农作物秸秆打捆机,浙江省台州市温岭市泽国镇泽楚路889号温岭汽贸商务城9幢二单元708室,317523
CN201510707165.7,20151028,CN105252506B,20170322,B25H3/02;B23P15/00;,金华市秸和环保技术咨询有限公司,李聪,一种电力工具柜,浙江省金华市婺城区新狮街道金带街729号A4-402,321000
CN102015000707303,20151027,CN105271420B,20170322,C01G41/02;B82Y30/00;,陕西科技大学,黄剑锋,一种制备纳米级颗粒状W<sub>18</sub>O<sub>49</sub>材料的方法,陕西省西安市未央区大学园1号,710021
CN102015000707611,20151026,CN105259314B,20170322,G01N33/00;,广东省生态环境与土壤研究所,陈俊华,一种铅离子可视化检测方法及检测试剂盒,广东省广州市天源路808号,510650
CN102015000707787,20151026,CN105298329B,20170322,E06B3/66;E06B3/67;E06B9/02;E06B7/28;,陈桂粦,吴玲玲,窗体结构,广东省惠州市博罗县龙溪镇龙溪大道106号,516000
CN102015000707834,20151026,CN105298311B,20170322,E06B3/02;E06B5/20;E06B5/16;E06B7/28;,吴玲玲,吴玲玲,玻璃门,广东省惠州市惠阳区新圩镇镇府南路12号,516000
CN102015000708129,20151018,CN105235071B,20170322,B28D1/04;B28D7/04;,河南省众邦伟业科技有限公司,胡伟祥,建筑墙材智能生产线一次多片切割机,河南省漯河市临颍县产业聚集区颍川路北侧经一路西侧,0
CN102015000708502,20151026,CN105293297B,20170322,B66C19/00;B66C11/00;,广东电网有限责任公司中山供电局,林悦德,吊装设备,广东省中山市东区博爱六路68号,528437
CN201510708645.5,20151026,CN105298330B,20170322,E06B3/67;,陈桂粦,吴玲玲,窗口隔热结构,广东省惠州市博罗县龙溪镇龙溪大道106号,516000
CN102015000709257,20151028,CN105198352B,20170322,C04B28/14;C04B38/02;E04B2/72;,青海博川矿业开发有限公司,王世刚,一种NCS‑石膏一体化自保温轻质墙体的制备方法,山西省长治市潞城市迎宾路1号,047500
CN102015000710915,20151028,CN105150777B,20170322,B60C23/04;,上海泰好电子科技有限公司,金晓干,胎压监测系统的低频自动匹配方法及装置,上海市浦东新区卫亭路533号,201323
CN201510711326.X,20151028,CN105202776B,20170322,F24J2/10;F24J2/46;,浙江大明玻璃有限公司,屠有军,一种超薄微弧平面太阳能反射镜的封装方法,浙江省嘉兴市平湖市独山港区兴港路789号,314200
CN201510711901.6,20151028,CN105157254B,20170322,F24J2/38;,广东合一新材料研究院有限公司,王伟,适用太阳能聚光系统的跟踪传动机构,广东省广州市中新广州知识城凤凰三路8号2号楼2006房,511365
CN201510713445.9,20151028,CN105220325B,20170322,D03J1/00;D03D47/34;,海宁市金佰利纺织有限公司,鲁金州,一种改进的剑杆织机的除尘加湿装置,浙江省嘉兴市海宁市长安镇（农发区）之江路57号,314408
CN201510714421.5,20151029,CN105237379B,20170322,C07C49/697;C07C45/00;,河南省科学院化学研究所有限公司,杨振强,一种4‑溴芴酮的生产方法,河南省郑州市金水区红专路56号,450002
CN201510715649.6,20151030,CN105171770B,20170322,B25J17/00;G01M5/00;,四川大学,汤卿,一种机械安全变刚度弹性关节,四川省成都市武侯区一环路南一段24号,610065
CN201510716411.5,20151029,CN105327670B,20170322,B01J19/24;,李舒展,李舒展,一种化学反应釜,山东省济宁市中区洸河路26号济宁市育才中学,272000
CN201510718486.7,20151028,CN105338336B,20170322,H04N13/04;H04N13/00;G02B27/22;,四川长虹电器股份有限公司,李丹权,基于柱镜光栅与LCD屏幕的立体图像快速合成方法,四川省绵阳市高新区绵兴东路35号,621000
CN201510718635.X,20151029,CN105418468B,20170322,C07C319/14;C07C323/22;,深圳拒马科技有限公司,张云翔,一种醌芳基硫醚类化合物的合成方法,广东省深圳市前海深港合作区前湾一路1号A栋201室,518000
CN201510718905.7,20151030,CN105146725B,20170322,A24B7/00;,中国烟草总公司郑州烟草研究院,朱文魁,一种烟草制丝线滚筒加工过程筒内漏风量的检测方法,河南省郑州市高新区枫杨街2号,450001
CN201510718968.2,20151029,CN105207267B,20170322,H02J3/38;,南阳理工学院,高彦卿,一种微网能量管理系统,河南省南阳市宛城区长江路80号,473004
CN201510719249.2,20151029,CN105236168B,20170322,B65H1/18;B65H3/24;B65G25/06;B65G47/91;,启东腾飞企业管理服务有限公司,董芬芳,一种建材板料提升输送装置,江苏省南通市启东市科技创业园兴龙路1号,226200
CN201510719506.2,20151030,CN105217353B,20170322,B65H23/038;B65H23/26;,湖州现代纺织机械有限公司,韦文泉,一种织机传布装置,浙江省湖州市吴兴区八里店镇章家埭村经一路88号,313000
CN201510719687.9,20151030,CN105220323B,20170322,D03D49/20;,湖州现代纺织机械有限公司,韦文泉,一种布辊卷取座,浙江省湖州市吴兴区八里店镇章家埭村经一路88号,313000
CN201510719941.5,20151030,CN105146854B,20170322,A43B23/04;,黑金刚（福建）自动化科技股份公司,阙凯,一种运动鞋鞋面,福建省泉州市经济技术开发区崇宏街388号,362000
CN201510720698.9,20151030,CN105275332B,20170322,E06B3/58;,成都标建铝业有限公司,罗健,便于玻璃装卸的铝型材窗,四川省成都市双流县黄水镇玉坝村,610000
CN201510721085.7,20151030,CN105222626B,20170322,F28D15/02;B21D53/06;,浙江省太阳能产品质量检验中心,韩雷涛,重力热管常温排真空加工设备,浙江省嘉兴市海宁市袁花镇联红路208号,314416
CN201510721477.3,20151030,CN105269230B,20170322,B23K37/047;,安徽合力股份有限公司,陈中华,用于叉车内门架上横梁的铆焊工装,安徽省合肥市经开区卧云路163号,230601
CN201510722550.9,20151031,CN105380480B,20170322,A47G21/04;,重庆恒悦户外旅行用品有限公司,杨长清,一种防抖的勺子,重庆市涞滩镇正觉村二社,401520
CN201510723328.0,20151029,CN105157253B,20170322,F24J2/34;F24J2/30;F24J2/46;,四川亚欧鼎新能源科技有限公司,张天明,一种太阳能相变蓄热系统,四川省成都市高新区天府三街69号1栋21层2121号,610041
CN201510723436.8,20151029,CN105230230B,20170322,A01D41/12;,张春平,张春平,联合收割机粮食快排筛选机,安徽省亳州市蒙城县庄子小区D区7栋402室,233500
CN201510723711.6,20151101,CN105334327B,20170322,C12Q1/68;,宁波美康盛德医学检验所有限公司,邹炳德,一种用于检测眼病的试剂盒及其检测方法,浙江省宁波市鄞州区启明南路269号,315104
CN201510723720.5,20151101,CN105334328B,20170322,C12Q1/68;,深圳市艾伟迪生物科技有限公司,李泓彦,一种用于检测眼科疾病的试剂盒及其检测方法,广东省深圳市南山区桃源街道平山一路民企科技园2栋606,518000
CN201510724305.1,20151029,CN105174228B,20170322,C01B13/11;,浙江百悦康科技有限公司,朱鲁曰,一种臭氧发生装置,浙江省嘉兴市南湖区七星镇三店路398号,314002
CN201510724471.1,20151030,CN105291182B,20170322,B26F1/16;B26D5/08;B26D5/26;,青岛新大成塑料机械有限公司,李成秀,滴灌管带用打孔机及滴灌管带生产线,山东省青岛市胶州市阜安第二工业园,266000
CN201510725235.1,20151029,CN105196294B,20170322,B25J9/16;,长春工业大学,董博,采用位置测量的可重构机械臂分散控制系统及控制方法,吉林省长春市朝阳区延安大街2055号,130012
CN201510725437.6,20151030,CN105259429B,20170322,G01R29/16;,厦门科华恒盛股份有限公司,易龙强,一种三相电相序判断方法,福建省厦门市火炬高新区火炬园马垄路457号,361006
CN201510725461.X,20151030,CN105204125B,20170322,G02B6/42;,武汉光迅科技股份有限公司,谭书伟,一种反射式光电子器件的自动耦合系统,湖北省武汉市江夏区藏龙岛开发区潭湖路1号,430205
CN201510725526.0,20151030,CN105241682B,20170322,G01M99/00;,吉林大学,陈传海,重型机床尾座可靠性试验台,吉林省长春市南关区前进大街2699号,130000
CN201510725998.6,20151030,CN105275079B,20170322,E03F5/04;E03C1/28;,宁波高新区海子卫浴用品有限公司,周赐平,一种横向排水地漏,浙江省宁波市高新区冬青路389号,315040
CN201510726003.8,20151102,CN105410990B,20170322,A24C5/39;,湖南核三力技术工程有限公司,许诺,负压气力输送系统物料品牌切换方法,湖南省衡阳市蒸湘区解放西路160号,421001
CN201510726498.4,20151028,CN105349896B,20170322,C22C38/28;C21D1/18;,安徽省三方新材料科技有限公司,仰明,一种低合金挖掘机斗齿的制备方法,安徽省宣城市宁国经济技术开发区汪溪园区S104道路东侧、工业二号路南侧,242300
CN201510726632.0,20151030,CN105291090B,20170322,B25J9/00;B25J9/12;B25J9/16;,清华大学,姜峣,一种并联式宏微高精度运动平台,北京市海淀区北京市-82信箱,100084
CN201510726712.6,20151028,CN105316601B,20170322,C22C38/60;C22C33/04;,安徽省三方新材料科技有限公司,仰明,一种顽石破碎机用衬板及其制备方法,安徽省宣城市宁国经济技术开发区汪溪园区S104道路东侧、工业二号路南侧,242300
CN201510727290.4,20151029,CN105271437B,20170322,C01G49/16;,南京南大波平电子信息有限公司,张金祥,一种低频电磁波吸收材料用羰基铁粉吸收剂的制备方法,江苏省南京市江宁区禄口空港工业园蓝天路19号,211113
CN201510727792.7,20151030,CN105171802B,20170322,B26D1/16;B26D7/26;,江苏耀阳电子有限公司,顾祥宝,一种用于加工太阳能电池板切片机的切割装置,江苏省镇江市扬中市三茅街道兴华村三二线,212200
CN201510727916.1,20151030,CN105254540B,20170322,C07C309/17;C07C303/32;B01D1/18;B01D1/14;,嘉兴赞宇科技有限公司,浙江赞宇科技股份有限公司,一种粉状脂肪酸甲酯磺酸钠的制备方法及装置,浙江省嘉兴市乍浦嘉化工业园内,314201
CN201510728047.4,20151030,CN105252462B,20170322,B25B11/00;,深圳市海目星激光科技有限公司,张松岭,一种定位治具模块,广东省深圳市龙华新区观澜君龙社区环观南路26号,518000
CN201510728134.X,20151029,CN105234742B,20170322,B23Q11/10;,丽水学院,叶晓平,自动过滤回收的环保机床,浙江省丽水市莲都区学院路1号,323020
CN201510728267.7,20151030,CN105269697B,20170322,B28D5/04;,浙江辉弘光电能源有限公司,陈小力,一种多线切割机用滑轮,浙江省嘉兴市平湖市经济开发区新兴三路899号,314200
CN201510728360.8,20130829,CN105212611B,20170322,A47G9/00;,郑牧之,郑永如,带弹簧的竹凉席及其制造方法,浙江省宁波市江东区曙光路595弄59号604室,315040
CN201510729008.6,20151030,CN105350573B,20170322,E02D29/045;E02D17/02;,上海建工二建集团有限公司,龙莉波,一种逆作法施工中楼板施工方法,上海市浦东新区福山路33号,200120
CN201510729051.2,20151031,CN105241273B,20170322,F28D1/047;F28F21/02;F28F1/30;F24F6/08;,宁波远志立方能源科技有限公司,卢雁显,具有翅片的暖气片,浙江省宁波市海曙区丽园北路755号1025室,315012
CN201510729269.8,20151102,CN105401315B,20170322,B65H73/00;D03J1/00;D01H9/16;,武汉纺织大学,张成俊,一种玻纤纱管余纱去除装置及其控制方法,湖北省武汉市东湖开发区民族大道227号,430073
CN201510729287.6,20151030,CN105196283B,20170322,B25J9/06;B25J15/06;B25J15/08;B25J17/00;B25J18/00;,武汉大学,王伟,一种混联双足铁塔攀爬机器人,湖北省武汉市武昌区珞珈山武汉大学,430072
CN201510729304.6,20151030,CN105362028B,20170322,A61G15/02;A61G15/12;A61H23/02;A47C17/04;,宁波康福特健身器械有限公司,汪海明,一种按摩沙发,浙江省奉化市东郊经济开发区唐鹰工业园,315500
CN201510729474.4,20151030,CN105234191B,20170322,B21B37/76;,华中科技大学,李曦,一种层流冷却温度控制方法,湖北省武汉市洪山区珞喻路1037号,430074
CN201510729813.9,20151102,CN105394803B,20170322,A24B3/10;,云南省烟草公司文山州公司,沈燕金,一种多热源供热烤烟房,云南省文山壮族苗族自治州文山市开化中路123号,663000
CN201510729827.0,20151102,CN105328196B,20170322,B22F9/02;C22C28/00;,中国核动力研究设计院,陈建刚,控制氮含量的U‑Mo合金粉末制备工艺,四川省成都市一环路南三段28号,610000
CN201510730202.6,20151102,CN105177444B,20170322,C22C38/42;C22C38/20;C22C38/16;C21D8/02;,武汉钢铁（集团）公司,高洋,一种生产低温高磁感取向硅钢的常化控制方法,湖北省武汉市武昌区友谊大道999号,430080
CN102015000730331,20151102,CN105221509B,20170322,F15B13/02;,宁波江北宇洲液压设备厂,卢宇,一种分阶段开启的平衡阀,浙江省宁波市江北区兴甬路98号宁波江北宇洲液压设备厂,315021
CN102015000730862,20151030,CN105269698B,20170322,B28D5/04;B28D7/00;,浙江辉弘光电能源有限公司,陈小力,一种多线切割机用切削液循环装置,浙江省嘉兴市平湖市经济开发区新兴三路899号,314200
CN102015000730907,20151030,CN105297236B,20170322,D03C1/16;D03D51/34;,浙江康立自控科技有限公司,梁汇江,织机反向找纬控制方法,浙江省绍兴市新昌县七星街道亿鼎路16号,312500
CN102015000730923,20130325,CN105216052B,20170322,B26F1/02;B26F1/14;B26D5/08;B26D7/02;D06H7/00;C14B5/00;C14B17/10;C14B17/08;,兰如林,兰如林,适用在布料、皮料以及革料上的打孔机,浙江省温州市瓯海区新桥街道永康巷7弄10号,325000
CN102015000731499,20151102,CN105253915B,20170322,C01G31/00;C09K11/69;,渤海大学,刘连利,Zn<sub>2</sub>(OH)<sub>3</sub>VO<sub>3</sub>微米球的制备方法,辽宁省锦州市松山新区科技路19号,121000
CN102015000731775,20151102,CN105331144B,20170322,C09B67/28;C09D11/02;,深圳市国华光电科技有限公司,深圳市国华光电研究院,纯黑色染料、其制备方法以及电润湿显示油墨,广东省深圳市龙华新区观澜大布巷社区观光路1301-1号7楼703-1,518110
CN102015000732105,20151029,CN105326317B,20170322,A47G29/122;,中国邮政集团公司广州市分公司,曾俊健,节能信报箱,广东省广州市天河区天河东路155号（骏源大厦内）,510620
CN102015000732389,20151102,CN105257198B,20170322,E06B9/52;B01D50/00;B01D53/76;A61L9/22;,西安康普瑞新材料科技有限公司,王一凡,防霾透气窗纱加工工艺及防霾透气窗纱,陕西省西安市高新区唐延路35号旺座现代城4幢2单元20804室,710065
CN102015000732396,20151102,CN105203670B,20170322,G01N30/02;G01N30/06;,黑龙江大学,刘丽娟,一种丝瓜络的高效液相色谱指纹图谱的建立方法,黑龙江省哈尔滨市南岗区学府路74号,150080
CN102015000732417,20151102,CN105277661B,20170322,G01N33/00;,西北工业大学,张开富,复合材料层合板干涉螺栓安装过程分层损伤分析方法,陕西省西安市友谊西路127号,710072
CN102015000732447,20151031,CN105341997B,20170322,A24B15/24;A24B3/12;C11B9/00;B01D3/00;,武汉纽威晨创科技发展股份有限公司,叶菁,水射流粉碎和牵引网膜微波蒸馏提取烟草致香成分的方法,湖北省武汉市东湖新技术开发区高科圆二路99号,430206
CN102015000732476,20151031,CN105249526B,20170322,A24B15/24;,武汉纽威晨创科技发展股份有限公司,叶菁,水射流粉碎和夹带式微波蒸馏提取烟草致香成分的方法,湖北省武汉市东湖新技术开发区高科圆二路99号,430206
CN102015000732727,20151102,CN105234179B,20170322,B21B19/10;B21B37/58;,浙江格洛斯无缝钢管有限公司,毛飞,利用二辊斜轧机进行厚壁无缝钢管的定径工艺及轧制工艺,浙江省绍兴市上虞区小越镇工业区,312367
CN102015000732793,20151031,CN105433433B,20170322,A24B15/24;A24B3/12;C11B9/00;,武汉纽威晨创科技发展股份有限公司,叶菁,水射流粉碎和离心膜微波蒸馏提取烟草致香成分的方法,湖北省武汉市东湖新技术开发区高科圆二路99号,430206
CN102015000733457,20151102,CN105256786B,20170322,E02D1/02;,赵新宏,赵新宏,一种无缆静力触探设备及其使用方法,浙江省宁波市永丰路199弄26栋101室,315000
CN102015000733482,20151102,CN105239549B,20170322,E02D1/02;H01R24/20;H01R24/28;H01R13/52;H01R13/03;,赵新宏,赵新宏,无缆静力触探探杆及应用于前述探杆的电缆连接器,浙江省宁波市永丰路199弄26栋101室,315000
CN102015000733533,20151031,CN105300154B,20170322,F28F1/32;F28F19/00;F28F21/02;F28F13/18;,卢雁显,卢雁显,防烫手暖气片,广西壮族自治区南宁市兴宁区民生路国贸大厦,530012
CN102015000734181,20151102,CN105196339B,20170322,B26D7/01;,马骁,马骁,一种裁切装置,天津市武清区王庆坨镇庆通道7号增1号,300317
CN102015000734251,20151030,CN105196285B,20170322,B25J9/08;B25J9/14;,无锡大东机械制造有限公司,邱恩博,气动取样装置,江苏省无锡市锡山经济技术开发区芙蓉西三路11号,214191
CN102015000734288,20151102,CN105226564B,20170322,H02G1/02;B25J9/00;B25J9/12;,国网山东省电力公司电力科学研究院,山东鲁能智能技术有限公司,一种高压输电线路在线作业操作臂,山东省济南市市中区望岳路2000号,250002
CN102015000734398,20151029,CN105234974B,20170322,B26D1/09;B26D7/20;B26D7/22;B26D7/26;B26D5/08;,安徽理工大学,郑艳,一种双刀连续剁馅机,安徽省淮南市舜耕中路168号,232001
CN102015000734410,20151103,CN105218339B,20170322,C07C49/203;C07C45/73;,山东新和成药业有限公司,浙江新和成股份有限公司,一种由异戊烯醛制备甲基庚烯酮的方法,山东省潍坊市滨海经济开发区香江西二街001999号,261108
CN102015000734716,20151030,CN105252588B,20170322,B26F1/02;B26F1/14;B26D7/06;B26D7/18;B26D7/02;,安徽广晟德自动化设备有限公司,胡稳,一种LED灯支架全自动生产线,安徽省宣城市广德县经济开发区西区,242200
CN102015000734785,20151030,CN105328353B,20170322,B23K26/70;B23K26/38;,安徽江淮汽车集团股份有限公司,刘烨,激光切割机的切割平台,安徽省合肥市桃花工业园始信路669号,230601
CN102015000734984,20151103,CN105235948B,20170322,B65B43/54;B65B51/07;,河南金谷实业发展有限公司,北京恒天中信科技开发有限公司,散装物料用自动包装机,河南省郑州市南阳路177号,0
CN102015000735137,20151103,CN105256481B,20170322,D06B3/30;D06B17/02;,桐乡市满江红纺织助剂厂,沈国良,一种成衣冷堆染色方法,浙江省嘉兴市桐乡市乌镇镇北大街河东25号（乌镇酒厂内）,314500
CN102015000735244,20151103,CN105214846B,20170322,B03C3/66;,佛山市科蓝环保科技股份有限公司,尤今,静电净化器冲击脉冲电流抑制装置及安装方法,广东省佛山市南海区狮山镇桃园东路99号力合科技产业中心4栋研发车间首层研发车间、二层研发车间,528200
CN102015000735875,20151028,CN105261427B,20170322,H01B15/00;,兴乐电缆有限公司,虞文品,一种简易式金属绞合线分线装置,浙江省乐清市柳市镇峡门工业区,325604
CN102015000736042,20151030,CN105234887B,20170322,B25B27/00;,安徽江淮汽车集团股份有限公司,王森,一种气门弹簧上垫片和锁夹拆装工具,安徽省合肥市桃花工业园始信路669号,230601
CN102015000736087,20151103,CN105269613B,20170322,B26D3/06;B26D7/26;B26D5/08;B26D7/00;,嘉善龙翔人造毛绒有限公司,张伟强,一种皮革切槽机,浙江省嘉兴市嘉善县陶庄镇西工区柳溪路413号,314100
CN102015000737907,20151104,CN105201949B,20170322,F15B13/02;,长江大学,冯定,一种液力活塞换向机构,湖北省荆州市南环路1号长江大学,434020
CN102015000737927,20151103,CN105296627B,20170322,C12Q1/68;C12N15/11;,浙江大学,方盛国,朱鹮抗细菌潜力检测的II类MHC基因的特异性引物及分型方法,浙江省杭州市西湖区浙大路38号,310027
CN102015000738801,20151104,CN105278007B,20170322,G02B1/10;,福建福光股份有限公司,陈龙,涂墨工装治具结构及其使用方法,福建省福州市马尾区江滨东大道158号,350015
CN102015000742343,20151105,CN105226138B,20170322,H01L31/18;,无锡市正罡自动化设备有限公司,刘文波,EPE膜自动供给装置及其方法和叠焊机,江苏省无锡市锡山经济开发区六期3号厂房,214101
CN102015000742842,20151103,CN105296802B,20170322,C22C14/00;C22C1/04;,华南理工大学,杨超,一种高强韧双尺度结构钛合金及其制备方法与应用,广东省广州市越秀区先烈中路83号华南理工大学越秀专利技术服务中心,510075
CN102015000743350,20151105,CN105199430B,20170322,C09B67/42;G01N1/30;G01N33/52;,济宁博联生物科技有限公司,李家青,一种上皮组织染色剂及其制备方法,山东省济宁市高新区柳行办事处东外环6号（鲁抗医药工业园内）,272000
CN102015000744418,20140724,CN105231983B,20170322,A61B1/24;A61B17/56;,谭洪武,张纪玲,一种颌面手术器械,山东省临沂市人民医院消化内一科,276000
CN102015000745356,20151106,CN105199018B,20170322,C08F2/48;G03F7/027;G03F7/004;C07F9/53;,常州久日化学有限公司,吴吉,肟酯类光引发剂及其制备和应用,江苏省常州市金坛经济开发区东康路99号,213200
CN102015000746468,20151106,CN105230224B,20170322,A01D34/40;A01M21/02;,嘉兴职业技术学院,张金美,一种智能除草机及其杂草清除方法,浙江省嘉兴市桐乡大道547号,314036
CN102015000746579,20151106,CN105259624B,20170322,G02B6/42;,武汉电信器件有限公司,罗耀新,一种光电通信用SFP+COB模块组件的耦合平台,湖北省武汉市洪山区邮科院路88号,430074
CN102015000746737,20151105,CN105261658B,20170322,H01L31/0203;H01L31/18;,中国地质调查局南京地质调查中心,修连存,一种光电传感器封装及其方法,江苏省南京市中山东路534号,210016
CN102015000746815,20151104,CN105427025B,20170322,G06Q10/06;G06Q50/06;,广东电网有限责任公司茂名供电局,王清玲,一二次元件安全性评估方法和系统,广东省茂名市官山四路2号,525000
CN102015000747234,20151104,CN105421463B,20170322,E02D17/02;E02D17/04;,中建三局集团有限公司,张安政,一种大跨度密支撑超长深基坑纵向开挖施工方法,湖北省武汉市洪山区鲁磨路306号,430074
CN102015000747404,20151105,CN105350549B,20170322,E02D17/20;,河海大学,张久长,一种柱状节理岩体边坡锚索支护方法,江苏省南京市江宁开发区佛城西路8号,211100
CN102015000747409,20151103,CN105235903B,20170322,B64C33/02;,安徽工业大学,邱晗,仿生摆翼式飞行器,安徽省马鞍山市马向路新城东区,243032
CN102015000747556,20151106,CN105230246B,20170322,A01D51/00;,李兆林,李兆林,一种花籽收集车,甘肃省酒泉市玉门市黄闸湾乡泽湖村,735211
CN102015000747898,20151106,CN105257428B,20170322,F02K7/16;F02K7/14;,西南科技大学,宋丹路,一种分布式压缩、旋流冲压发动机,四川省绵阳市涪城区青龙大道中段59号,621000
CN102015000747903,20151106,CN105236452B,20170322,C01D9/14;,化工部长沙设计研究院,杨灿辉,一种硝酸钠与氯化钾反应生产高纯硝酸钾的工艺,湖南省长沙市雨花区洞井铺洞株路6号,410116
CN102015000747909,20151106,CN105234919B,20170322,B25H7/04;,国家电网公司,国网山西省电力公司朔州供电公司,设备线夹自动标孔装置,北京市西城区长安街86号,100031
CN102015000748472,20151107,CN105200286B,20170322,C22C21/08;C22C21/16;F03D1/06;F03D3/06;,江苏晨日环保科技有限公司,杨浩,小型风力发电机,江苏省南通市海安县开发区开发大道188号,226600
CN102015000748475,20151107,CN105220062B,20170322,C22C38/02;C22C38/04;C22C38/18;C22C38/08;C22C38/12;C22C38/16;C22C38/06;C23C8/22;C21D1/18;C21D6/04;F03D80/70;F03D15/00;,李建尧,李白,一种风力发电机,山东省青岛市李沧区九水东路320号工业园,266000
CN102015000749329,20151106,CN105238468B,20170322,C10L1/32;,广西师范学院,张丽霞,煤油微乳液及其制备方法,广西壮族自治区南宁市明秀东路175号广西师范学院,530001
CN102015000749496,20151105,CN105304355B,20170322,H01G11/86;H01G11/30;H01G11/42;H01G11/46;,上海应用技术学院,张全生,一种利用有机物电解法制备二氧化锰/碳微球电极的方法,上海市徐汇区漕宝路120号,200235
CN102015000749636,20151106,CN105240058B,20170322,F01D17/00;,国网河南省电力公司电力科学研究院,大唐林州热电有限责任公司,一种基于喷嘴流量计算的汽轮机流量曲线辨识及优化方法,河南省郑州市二七区嵩山南路85号,450052
CN102015000749755,20151106,CN105275790B,20170322,F04B49/06;,大亚湾核电运营管理有限责任公司,中国广核集团有限公司,一种核电站一回路冷却剂泵的调整方法,广东省深圳市大鹏新区大鹏街道鹏飞路大亚湾核电基地01楼B105,518124
CN102015000749785,20151106,CN105239509B,20170322,E01D19/16;E01D21/00;,柳州欧维姆工程有限公司,韦福堂,一种平行钢绞线斜拉索的紧索器及其施工方法,广西壮族自治区柳州市龙泉路3号,545005
