CN102016000823406,20160914,CN106299002B,20170714,H01L31/048;H02S30/10;H01L31/18;,中国电子科技集团公司第四十八研究所,周洪彪,柔性太阳电池组件及其制备方法和应用,湖南省长沙市天心区新开铺路1025号,410111
CN102016000854196,20160926,CN106430313B,20170714,C01G41/02;G01N33/00;,安阳师范学院,魏少红,空心花团状WO<base:Sub>3</base:Sub>多级结构气敏材料、合成方法及应用,河南省安阳市弦歌大道436号,455000
CN102016000879293,20160930,CN106267560B,20170714,A61N1/36;,深圳硅基仿生科技有限公司,夏斌,用于神经刺激的脉冲电流产生电路及人工视网膜系统,广东省深圳市宝安区新安街道留芳路6号庭威产业园3栋4楼A区,518000
CN102016000889351,20161011,CN106315991B,20170714,C02F9/14;,内蒙古中煤远兴能源化工有限公司,唐多钦,一种用于工业废水的分盐工艺,内蒙古自治区鄂尔多斯市乌审旗无定河镇纳林河项目区,017309
CN102016000919221,20161021,CN106501087B,20170714,G01N3/10;,江苏铭星供水设备有限公司,王林泉,水箱强度试验装置,江苏省盐城市建湖县科技创业园铭星北路1号,224700
CN102016000963715,20161028,CN106476288B,20170714,B29C65/56;B29C65/78;B26D5/08;B26D1/12;,广州林旺空调工程有限公司,林兴权,一种配电柜柜门边框拼接件的密闭条按压装置,广东省广州市天河路228号广晟大厦1709,510000
CN102016001006417,20161116,CN106358405B,20170714,H05K5/02;H05K7/14;,广州市金志电气科技发展有限公司,王琪,一种电力抽屉柜,广东省广州市增城区增江街经三路18号（厂房A1、A2）,511300
CN102016001016547,20161118,CN106276420B,20170714,B65H75/02;B65H75/34;,惠州市一德塑胶科技有限公司,黄仕元,一种供水软管的绕式连接装置,广东省惠州市博罗县龙溪镇小蓬岗村一德产业园,516121
CN102016001180001,20161219,CN106499781B,20170714,F16H3/66;F16H63/34;,广州市新域动力技术有限公司,段福海,叠层电子制动鼓式四速自动变速装置,广东省广州市萝岗区云展路8号,510000
