CN102015000873345,20151202,CN105405534B,20170322,H01B13/00;,重庆泰山电缆有限公司,刘彤,线芯表面氮气油污和小颗粒分离装置,重庆市渝北区渝北国家农业科技园区金果大道239号,401120
CN102015000873349,20151202,CN105379486B,20170322,A01C11/02;,现代农装科技股份有限公司,颜华,一种移栽机及其栽植装置,北京市朝阳区德胜门外北沙滩1号32信箱,100083
CN102015000873796,20151202,CN105423832B,20170322,F42D1/00;F42D3/02;,广东中人集团建设有限公司,邢光武,一种厚壁砖烟囱定向窗的爆破施工方法,广东省广州市天河区上元岗中成路300号大院,510515
CN102015000873837,20151202,CN105294688B,20170322,C07D471/04;A61P31/18;,北京工业大学,胡利明,"6‑氯‑N‑(取代苄基)‑1H‑吡咯并[2,3‑b]吡啶‑2‑酰胺化合物及其制备方法和应用",北京市朝阳区平乐园100号,100124
CN201510873841.8,20151201,CN105500957B,20170322,B42F17/22;,黄丽萍,黄丽萍,容易拨取名片的名片夹,广东省佛山市南海区大沥镇盐步青龙村青龙大道北十一巷3号,528000
CN102015000873845,20151201,CN105399139B,20170322,C01G23/047;,华南师范大学,深圳市国华光电科技有限公司,一种诱导二氧化钛纳米颗粒自组装形成珍珠链结构的方法,广东省广州市大学城华南师范大学理五栋彩色动态电子纸显示技术研究所,510631
CN102015000873922,20150209,CN105366636B,20170322,B81C1/00;,江西师范大学,袁彩雷,集成MOS器件的CMOS湿度传感器形成方法,江西省南昌市紫阳大道99号,330022
CN102015000874134,20151202,CN105348285B,20170322,C07D473/34;,新发药业有限公司,戚聿新,一种低成本高收率制备腺嘌呤的方法,山东省东营市垦利县黄店村,257513
CN102015000874276,20151203,CN105489265B,20170322,H01B1/22;H01L31/0224;H01B13/00;,佛山市首诺新能源材料有限公司,邹敏昌,一种用于导电线路的喷墨打印透明纳米导电银溶液及其制备方法和施工方法,广东省佛山市顺德区伦教新塘世龙工业区世龙大道（时款手套有限公司内厂房首层）,528308
CN102015000874371,20151202,CN105508079B,20170322,F02G5/02;H01L37/04;,国网山东省电力公司冠县供电公司,张海洋,一种槽轮换向的汽车废气热磁发电设备及发电方法,山东省聊城市冠县东风东路130号,252500
CN102015000874690,20151203,CN105461642B,20170322,C07D239/94;A61K31/517;A61P35/00;,中国人民解放军南京军区南京总医院,卢光明,一种新型喹唑啉衍生物LU1505及其制备方法和应用,江苏省南京市玄武区中山东路305号,210002
CN102015000874694,20151201,CN105328081B,20170322,B21F11/00;B21F23/00;D07B9/00;,广州市番禺桂博自动化设备制造厂,蒋永官,一种双线异步剪线设备,广东省广州市番禺区大龙街汉基工业村汉基大道14号,510000
CN102015000875720,20151203,CN105418517B,20170322,C07D239/94;A61K31/517;A61P35/00;,中国人民解放军南京军区南京总医院,卢光明,一种新型喹唑啉衍生物LU1509及其制备方法和应用,江苏省南京市玄武区中山东路305号,210002
CN102015000877738,20151204,CN105382453B,20170322,B23K37/02;,东方电气集团东方汽轮机有限公司,邱述林,一种割炬摆动角度转换装置,四川省德阳市高新技术产业园区金沙江西路666号,618000
CN102015000877881,20151204,CN105499245B,20170322,B08B13/00;B08B3/02;,臧汝涛,臧汝涛,无水型清洗机的气体发生器,北京市海淀区曙光花园望山园4号-704,100048
CN102015000878311,20151204,CN105331762B,20170322,C21B13/12;C22B34/12;,阜新盛盟钛业有限责任公司,辛福永,高钛渣冶炼炉加盖装置,辽宁省阜新市阜蒙县建阜路中段,123000
CN102015000878832,20151204,CN105385875B,20170322,C22C1/10;C22C23/00;C22C32/00;,中北大学,原梅妮,一种仿贝壳珍珠层的镁基复合材料的制备方法,山西省太原市尖草坪区学院路3号,030051
CN102015000879358,20151205,CN105310196B,20170322,A44C5/00;G01C22/00;,张华,张华,一种智能运动手环,山东省青岛市市北区山东路175号青岛疾控中心慢地病科（413室）,266033
CN102015000879667,20151205,CN105312780B,20170322,B23K26/38;B23K26/08;B23K26/70;,重庆镭宝激光智能机器人制造有限公司,祝源成,激光切割机器人的辅助定位装置,重庆市渝北区空港工业园区朗月路标准厂房1单元,401120
CN102015000879724,20151205,CN105345283B,20170322,B25J19/00;,重庆镭宝激光智能机器人制造有限公司,祝源成,机器人激光切割手臂防尘罩,重庆市渝北区空港工业园区朗月路标准厂房1单元,401120
CN102015000880398,20151204,CN105367603B,20170322,C07F9/6568;C09K11/06;H01L51/54;,河南省科学院化学研究所有限公司,陈辉,一种基于蒽的双膦杂六元环有机电致发光化合物、合成方法及其应用,河南省郑州市金水区红专路56号,450002
CN102015000882415,20151207,CN105416340B,20170322,B61L15/00;B61L23/00;,河南思维信息技术有限公司,赵延杰,一种列车提示和预警系统,河南省郑州市高新区科学大道97号,450001
CN102015000882637,20151207,CN105372409B,20170322,G01N33/24;,太原理工大学,冯国瑞,一种用于相似模拟试验的开挖装置,山西省太原市万柏林区迎泽西大街79号,030024
CN102015000882706,20151207,CN105345715B,20170322,B25B21/02;B25B23/147;,苏州市纽莱克电子科技有限公司,田角峰,冲击扭矩电动工具及该工具的控制方法,江苏省苏州市高新区紫金路85号,215015
CN102015000882950,20151203,CN105291070B,20170322,B25H1/16;,哈尔滨工业大学,樊绍巍,一种自锁式一体化升降机构,黑龙江省哈尔滨市南岗区西大直街92号,150001
CN201510884300.5,20151203,CN105348061B,20170322,C07C49/603;C07C45/00;,华中科技大学,顾彦龙,一种2‑环己烯‑1‑酮的制备方法,湖北省武汉市洪山区珞喻路1037号,430074
CN201510885038.6,20151204,CN105290301B,20170322,B21K3/00;B21J13/02;,中国南方航空工业（集团）有限公司,余三山,一种多向异形轴颈锻造方法,湖南省株洲市芦淞区董家塅,412002
CN201510885078.0,20151207,CN105521670B,20170322,B01D46/02;B01D46/04;B01D46/12;,北京巨维通科技有限公司,关玉梅,一种具有二次净化效果的雾霾净化装置,山东省枣庄市高新区泰国工业园复元五路海特电子集团转,277800
CN201510885465.4,20151203,CN105548740B,20170322,G01R31/00;,广东电网有限责任公司电力科学研究院,武汉三相电力科技有限公司,雷击故障侵入波与接地故障侵入波的辨识方法与系统,广东省广州市越秀区东风东路水均岗8号,510080
CN201510886518.4,20151207,CN105364904B,20170322,B25H7/04;,大连金河铸造有限公司,马广华,划线盘,辽宁省大连市庄河市庄岫路78号大连金河铸造有限公司,116400
CN201510886743.8,20151207,CN105350903B,20170322,H02G1/02;E06C7/48;E06C1/52;,国网河南省电力公司三门峡供电公司,国家电网公司,一种输电检修用单双线软梯头,河南省三门峡市崤山路西段,472000
CN201510886835.6,20151207,CN105350904B,20170322,H02G1/02;E06C7/48;E06C1/52;,国网河南省电力公司三门峡供电公司,国家电网公司,输电检修用单双线软梯头,河南省三门峡市崤山路西段,472000
CN201510887613.6,20141030,CN105415942B,20170322,B43L21/02;,曹天行,曹天行,一种提高擦除效率的防尘黑板擦,北京市西城区月坛南街55号,100000
CN201510888444.8,20151203,CN105329777B,20170322,B66C13/18;,山东大学,马昕,带有持续扰动的可升降桥式吊车系统的模糊控制方法,山东省济南市历下区经十路17923号,250061
CN201510888503.1,20151204,CN105329945B,20170322,C01G39/02;,湖北中澳纳米材料技术有限公司,陈方吾,用工业钼酸制备高纯、高溶性三氧化钼的装置及方法,湖北省随州市广水市应办工业园杜家湾,432700
CN201510888696.0,20151204,CN105345254B,20170322,B23K26/03;B23K26/042;,湖北工业大学,吴庆华,旁轴式视觉系统与激光振镜加工系统位置关系的标定方法,湖北省武汉市武昌区南湖李家墩1村1号,430068
CN201510890529.X,20151204,CN105294027B,20170322,C04B28/04;C04B14/02;C04B111/72;,武汉理工大学,李相国,一种氧化石墨烯改性水泥基复合材料及其制备方法,湖北省武汉市洪山区珞狮路122号,430070
CN201510891107.4,20141226,CN105503873B,20170322,C07D473/04;C07D473/06;,浙江永太科技股份有限公司,邵鸿鸣,一种作为二肽基肽酶‑4抑制剂的化合物的制备方法,浙江省台州市临海市杜桥镇东海第五大道1号,317016
CN201510891176.5,20151204,CN105405915B,20170322,H01L31/101;H01L31/108;H01L31/0304;H01L31/18;,华南理工大学,李国强,一种InGaN基蓝光探测器及其制备方法,广东省广州市天河区五山路381号,510640
CN201510891442.4,20151207,CN105481870B,20170322,C07D491/107;C09K11/06;G01N21/64;,东南大学,钱鹰,一种吡啶乙烯基三苯胺‑罗丹明荧光分子PTRh及其制备方法和应用,江苏省南京市江宁区东南大学路2号,211189
CN201510891593.X,20141030,CN105415944B,20170322,B43L21/02;,杨文朔,杨文朔,一种减少粉尘污染的黑板擦,山东省济南市历下区南新街21号2号楼1单元503号,250012
CN201510892093.8,20151207,CN105482490B,20170322,C09B47/32;C09B67/48;,江苏双乐化工颜料有限公司,毛顺明,一种ε型酞菁蓝的制备方法和用途,江苏省泰州市兴化市张郭镇人民路2号,225722
CN201510893787.3,20151202,CN105361616B,20170322,A47G29/12;,闫鹏,闫鹏,一种智能家用快递接收箱,山东省济南市历城区二环东路999号,250000
CN201510895238.X,20151207,CN105380327B,20170322,A41H33/00;D05B37/04;,广东溢达纺织有限公司,侯伟,自动拆领机及其自动拆领方法,广东省佛山市沧江出口加工区,528500
CN201510895290.5,20151208,CN105328605B,20170322,B25B13/02;,国家电网公司,国网新源控股有限公司,一种可用于狭窄空间的内六角扳手,北京市西城区西长安街86号,100017
CN201510895425.8,20151207,CN105444614B,20170322,F41B6/00;,华南理工大学,李静,一种应用轨道炮轨道循环冷却系统和冷却方法,广东省广州市天河区五山路381号,510640
CN201510895614.5,20151207,CN105355485B,20170322,H01H11/00;,国网山东莒南县供电公司,国家电网公司,一种电力断路器弹簧拆卸装置及其使用方法,山东省临沂市莒南县天桥路16号,276600
CN201510896172.6,20151208,CN105348062B,20170322,C07C49/67;C07C49/697;C07C49/755;C07C45/45;,清华大学,席婵娟,3‑芳基‑1‑茚满酮衍生物的制备方法,北京市海淀区北京市信箱82分箱清华大学专利办公室,100084
CN201510896179.8,20151208,CN105364353B,20170322,B23K37/00;B23K37/02;B23K37/04;B23K37/047;,浙江兴益风机电器有限公司,余盛江,一种多翼式风机叶轮的自动化焊接设备,浙江省台州市温岭市泽国镇丹崖工业区,317522
CN201510896996.3,20151203,CN105438838B,20170322,B65G53/50;B65G53/16;,安徽耐力德气力输送有限公司,许晓慧,连续仓式气力输送泵,安徽省合肥市高新区望江西路535号,230088
CN201510897017.6,20151207,CN105298412B,20170322,E21B17/10;E21B17/00;,中国石油大学（华东）,刘秀全,一种防碰撞钻井隔水管横向约束装置,山东省青岛市山东青岛市黄岛区长江西路66号,266580
CN201510897614.9,20151207,CN105293225B,20170322,B66B1/06;B66B1/34;,中建三局集团有限公司,王辉,智能防过转定位装置及实施方法,湖北省武汉市洪山区珞狮南路248号,430064
CN201510897995.0,20151208,CN105342270B,20170322,A47G19/02;,浙江苏泊尔股份有限公司,陈德福,一种盛放碗,浙江省台州市玉环县大麦屿街道办事处,317604
CN201510898662.X,20151208,CN105367591B,20170322,C07F3/08;B01J31/22;C02F1/32;C02F101/38;,安阳师范学院,刘雷雷,一种具有催化光降解亚甲基蓝的镉配合物单晶及其制备方法,河南省安阳市弦歌大道436号,455000
CN201510900085.3,20151208,CN105294689B,20170322,C07D471/04;A61P35/00;A61P5/50;A61P31/00;,湖南科技大学,赵云辉,一种四取代吡唑并异喹啉化合物及其合成方法,湖南省湘潭市雨湖区石码头2号,411201
CN201510900131.X,20151208,CN105328730B,20170322,B26D5/16;B26D7/02;,秦涛,秦涛,一种快速省力的打花器的刀公下压机构,湖北省黄石市大冶市金湖办事处有色铜录山矿工人村6-2-5,435100
CN201510900305.2,20151208,CN105434233B,20170322,A61K8/9789;A61K8/49;A61Q19/00;,广州市花安堂生物科技有限公司,何廷刚,一种角质修护精华露,广东省广州市番禺区化龙镇柳围街13号(1号厂房),511434
CN201510900976.9,20151208,CN105506325B,20170322,C22C1/03;C22C9/00;,东北大学,佟伟平,CuCr或CuFe合金的原位合成制备方法,辽宁省沈阳市和平区文化路3号巷11号,110819
CN201510901155.7,20151208,CN105386803B,20170322,F01K27/02;F01K25/00;F01D15/10;F01D17/10;F01D25/20;,中船重工重庆智能装备工程设计有限公司,冀庆康,一种气液混合回收的低品质余热发电系统及控制方法,重庆市北部新区龙睛路9号（复城国际11-1）,401122
CN201510901344.4,20151209,CN105364308B,20170322,B23K26/14;,重庆镭宝激光智能机器人制造有限公司,祝源成,激光切割机器人聚焦镜的冷却装置,重庆市渝北区空港工业园区朗月路标准厂房1单元,401120
CN201510902014.7,20151208,CN105416588B,20170322,B64D1/18;B64C39/02;,广州极飞科技有限公司,何建兵,无人机的喷洒模组和无人机,广东省广州市天河区思成路1号3A01,510000
CN201510903434.7,20151209,CN105463291B,20170322,C22C30/04;C22C38/16;C22C38/10;C22C38/08;C22C38/18;C22C38/12;C22C38/14;C22C38/04;B22F1/02;B22F9/08;B22F9/22;,博深工具股份有限公司,李忠林,全预合金化粉末及其制备方法,河北省石家庄市高新区海河道10号,050035
CN201510909678.6,20151208,CN105428457B,20170322,H01L31/18;,中国电子科技集团公司第十八研究所,王胜利,一种工业化沉积CIGS太阳电池吸收层的方法及设备,天津市西青区海泰工业园华科七路6号,300384
CN201510909880.9,20151231,CN105424858B,20170322,G01N30/88;,广州甘蔗糖业研究所,高裕锋,乳粉中低聚半乳糖的高效液相色谱串联质谱检测方法,广东省广州市海珠区石榴岗10号大院广州甘蔗糖业研究所东区,510316
CN201510911633.2,20151211,CN105397383B,20170322,B23K37/047;,安徽合力股份有限公司,田星亮,一种用于焊接槽钢筋板的翻转平台机,安徽省合肥市经开区卧云路163号,230601
CN201510911931.1,20151211,CN105345724B,20170322,B25B27/00;,柳州市七彩阳光安全玻璃有限公司,梁晨峰,车窗玻璃密封胶条拆卸装置,广西壮族自治区柳州市鱼峰区新柳大道3号之一,545616
CN201510912529.5,20151211,CN105414869B,20170322,B23K37/053;B23K101/10;,山东三土能源股份有限公司,安斌,一种架空管道焊接辅助设备,山东省荣成市青山东路88号,264300
CN201510912947.4,20151211,CN105383523B,20170322,B61L27/00;,天津七一二通信广播股份有限公司,王晓强,一种铁路数字平面调车远程控制系统的控制方法,天津市滨海新区经济技术开发区西区北大街141号,300462
CN201510914044.X,20151212,CN105361415B,20170322,A46D3/00;,娄建明,娄建明,自动扫帚制造机,浙江省湖州市南浔区菱湖镇油车潭55号,313000
CN201510914445.5,20151213,CN105342226B,20170322,A47G1/08;,苏州市启扬商贸有限公司,姚多妹,安装位置可调整的画框,江苏省苏州市吴中区东吴北路19号,215128
CN201510915117.7,20151214,CN105502521B,20170322,H01M4/525;C01G53/00;,山东精工电子科技有限公司,关成善,一种基于调控核生长机制制备球型镍钴铝酸锂前驱体的方法,山东省枣庄市高新区泰国工业园复元五路319号山东精工电子科技有限公司,277000
CN201510915613.2,20151210,CN105391019B,20170322,H02G7/14;,广东电网有限责任公司电力科学研究院,谢文平,一种输电线路微风振动宽频段抑制防振金具,广东省广州市越秀区东风东路水均岗8号,510080
CN201510915710.1,20151211,CN105489678B,20170322,H01L31/048;H01L31/18;,奥特斯维能源（太仓）有限公司,丁常林,一种优化光伏组件封装损失的方法,江苏省苏州市太仓港港口开发区平江路88号,215434
CN201510915724.3,20151210,CN105328710B,20170322,B25J15/10;B25J9/12;,江苏三工建材科技有限公司,毛中强,一种基于钢丝传动的多自由度机械手,江苏省常州市新北区春江镇安西路31号,213126
CN201510916182.1,20151210,CN105544382B,20170322,E01D19/02;E01D21/00;E02D19/04;E01D101/26;,中铁大桥局集团有限公司,赵小静,一种哑铃型承台的施工方法,湖北省武汉市汉阳区汉阳大道38号,430050
CN201510917553.8,20151211,CN105345334B,20170322,B23K37/00;,贵州黎阳航空动力有限公司,马永锋,一种焊接降温装置,贵州省安顺市平坝县白云镇,561102
CN201510918203.3,20151209,CN105345700B,20170322,B25B11/00;,安徽爱乐门窗系统工程有限公司,王双民,一种实木地球仪的半球定型夹具及其应用于半球定位的方法,安徽省宿州市埇桥区城东循环经济示范园仁和路188号,234000
CN201510918354.9,20151210,CN105544414B,20170322,E01D22/00;E01D19/16;E01D11/04;,中交第二航务工程局有限公司,张永涛,基于无应力索长的斜拉索更换方法,湖北省武汉市东西湖区金银湖路11号,430048
CN201510918581.1,20151210,CN105599534B,20170322,B44D7/00;C08L71/08;C08K3/22;,陕西师范大学,李玉虎,一种酥粉壁画加固保护剂及其制备和加固方法,陕西省西安市长安南路199号,710062
CN201510919611.0,20151211,CN105386669B,20170322,E05D15/06;E06B3/46;E06B7/32;,黎明钢构股份有限公司,不公告发明人,一种上挂式滑轨推拉门,湖北省孝感市汉川市北桥科技工业园霍城大道169号,431600
CN201510920241.2,20151211,CN105345876B,20170322,B26D7/10;B26D7/18;,浙江汉高机械有限公司,郑立峰,自动薄膜切割成型设备,浙江省温州市瑞安市锦湖街道第一桥村清波工业区10-11号,325000
CN201510920420.6,20151211,CN105401527B,20170322,E01D21/00;,中交一公局第三工程有限公司,顾跃强,猫道锚固的施工方法以及猫道锚固装置,北京市通州区中关村科技园区通州园金桥科技产业基地景盛北三街10号,101100
CN201510920943.0,20151214,CN105345837B,20170322,B25J15/08;B25J9/12;,东南大学,崔建伟,一种异构式机器人手控器四自由度手部转动装置,江苏省南京市江宁区东南大学路2号,211189
CN201510921296.5,20151214,CN105346129B,20170322,B30B1/42;B30B1/32;,董中天,董中天,磁场等静压机,山西省太原市尖草坪区阳曲镇广立工业园区北区11号,030008
CN201510922313.7,20151214,CN105443029B,20170322,E06C7/00;E06C7/44;E06C7/46;,国家电网公司,国网河北省电力公司沧州供电分公司,使用可靠的绝缘梯,北京市西城区西长安街86号,100031
CN201510922644.0,20151214,CN105423826B,20170322,F41H11/12;,山西江阳兴安民爆器材有限公司,王高宏,扫雷专用拒爆筒,山西省太原市尖草坪区西留路18号江阳科技园,030041
CN201510922995.1,20151211,CN105546689B,20170322,F24F5/00;F24F11/00;,诸暨市兴阳机电设备有限公司,章新江,一种监房全自动蒸发式降温换气机,浙江省绍兴市诸暨市陶朱街道丰兴村丰木117号,311800
CN201510923207.0,20151210,CN105382469B,20170322,B23K37/04;,安徽大昌科技股份有限公司,钱炳南,双向夹持工装,安徽省芜湖市鸠江区飞翔路19号,241000
CN201510924481.X,20151214,CN105353064B,20170322,G01N30/86;G01N30/06;,山东凯盛新材料股份有限公司,张乐,辛酰氯的气相色谱检测方法,山东省淄博市淄川区双杨镇,255190
CN201510925657.3,20151214,CN105530607B,20170322,H04W4/02;G06F17/30;G06Q50/00;H04L12/58;H04M1/725;,腾讯科技（深圳）有限公司,黎凯锋,用户推荐方法、装置和系统,广东省深圳市福田区振兴路赛格科技园2栋东403室,518000
CN201510925850.7,20151209,CN105364381B,20170322,B23K37/04;,安徽江淮汽车集团股份有限公司,杜坤,一种翼子板装配样架,安徽省合肥市桃花工业园始信路669号,230601
CN201510925870.4,20151211,CN105314663B,20170322,C01F7/02;,东北大学设计研究院（有限公司）,左一,一种氧化铝厂赤泥堆场回水的回收利用装置及其使用方法,辽宁省沈阳市和平区安图街8号,110013
CN201510927079.7,20151214,CN105437141B,20170322,B25B27/02;B25B11/00;,上海人本集团有限公司,上海思博特轴承技术研发有限公司,基于螺旋测试机架的满装圆柱滚子轴承分解方法,上海市奉贤区奉城镇高桥村,201400
CN201510927338.6,20151214,CN105545062B,20170322,E04H12/12;E04G23/02;,广东电网有限责任公司电力科学研究院,东南大学,一种缠绕纤维束纱加固混凝土变电构架的实施方法,广东省广州市越秀区东风东路水均岗8号,510080
CN201510927510.8,20151214,CN105417570B,20170322,C01G1/02;C01F7/02;C01G53/04;C01G9/02;C01G51/04;C01G3/02;C01G45/02;C01G49/08;C01G15/00;,西南化工研究设计院有限公司,程金燮,共沉淀‑均质‑喷雾干燥制备尖晶石型复合氧化物的方法,四川省成都市高新区高朋大道5号,610225
CN201510927590.7,20151214,CN105544397B,20170322,E01D21/00;E01D19/02;E01D101/24;,中交一公局第三工程有限公司,宾熊,混凝土高墩施工模板装置,北京市通州区中关村科技园区通州园金桥科技产业基地景盛北三街10号,101100
CN201510927597.9,20151214,CN105386410B,20170322,E01D21/00;E01D19/14;,中交一公局第三工程有限公司,杨世好,一种散索鞍姿态调整和转运平车,北京市通州区中关村科技园区通州园金桥科技产业基地景盛北三街10号,101100
CN201510928130.6,20151215,CN105415925B,20170322,B43K8/02;,项城市汝阳刘笔业有限公司,刘好勤,中、小学生专用毛笔,河南省周口市项城市孙店汝阳刘村,466200
CN201510930297.6,20151211,CN105461716B,20170322,C07D471/04;C07C51/41;C07C59/245;A01N43/90;A61K31/437;A61P37/02;A61P29/00;A61P19/02;A01P1/00;G01N33/68;,南开大学,汪清民,NK007的两个光学纯异构体及其合成和应用,天津市南开区卫津路94号,300071
CN201510934793.9,20151215,CN105396347B,20170322,B01D29/03;B01D29/50;,志峰（北京）环境科技集团有限公司,邵志元,雨水排放处理装置,北京市通州区潞城镇武兴路7号,101107
CN201510935912.2,20151215,CN105372919B,20170322,G03B21/54;,重庆触视科技有限公司,任博,便于角度调节的投影仪,重庆市江北区嘉陵一村41号1幢16-5,400020
CN201510937040.3,20151216,CN105345811B,20170322,B25J9/00;,河南理工大学,陈国强,工作空间可调的加强型三自由度并联机构,河南省焦作市高新区世纪路2001号河南理工大学机械与动力工程学院,454000
CN201510937351.X,20151215,CN105460964B,20170322,C01F7/42;C01B3/08;,湖北工业大学,王辉虎,一种纳米羟基氧化铝粉体的制备方法,湖北省武汉市洪山区李家墩特1号,430068
CN201510937427.9,20151215,CN105405911B,20170322,H01L31/08;H01L31/028;,武汉邮电科学研究院,王磊,基于片上模式变换器的硅锗光电探测装置,湖北省武汉市洪山区邮科院路88号,430074
CN201510938356.4,20151215,CN105421249B,20170322,E01D21/10;,中铁十四局集团第二工程有限公司,刘小果,一种拖吊结合式挂篮结构及施工方法,山东省泰安市东岳大街西首,271021
CN201510938738.7,20151215,CN105569479B,20170322,E05D5/04;E05D11/00;E05F5/06;,张政阳,张政阳,电磁线性阻尼铰链及相应门窗装置,北京市海淀区北蜂窝中路丙8号院1号楼4单元1002室,100038
CN201510938777.7,20151216,CN105365053B,20170322,B28D1/00;B28D1/08;B28D7/04;B65G47/82;,苏金溢,苏金溢,全自动多功能整套石材加工设备及加工方法,福建省泉州市晋江市安海镇梧山工业区6号,362261
CN201510939128.9,20151215,CN105486180B,20170322,F42C21/00;F42C13/02;,西安电子科技大学,曹运华,基于波束分解和局部照射的激光引信近场回波功率计算方法,陕西省西安市雁塔区太白南路2号,710071
CN201510939146.7,20151214,CN105501253B,20170322,B61L23/00;,辽宁工程技术大学,金钰博,一种自动行车测试装置,辽宁阜新中华路47#,123000
CN201510939720.9,20151216,CN105421916B,20170322,E05D1/04;,广州米格办公家具有限公司,李俊琴,一种稳定柜门螺扣结构,广东省广州市天河区科韵北路102号101,510000
CN201510940966.8,20151216,CN105370118B,20170322,E05C17/56;,中山市联鑫家具有限公司,刘仁超,一种柜门软扣结构,广东省中山市南朗镇第一工业区美倡厂内B栋厂房,528400
CN201510941118.9,20151215,CN105390199B,20170322,H01B7/282;H01B7/29;H01B13/26;,江苏上上电缆集团有限公司,周云峰,一种柔性防火电缆及制造方法,江苏省常州市溧阳市溧城镇上上路68号,213399
CN201510941327.3,20151216,CN105502485B,20170322,C01G23/053;,江南大学,姚伯龙,一种吸附相反应制备空心二氧化钛微球的方法,江苏省无锡市滨湖区蠡湖大道1800号,214122
CN201510941914.2,20151216,CN105536592B,20170322,B01F7/04;B02C18/14;,蓝深集团股份有限公司,南京合工流体科技有限公司,一种带切割功能的高效永磁潜水搅拌机,江苏省南京市六合区雄州东路305号,211500
CN201510942250.1,20151216,CN105398474B,20170322,B61L23/00;B61H7/02;,郑州北斗七星通讯科技有限公司,魏银库,一种北斗智能铁路防溜铁鞋实时监控可视化管理系统,河南省郑州市高新区长椿路11号Y06幢1单元3层2号,450001
CN201510943576.6,20151214,CN105421158B,20170322,E01B1/00;,天津铁路信号有限责任公司,寇建设,一种带有钢制挡肩承轨槽的车辆减速器基础,天津市东丽区驯海路1199号,300300
