CN201510944822.X,20151216,CN105371708B,20170322,F42B4/30;B65G47/08;,江西佳联科技有限公司,陈运萍,烟花内筒生产线,江西省萍乡市上栗县赤山工业园内,337004
CN201510945316.2,20151215,CN105397808B,20170322,B25J9/12;,南开大学,刘景泰,基于压簧的线性串联弹性驱动器,天津市南开区卫津路94号,300071
CN201510945757.2,20151216,CN105547058B,20170322,F42B35/00;,哈尔滨工业大学,王聪,一种基于动量定理的弹托分离系统,黑龙江省哈尔滨市南岗区西大直街92号,150001
CN201510946929.8,20151217,CN105386698B,20170322,E06B3/70;E06B7/28;E05F15/614;,深圳马顿科技有限公司,汪世鹏,变形门,广东省深圳市南山区高新技术产业园南区R1-A栋1楼A08单位,518000
CN201510948195.7,20151217,CN105436758B,20170322,B23K37/00;B23K37/04;B23K37/047;,郑州市嵩阳煤机制造有限公司,弋现生,中部槽专用自动组焊机床,河南省郑州市登封市产业集聚区玉京大道与禹都大街交叉口,452470
CN201510948315.3,20151217,CN105401550B,20170322,E01H1/10;,湖北合加环境设备有限公司,胡新灵,一种洗扫车的变容结构垃圾箱,湖北省咸宁市经济开发区长江产业园238号,437100
CN201510950063.8,20151218,CN105502492B,20170322,C01G25/02;,景德镇陶瓷大学,冯果,一种非水沉淀法制备稳定氧化锆超细粉体的方法,江西省景德镇市珠山区新厂陶阳路27号,333001
CN201510950735.5,20151219,CN105371219B,20170322,F21S9/02;F21S9/04;F21V17/12;F21V31/00;F21V23/04;,宁波育利电器有限公司,徐教育,节能指示灯,浙江省宁波市宁海县桃源街道金山路30号,315600
CN201510950889.4,20151219,CN105386460B,20170322,E02D29/045;E03F3/04;E03F7/02;E03F7/04;E03F5/02;E02D31/08;,赵学坤,赵学坤,一种城市地下智能综合管廊,山东省菏泽市单县北外环路2号,274300
CN201510951901.3,20151217,CN105345743B,20170322,B25B27/18;,江苏天赋新能源工程技术有限公司,金明,一种风力发电机端盖断螺栓拆卸装置,江苏省南通市南通经济技术开发区广州路42号505室,226000
CN201510952520.7,20151217,CN105372036B,20170322,G01M9/06;,西北工业大学,梁少然,多自由度天平校准装置以及天平校准方法,陕西省西安市友谊西路127号,710072
CN201510953427.8,20151217,CN105442397B,20170322,E01B27/06;,南车戚墅堰机车车辆工艺研究所有限公司,张海锋,一种清筛机挖掘链,江苏省常州市戚墅堰区五一路258号,213011
CN201510956175.4,20151217,CN105398978B,20170322,B66C23/62;,太原重工股份有限公司,贾勇,双缸头穿销装置,山西省太原市万柏林区玉河街53号,030024
CN201510956720.X,20151217,CN105503864B,20170322,C07D471/04;,江苏阿尔法药业有限公司,漆志文,莫西沙星中间体的制备方法,江苏省宿迁市生态化工科技产业园燕山路9号,223800
CN201510956796.2,20151217,CN105576068B,20170322,H01L31/0735;H01L31/0725;,中国电子科技集团公司第十八研究所,张恒,一种双面生长的InP五结太阳电池,天津市西青区海泰工业园华科七路6号,300384
CN201510957016.6,20151218,CN105443424B,20170322,F04D27/00;,南京南瑞继保电气有限公司,南京南瑞继保工程技术有限公司,一种逆变器散热风扇的控制装置及控制方法,江苏省南京市江宁区苏源大道69号,211102
CN201510957311.1,20151216,CN105502519B,20170322,C01G51/04;,安徽建筑大学,胡寒梅,二维超大薄的荷叶状氧化镍纳米材料及其制备方法,安徽省合肥市紫云路292号,230601
CN201510957454.2,20151218,CN105382881B,20170322,B26F1/02;B26D7/18;B26D7/26;,青岛农业大学,马泽芳,对流免疫电泳琼脂板打孔器,山东省青岛市城阳区长城路700号(青岛农业大学动物科技学院),266109
CN201510962378.4,20151217,CN105448381B,20170322,H01B1/02;H01B7/20;H01B7/17;,重庆凯顺机械有限公司,万平,一种机械设备抗拉伸金属线芯,重庆市合川区南办处堰口村4社,401521
CN201510963287.2,20151221,CN105418611B,20170322,C07D471/16;,浙江大学,顾昊睿,一种四氢苯并吡咯并吡嗪并异喹啉衍生物的制备方法,浙江省杭州市西湖区浙大路38号,310027
CN201510966032.1,20151222,CN105435546B,20170322,B01D46/02;B01D46/18;,北京巨维通科技有限公司,关玉梅,一种带有防跑偏过滤布的室外雾霾过滤器,山东省枣庄市高新区泰国工业园复元五路海特电子集团转,277800
CN201510966062.2,20151222,CN105458458B,20170322,G01K11/32;B23K9/095;B23K9/127;,吉林大学,徐国成,基于异型红外光纤束的非平面焊缝温度场监测方法,吉林省长春市前进大街2699号,130012
CN201510966155.5,20151222,CN105437385B,20170322,B28D1/22;B26D3/06;,刘超,刘超,一种便携式开沟槽设备,辽宁省沈阳市铁西区腾飞二街22-2号1-3-2,110072
CN201510966170.X,20151222,CN105345816B,20170322,B25J9/12;B25J15/08;,金华知产婺源信息技术有限公司,刘金,一种基于齿轮传动的多自由度机械手,浙江省金华市婺城区西关街道董宅社区董康巷6号203室,321000
CN201510967437.7,20151222,CN105428325B,20170322,H01L23/28;H01L23/13;H01L21/56;,苏州日月新半导体有限公司,郭桂冠,一种带金属屏蔽层的单层超薄基板封装结构的制备工艺及其制品,江苏省苏州市工业园区苏虹西路188号,215021
CN201510967448.5,20131126,CN105479004B,20170322,B23K26/24;B23K26/70;,天津大学,申俊琦,激光填丝焊焊丝校准装置的使用方法,天津市南开区卫津路92号,300072
CN201510967677.7,20151221,CN105588476B,20170322,F41H5/08;,无畏警用装备有限公司,倪峻峰,盾牌折叠机构,江苏省泰州市靖江市无畏路1号,214500
CN201510968014.7,20151222,CN105405916B,20170322,H01L31/105;H01L31/0216;H01L31/18;,中国科学院半导体研究所,刘智,硅基宽光谱探测器及制备方法,北京市海淀区清华东路甲35号,100083
CN201510968043.3,20151221,CN105391293B,20170322,H02M1/36;H02J3/36;,中国西电电气股份有限公司,苟锐锋,一种模块化多电平柔性直流输电换流器启动方法,陕西省西安市唐兴路7号,710075
CN201510969202.1,20151218,CN105536281B,20170322,B01D5/00;E03B3/28;,曹可欣,曹可欣,用于淡水收集设备上的空气凝水装置,天津市河北区榆关道胜景花园11号楼2门601号,300134
CN201510969576.3,20151222,CN105366727B,20170322,C01G39/06;B82Y40/00;,镇江市高等专科学校,唐国钢,二硫化钼花状纳米棒的制备方法,江苏省镇江市京口区学府路61号,212003
CN201510970287.5,20151222,CN105507157B,20170322,E01D21/00;E01D101/26;,深圳市福田建安建设集团有限公司,吴金兴,变曲率环形劲芯现浇混凝土梁施工方法,广东省深圳市福田区新洲南路沙尾工业区金享投资公司1栋厂房6楼北面604,518048
CN201510972009.3,20151218,CN105387774B,20170322,F42C19/12;F42C15/00;,安徽理工大学,邢化岛,一种安全电引火药头,安徽省淮南市舜耕中路168号,232001
CN201510972067.6,20151222,CN105559480B,20170322,A47G19/22;A01N59/16;A01P1/00;,王显祺,唐艺峰,一种抑菌不锈钢杯子的制备方法,广东省佛山市南海区桂城东怡花园E区1座3008,528200
CN201510972217.3,20140804,CN105411520B,20170322,A61B1/32;,河南科技大学第一附属医院,樊冬梅,带有锁定机构的医用妇科检查器,河南省洛阳市涧西区景华路24号,471000
CN201510972657.9,20151223,CN105559328B,20170322,A46B11/00;A46B7/04;A46B5/00;,温州市洞头北岙晟立机械设计工作室,吴梓渟,双摆转锁扣连接分体氮化硅水杯牙刷,浙江省温州市洞头区北岙街道凝香路1号电子电器科技园A1幢第五层515室,325700
CN201510973126.1,20151223,CN105398956B,20170322,B66C13/06;B66C15/02;,无锡信大气象传感网科技有限公司,禹胜林,一种钢板起吊系统,江苏省无锡市无锡国家高新技术产业开发区菱湖大道97号创新研发楼二期南楼101室,214135
CN201510975434.8,20151222,CN105353065B,20170322,G01N30/86;G01N30/06;,黑龙江大学,刘丽娟,一种荔枝核的高效液相色谱指纹图谱的建立方法,黑龙江省哈尔滨市南岗区学府路74号,150080
CN201510975667.8,20151222,CN105466186B,20170322,F26B15/00;F26B21/00;F26B25/00;,长庆石油勘探局技术监测中心,裴润有,碳纤维气瓶水压辅助测试装置及测试方法,陕西省西安市经开区凤和路长庆技术监测中心,710018
CN201510976233.X,20151222,CN105433687B,20170322,A47G9/10;,安徽三宝棉纺针织投资有限公司,马晓飞,一种内置药包的枕头,安徽省阜阳市界首市工业园区,236500
CN201510976893.8,20151223,CN105446407B,20170322,G05F1/56;,深圳市中孚能电气设备有限公司,丁柏平,一种电子器件的供电电路,广东省深圳市龙岗区龙城街道爱联社区嶂背村嶂背大道9号一楼、四楼,518000
CN201510977332.X,20151223,CN105418612B,20170322,C07D473/08;C07D317/16;,北京颐方生物科技有限公司,王姣,一种多索茶碱的制备方法,北京市石景山区实兴大街30号院3号楼2层A-1078房间,100040
CN201510978184.3,20151223,CN105423835B,20170322,F42D3/04;F42D1/00;,内蒙古包钢钢联股份有限公司,闫永富,一种炮孔布孔仪,内蒙古自治区包头市昆区河西工业区,014000
CN201510978299.2,20151223,CN105364928B,20170322,B25J9/22;B23K37/02;,宁波市智能制造产业研究院,仵浩,一种离线编程系统,浙江省宁波市余姚市经济开发区城东新区,315400
CN201510978509.8,20151224,CN105401864B,20170322,E06B9/01;B23P15/00;,石礼华,石礼华,一种防盗网包边型材,安徽省安庆市宿松县长铺镇长铺社区灯上组29号,246500
CN201510980298.1,20151224,CN105455403B,20170322,A46B5/00;A46B17/04;,宁波市江北怡和健康管理有限公司,陈欢,一种防止刷毛压弯的刷头与刷盖配合结构,浙江省宁波市江北区人民路673号,315020
CN201510980300.5,20151224,CN105559333B,20170322,A46B17/04;A46B5/00;,宁波市江北怡和健康管理有限公司,陈欢,一种改进型刷头与刷盖的配合结构,浙江省宁波市江北区人民路673号,315020
CN201510980619.8,20151223,CN105437289B,20170322,B26D1/10;B26D7/32;B26D7/27;B26D7/08;B26D5/00;,青岛海诺机械制造有限公司,董少君,一种全自动切管机,山东省青岛市四方区重庆南路81号甲,266000
CN201510980681.7,20151223,CN105397805B,20170322,B25J9/08;B25J15/00;F16C33/12;F16C33/66;,江苏久信医疗科技有限公司,房志刚,一种远程运动中心机构,江苏省常州市新北区汉江路103号,213000
CN201510980728.X,20151223,CN105421577B,20170322,E03F5/14;E03F5/16;,山东大学,张炯,一种初期雨水处理系统,山东省济南市历下区经十路17923号,250061
CN201510981650.3,20151223,CN105382845B,20170322,B25J15/04;,北京控制工程研究所,周元子,一种空间机械臂末端工具更换装置及更换方法,北京市海淀区北京2729信箱,100080
CN201510981718.8,20151224,CN105382849B,20170322,B25J15/08;,深圳市永霖科技有限公司,何莹,一种基于电磁驱动的仿真机械手指,广东省深圳市龙华新区龙华街道维雅德酒店商务办公18K,518000
CN201510981719.2,20151224,CN105382844B,20170322,B25J15/02;,佛山市天帆数控科技有限公司,李玉燕,一种基于时序控制的多自由度机械手,广东省佛山市南海区桂城夏东工业区,528000
CN201510982313.6,20151224,CN105388955B,20170322,G05F1/569;,上海奉天电子股份有限公司,彭雄飞,用于汽车启停系统的大功率高可靠电压保持器,上海市嘉定区恒永路518弄1号B区501-1,201800
CN201510982679.3,20151224,CN105606224B,20170322,G01J5/00;,华中科技大学,张天序,一种基于水体分层滤波的水下热源探测定位方法,湖北省武汉市洪山区珞喻路1037号,430074
CN201510984336.0,20151225,CN105415951B,20170322,B43M99/00;B43K13/02;,宁波丰德科技信息咨询有限公司,陈欢,一种能自动清洗毛笔的笔筒,浙江省宁波市江北区环城北路455号,315020
CN201510984345.X,20151225,CN105415928B,20170322,B43K13/02;B43M99/00;,宁波丰德科技信息咨询有限公司,陈欢,一种毛笔笔筒,浙江省宁波市江北区环城北路455号,315020
CN201510988089.1,20151225,CN105482425B,20170322,C08L69/00;C08L55/02;C08K13/02;C08K3/16;C08K3/08;C08K3/28;,金发科技股份有限公司,艾军伟,一种聚碳酸酯复合材料,广东省广州市高新技术产业开发区科学城科丰路33号,510663
CN201510989053.5,20151224,CN105459702B,20170322,B43L25/04;,青岛橡胶谷知识产权有限公司,李峰,一种便于吸取墨水的墨水瓶,山东省青岛市市北区郑州路43号A栋130室,266045
CN201510989198.5,20151228,CN105572750B,20170322,G01V3/11;,深圳市澳亚迪电子设备有限公司,王兰,一种自平衡降噪金属探测双线圈,广东省深圳市宝安区观澜街道富坑社区大富工业区华创达科技园1栋五楼西区,518000
CN201510992161.8,20151223,CN105599042B,20170322,B26D7/24;B26D7/22;,诺斯贝尔化妆品股份有限公司,张传营,一种纸巾甩切圆盘刀片切割装置,广东省中山市南头镇东福北路50号,528427
CN201510992961.X,20151225,CN105382419B,20170322,B41J2/435;B23K26/362;B23K26/046;,苏州智合源电子科技有限公司,胡锟,一种在线式全自动激光打标机激光升降座,江苏省苏州市吴中区木渎镇金桥工业园木胥东路39号10幢,215104
CN201510993235.X,20151224,CN105444164B,20170322,F23C99/00;F23Q7/00;,韩汶冀,韩汶冀,一种燃烧装置,新疆维吾尔自治区乌鲁木齐市克拉玛依西路1096号塞外江南小区3-2-1102,830000
CN201510993873.1,20151228,CN105427969B,20170322,H01B17/14;H01B19/00;,南京电气高压套管有限公司,孙闻峰,真空胶浸纤维空心注膏支柱绝缘子,江苏省南京市经济技术开发区仙新中路2号,210046
CN201510995208.6,20151228,CN105457207B,20170322,A62C31/28;,郑州航空工业管理学院,禹建丽,超高层建筑专用超大型复合消防灭火装备,河南省郑州市二七区大学中路2号,450000
CN201510995365.7,20151228,CN105427956B,20170322,H01B13/00;,上海科润光电技术有限公司,郭素文,一种带有荧光的纳米银线透明导电液制备方法,上海市闵行区马桥镇富砾路259弄31号,201111
CN201510995578.X,20151223,CN105541958B,20170322,C07J71/00;,湖北民族学院,董静洲,一种薯蓣皂苷次级苷的工业化生产方法,湖北省恩施土家族苗族自治州学院路39号,445000
CN201510995827.5,20151225,CN105421254B,20170322,E01D22/00;E01D19/04;,北京市政建设集团有限责任公司,王松,一种轨道交通桥梁支座上垫石原位修复方法及垫石模板,北京市朝阳区三台山路5号市政一处,100176
CN201510996426.1,20151225,CN105442393B,20170322,E01B19/00;,曹秋林,曹秋林,一种铁轨消音减震装置,湖南省长沙市长沙县黄花镇人民政府,410000
CN201510997103.4,20151223,CN105479530B,20170322,B26D7/01;B26D7/02;B23D47/04;,佛山欧亚特机械设备有限公司,罗贵兴,一种分离式靠料板结构,广东省佛山市南海区狮山兴贤长虹岭二期开发区兴虹路（明益包装材料有限公司内）,528225
CN201510997661.0,20151226,CN105442487B,20170322,E01H5/12;,周逸宇,杨永敏,一种路面压实冰雪层剁切机,河北省承德市滦平县交通运输局,068250
CN201510997961.9,20151227,CN105600807B,20170322,C01D3/06;,北京化工大学,杨文胜,一种从高镁锂比盐水中电化学提取锂盐的方法,北京市朝阳区北三环东路15号,100029
CN201510998567.7,20151224,CN105459207B,20170322,B26F1/38;B26D7/27;B08B7/00;,珠海双赢柔软电路有限公司,王建珂,自动贴合系统,广东省珠海市斗门区新青科技工业园新青工业区三号厂房,519180
CN201510998789.9,20151228,CN105484603B,20170322,E05F15/70;E05F15/77;E05F15/632;E05F15/47;E06B7/28;H04N7/18;,沈阳宝通航空机电有限公司,方汉伟,一种全方位影像监控的机库大门,辽宁省沈阳市浑南新区世纪路7号,110189
CN201510998840.6,20151228,CN105418714B,20170322,C07J9/00;,成都市新功生物科技有限公司,张秀芳,一种光化学法用鹅去氧胆酸合成熊去氧胆酸的方法,四川省成都市青羊区过街楼街17号1栋3单元6层610号,610000
CN201510999019.6,20151224,CN105405535B,20170322,H01B13/00;,铜陵精迅特种漆包线有限责任公司,周俊,可调整线冷却通道,安徽省铜陵市经济技术开发区泰山大道铜陵精迅特种漆包线有限责任公司,244061
CN201510999292.9,20151226,CN105420607B,20170322,C22C38/14;C22C38/06;C22C38/04;C21D8/02;C21D1/26;,首钢总公司,杨建炜,提高冷轧汽车板可涂装性能表面质量的控制方法,北京市石景山区石景山路68号,100041
CN201510999363.5,20121227,CN105584224B,20170322,B41J2/175;B41J2/01;B41J29/393;,珠海纳思达企业管理有限公司,钦雷,墨盒的发光控制方法、单元、电路板、墨盒及成像设备,广东省珠海市珠海大道3883号1栋5楼A,519060
CN201510999477.X,20151228,CN105484604B,20170322,E05F15/70;E05F15/73;E05F17/00;H04N7/18;,沈阳宝通航空机电有限公司,方汉伟,一种机库大门控制系统及方法,辽宁省沈阳市浑南新区世纪路7号,110189
CN201510999890.6,20151228,CN105548564B,20170322,G01N33/68;,青岛古高生物科技有限公司,王华,原花青素的应用及含原花青素的纤维蛋白原测定试剂,山东省青岛市高新区河东路368号蓝色生物医药产业园6号楼1层101、102室,266000
CN201511000634.8,20151229,CN105712388B,20170322,C01F11/18;C01D9/12;C05G1/00;C09K17/02;C09K109/00;,湖北新洋丰肥业股份有限公司,郑润,一种硝基复合肥联产工业硝酸钾的方法,湖北省荆门市东宝区石桥驿镇,448150
CN201511000655.X,20151224,CN105380359B,20170322,A44C5/00;A44C5/02;,东莞美景实业有限公司,游志聪,手镯,广东省东莞市塘厦镇石豉村塘天南路33号,523729
CN201511001784.0,20151229,CN105414261B,20170322,B21D3/14;B21D43/00;B21D43/02;,李传聪,李传聪,自动校圆机,安徽省六安市经济技术开发区皋城东路东三路口,237000
CN201511004111.0,20151228,CN105467086B,20170322,G01N33/00;,国网山东省电力公司电力科学研究院,国家电网公司,一种测量电站锅炉烟气量的方法,山东省济南市市中区望岳路2000号,250002
CN201511004835.5,20151228,CN105479070B,20170322,B23K37/04;B23K28/02;,深圳出入境检验检疫局工业品检测技术中心,鹿文军,一种双工位方钢管自动焊接装置,广东省深圳市南山区蛇口工业八路289号,518067
CN201511007097.X,20140725,CN105600529B,20170322,B65H5/08;B65H5/14;A43D117/00;,黑金刚（福建）自动化科技股份公司,阙小鸿,一种网布型鞋面裁片的单气缸自动传送工艺,福建省泉州市经济技术开发区兴泰路23号,362000
CN201511007658.6,20151228,CN105382411B,20170322,B23K26/062;B23K26/26;B23K26/60;B23K26/082;,哈尔滨工业大学,陶汪,一种T型接头双侧激光扫描焊接方法,黑龙江省哈尔滨市南岗区西大直街92号,150001
CN201511008297.7,20151229,CN105415364B,20170322,B25J9/10;B25J17/00;,苏州卓德电子有限公司,陈艺峰,一种机械手臂移动关节水平调节装置,江苏省苏州市吴中区木渎镇金山路47号,215000
CN201511008396.5,20151229,CN105571415B,20170322,F42D1/00;F42D1/08;F42D3/04;,重庆大学,杨海清,一种公路隧道裂隙岩体光面爆破精细化控制方法,重庆市沙坪坝区沙正街174号,400044
CN201511008834.8,20151226,CN105553009B,20170322,H02J7/00;,惠州市蓝微新源技术有限公司,徐文赋,开关阵列快速均衡电池组的均衡电路及控制方法,广东省惠州市仲恺高新区和畅五路西101号,516006
CN201511009253.6,20151230,CN105420895B,20170322,D03D47/30;,吴江万工机电设备有限公司,周玉峰,一种筘槽内核心气流测量装置,江苏省苏州市吴江区横扇镇菀坪开发路,215223
CN201511009320.4,20151229,CN105445868B,20170322,G02B6/38;,深圳日海通讯技术股份有限公司,王大庆,一种高密度光纤配线模块及光通讯配线设备,广东省深圳市南山区科苑路清华信息港综合楼一层107号,518057
CN201511009773.7,20151225,CN105459429B,20170322,B30B9/06;B30B15/32;B30B15/00;,苏桂四,苏桂四,两级压榨式榨油装置,广东省佛山市南海区丹灶镇海安路海景楼201房,528216
CN201511010152.0,20151229,CN105417586B,20170322,C01G45/02;,中国科学院过程工程研究所,卢旭晨,一种四氧化三锰及其制备方法,北京市海淀区中关村北二条1号,100190
CN201511010852.X,20151230,CN105414819B,20170322,B23K37/00;B23K31/02;,吉林大学,朱先勇,用于手动泵中自动上料点焊的设备,吉林省长春市前进大街2699号,130012
CN201511010916.6,20151230,CN105437596B,20170322,B30B9/32;B30B15/00;B30B15/30;B03C1/12;,徐州工业职业技术学院,周波,单缸压制的切削废料分类压块机及其液压控制系统,江苏省徐州市鼓楼区襄王路1号,221140
CN201511011278.X,20151230,CN105422199B,20170322,F01K25/10;F01K25/00;,中冶南方工程技术有限公司,盖东兴,一种中低温热源发电系统,湖北省武汉市东湖新技术开发区大学园路33号,430223
CN201511013119.3,20151231,CN105469892B,20170322,H01B7/40;F16L15/00;F16L35/00;,苏州桑泰海洋仪器研发有限责任公司,杨文亮,一种探测拖曳缆的承力拖头结构,江苏省苏州市工业园区星湖街218号C4楼101,215125
CN201511014319.0,20151231,CN105540622B,20170322,C01F5/02;,上海应用技术学院,房永征,一种硅钢级氧化镁的回收再制备方法,上海市徐汇区漕宝路120号,200235
CN201511014859.9,20151231,CN105515528B,20170322,H02S40/44;,哈尔滨工业大学,刘佳宁,一种废热和太阳能多功能混合发电装置,黑龙江省哈尔滨市南岗区西大直街92号,150000
CN201511015470.6,20151231,CN105679372B,20170322,G11C29/14;G11C29/56;,湖南国科微电子股份有限公司,胡德才,一种系统级封装结构及用于该结构的闪存裸片测试方法,湖南省长沙市经济技术开发区东十路南9号,410131
CN201511021594.5,20151231,CN105464530B,20170322,E06B3/46;E05D13/00;,森特士兴集团股份有限公司,陈俊臣,一种三联门储物柜,北京市大兴区经济技术开发区BDA国际企业大道20号,100176
CN201511022694.X,20151229,CN105449045B,20170322,H01L31/18;H01L21/02;C30B33/10;,江西比太科技有限公司,解观超,一种适用于RIE制绒后晶体硅片的表面微腐蚀清洗方法,江西省南昌市高新技术产业开发区京东大道1189号高新欧洲工业园,330096
CN201511022994.8,20151231,CN105442525B,20170322,E02D3/10;,浙江宏力阳生态建设股份有限公司,张志建,一种塑料排水板插设机构,浙江省宁波市高新区江南路1528号12楼,315040
CN201511023178.9,20151230,CN105405347B,20170322,G09B25/00;,济南大学,邢立亭,一种内陆含水系统咸淡水交互驱替模拟装置及模拟方法,山东省济南市市中区南辛庄西路336号,250022
CN201511023235.3,20151231,CN105573681B,20170322,G06F3/06;,湖南国科微电子股份有限公司,陈意,一种SSD盘片内部RAID组建方法及系统,湖南省长沙市经济技术开发区东十路南9号,410131
CN201511023290.2,20151230,CN105407583B,20170322,H05B33/08;H02M3/335;H02M1/42;,哈尔滨工业大学,王懿杰,一种基于Buck‑Boost电路和Flyback电路的单极准谐振LED驱动装置,黑龙江省哈尔滨市南岗区西大直街92号,150001
CN201511023341.1,20151231,CN105607874B,20170322,G06F3/06;,湖南国科微电子股份有限公司,赵志强,SATA协议加速模块、主机与硬盘通信方法及固态硬盘控制器,湖南省长沙市经济技术开发区东十路南9号,410131
CN201511023835.X,20151230,CN105439205B,20170322,C01G45/02;,江苏理工学院,李中春,方框状Mn<sub>3</sub>O<sub>4</sub>的制备方法,江苏省常州市钟楼区中吴大道1801号,213016
CN201511024067.X,20151230,CN105415282B,20170322,B25B27/14;,同济大学,简小刚,一种锥齿轮传动式单边螺栓紧固件安装工具,上海市杨浦区四平路1239号,200092
CN201511024153.0,20151230,CN105615527B,20170322,A47G21/00;A47J47/00;,宁波市鄞州剑均机械科技有限公司,陆颂荫,一种吸盘汤匙篓,浙江省宁波市鄞州区下应街道河东村,315104
CN201511024782.3,20151231,CN105509961B,20170322,G01L25/00;G01B7/16;G01R27/02;G01R19/00;,陕西理工学院,赵峰,一种大阵列电阻式应变片自动检测装置及方法,陕西省汉中市汉台区朝阳路陕西理工学院陕西省工业自动化重点实验室,723001
CN201511024900.0,20151230,CN105520466B,20170322,A47G19/22;,深圳市伟春货贸易有限公司,周啟帆,一种水盖及具有该水盖的水杯,广东省深圳市福田区福华三路时代财富大厦34A,518000
CN201511025069.0,20151229,CN105573400B,20170322,G05F1/67;,华南理工大学,陈渊睿,一种光伏发电系统最大功率跟踪控制方法,广东省广州市天河区五山路381号,510640
CN201511025501.6,20151229,CN105463981B,20170322,E01D15/10;,广东技术师范学院,杨勇,一种用于道路施工的可移动桥式车辆通行系统,广东省广州市天河区中山大道293号,510665
CN201511025996.2,20151229,CN105524924B,20170322,C12N15/113;A61K31/713;A61P35/00;C12Q1/68;,广州永诺生物科技有限公司,罗景燕,环状RNA circ‑ZKSCAN1的用途,广东省广州市国际生物岛螺旋三路8号标产三期2栋602单元,510000
CN201511026303.1,20151230,CN105595390B,20170322,A24B3/04;,山东中烟工业有限责任公司,孙延钊,一种提高润梗机料头阶段出口水分稳定性的方法,山东省济南市历城区东外环路431号,250100
CN201511027916.7,20151231,CN105549916B,20170322,G06F3/06;,湖南国科微电子股份有限公司,赵志强,PCIe固态硬盘控制器、基于PCIe的存储系统及其数据读写方法,湖南省长沙市经济技术开发区东十路南9号,410131
CN201511028111.4,20151231,CN105463956B,20170322,E01B25/30;E01B5/16;,上海市安装工程集团有限公司,储华,一种F型轨的端部定位装置,上海市浦东新区浦东北路1430号,201208
