CN201510870700.0,20151201,CN105372718B,20170718,G01V11/00;,西安石油大学,沈鸿雁,一种2D位场构建3D位场的方法,陕西省西安市电子二路东段18号西安石油大学,710065
CN201510872321.5,20140626,CN105355306B,20170718,H01B7/22;G02B6/44;,湖南湘江电缆有限公司,侯少斌,一种电缆或光缆用复合钢带,湖南省长沙市暮云工业园伊莱克斯大道——湘江电缆,410119
CN201510873297.7,20151203,CN105345920B,20170718,B28B11/08;,江西省萍乡市三善机电有限公司,李珍计,一种瓷绝缘子的成型机,江西省萍乡市萍乡经济技术开发区高新技术工业园北区3号,337000
CN201510310908.7,20150609,CN104865772B,20170718,G02F3/00;,兰州大学,田永辉,一种基于微环谐振器的三值光学可逆逻辑器件,甘肃省兰州市城关区天水南路222号,730000
CN201510876483.6,20151203,CN105419840B,20170718,C10G1/00;C10G11/00;,南京绿帝环保能源科技有限公司,韩玉龙,废塑料裂化催化装置,江苏省南京市江宁区东麒路33号,210000
CN201510878270.7,20151204,CN105376554B,20170718,H04N13/02;H04N5/225;,深圳市第六星设计技术有限公司,崔明,3D摄像头机构、具有该机构的移动设备及控制方法,广东省深圳市龙华新区龙华街道龙峰三路锦华大厦1106,518000
CN201510878700.5,20151204,CN105364994B,20170718,B26F1/44;B26D7/26;,江苏劲嘉新型包装材料有限公司,王浩,可调节式钢模切刀板,江苏省淮安市经济开发区迎宾大道69号,223005
CN201510311647.0,20150608,CN104905578B,20170718,A47B88/95;,伍志勇,伍志勇,家具抽屉的前面板解锁驱动结构,广东省佛山市顺德区勒流镇东风合安工业区一路1号,528300
CN201510880824.7,20151204,CN105345636B,20170718,B24B27/033;B24B23/00;,广西大学,耿葵花,一种液压式高空导线除锈装置,广西壮族自治区南宁市西乡塘区大学路100号,530004
CN201510882542.0,20151203,CN105370407B,20170718,F02C6/14;,中国科学院理化技术研究所,王俊杰,低温液态空气储能系统,北京市海淀区中关村东路29号,100190
CN201510884434.7,20151204,CN105328709B,20170718,B25J15/08;,哈尔滨云控机器人科技有限公司,蒋再男,一种机械爪,黑龙江省哈尔滨市经开区哈平路集中区大连北路与兴凯路交口处,150069
CN201510885355.8,20151207,CN105286489B,20170718,A47J27/00;A47J36/00;A47J37/00;,徐宁宁,徐宁宁,全能厨艺机,广东省深圳市福田区红荔路福莲花园4栋807,518035
CN201510886106.0,20151204,CN105502507B,20170718,C01G49/00;C01G51/00;C01G53/00;,南京信息工程大学,黄啸谷,一种多波段电磁吸收剂及其制备方法,江苏省南京市建邺区奥体大街69号,210000
CN201510311676.7,20150610,CN104987287B,20170718,C07C59/84;C07C51/41;C07C229/26;C07C227/18;A61K31/198;A61P29/00;A61P19/02;A61P19/06;A61K31/192;,上海现代制药海门有限公司,上海现代制药股份有限公司,一种球形酮基布洛芬赖氨酸盐的制备方法,江苏省南通市海门市临江镇灵甸工业集中东区3号内2号房,226100
CN201510886933.X,20151207,CN105382161B,20170718,B21H3/04;B21H3/08;F16L15/00;,江苏迈能高科技有限公司,朱庆国,一种水箱内胆螺纹接头专用螺纹工装,江苏省泰州市靖江市开发区纬二路2号（前进村11队）,214500
CN201510887414.5,20151204,CN105538868B,20170718,B32B37/10;B32B38/18;B65H18/08;,余姚纺织机械有限公司,金凯岷,一种复合成卷机,浙江省宁波市余姚市舜水北路139号,315400
CN201510889162.X,20151204,CN105442991B,20170718,E06B3/46;E05D13/00;E05D15/06;E05F5/06;,伍志勇,伍志勇,家具侧滑门的调节定位机构,广东省佛山市顺德区勒流镇东风合安工业区一路1号,528300
CN201510311913.X,20150609,CN105016986B,20170718,C07C41/48;C07C43/305;C07C45/52;C07C47/58;C07C47/575;,岳阳昌德化工实业有限公司,何嘉勇,一种(3‑烷氧基‑4‑羟基)‑环己基甲缩醛二醇与其异构体的用途,湖南省岳阳市经济技术开发区开发总公司标准件厂房1楼,414000
CN201510889421.9,20151207,CN105510460B,20170718,G01N30/02;G01N30/46;,江南大学,王淼,一种定量检测葡萄糖系列酸及内酯的方法,江苏省无锡市蠡湖大道1800号,214122
CN201510893300.1,20151208,CN105289084B,20170718,B01D33/17;B01D33/48;B01D33/80;B01D33/68;,国投钦州发电有限公司,张伯兴,圆盘脱水机,广西壮族自治区钦州市钦州港果鹰大道1号,535008
CN201510894810.0,20151207,CN105403963B,20170718,G02B6/42;,武汉电信器件有限公司,曹芳,一种气密性并行传输光器件,湖北省武汉市洪山区邮科院路88号,430074
CN201510312213.2,20150608,CN104860578B,20170718,C04B26/26;C04B22/12;C04B20/00;C04B24/24;,苏交科集团股份有限公司,王文峰,缓释型抗冰冻沥青玛蹄脂碎石混合料的制备方法,江苏省南京市水西门大街223号,210017
CN201510895794.7,20151130,CN105512287B,20170718,G06F17/30;,山东正元地球物理信息技术有限公司,张善法,一种建立综合管廊信息数据库的方法,山东省济南市高新区颖秀路3366号,250101
CN201510312255.6,20150609,CN104858428B,20170718,B22F3/03;,宁波汇众粉末机械制造有限公司,严培义,一种粉末冶金制品自动整形机,浙江省宁波市镇海区澥浦工业开发区,315203
CN201510897610.0,20151208,CN105537385B,20170718,B21D35/00;,哈尔滨汽轮机厂有限责任公司,朱洪军,一种汽轮机冷凝器水室上的水室封头一体成型的方法,黑龙江省哈尔滨市香坊区三大动力路345号,150046
CN201510898799.5,20140526,CN105563788B,20170718,B29C47/02;B29C47/08;G02B6/44;B29L23/00;,东莞市颖源电子有限公司,潘明黎,一种线缆用气吹管道的制造方法,广东省东莞市厚街镇桥头村S256省道西,523000
CN201510902913.7,20151209,CN105490639B,20170718,H02S40/44;H02S40/42;,河海大学常州校区,彭俊,一种智能型光伏热一体化装置,江苏省常州市晋陵北路200号河海大学常州校区,213022
CN201510312533.8,20150609,CN104949435B,20170718,F25D21/04;F25D23/02;,合肥华凌股份有限公司,美的集团股份有限公司,一种安装在冷柜门体上的透气减霜装置及冷柜,安徽省合肥市经济技术开发区锦绣大道,230601
CN201510903197.4,20151209,CN105403930B,20170718,G01V9/00;,山东科技大学,刘伟韬,围岩采动破坏范围分段测试系统,山东省青岛市经济技术开发区前湾港路579号,266590
CN201510903864.9,20151209,CN105483499B,20170718,C22C30/06;C22C9/04;C22C9/06;C22C5/00;,深圳市甘露珠宝首饰有限公司,郑焕坚,一种用于制作金属饰品的补口材料及金属饰品材料,广东省深圳市罗湖区水贝工业区20栋爱得康大厦,518021
CN201510313637.0,20140611,CN104849253B,20170718,G01N21/64;C09B23/10;C09K11/06;,南方医科大学,刘瑞源,苯并吲哚半菁染料检测葡萄糖的用途,广东省广州市白云区沙太南路1023号,510515
CN201510906311.9,20151209,CN105301271B,20170718,G01N35/00;,中国科学院苏州生物医学工程技术研究所,罗刚银,具有卡盒位姿调整机构的血型卡离心机,江苏省苏州市科技城科灵路88号,215163
CN201510908606.X,20151210,CN105289517B,20170718,B01J20/22;B01J20/28;B01J20/30;C02F1/28;C02F103/08;,北京化工大学,徐庆红,一种适用于海水淡化的吸附材料及其制备方法,北京市朝阳区北三环东路15号,100029
CN201510911689.8,20140721,CN105295182B,20170718,C08L23/06;C08L67/02;C08L91/06;C08K13/02;C08K3/04;C08K3/22;H01B7/17;G02B6/44;,江苏申源新材料科技有限公司,袁柳淑,一种电线电缆用护套料及其制造方法,江苏省盐城市盐都区大冈镇胜利居委会三组（N）,224000
CN201510315759.3,20150610,CN104876268B,20170718,C01G31/00;,攀钢集团攀枝花钢铁研究院有限公司,殷兆迁,一种高密度多钒酸铵的制备方法,四川省攀枝花市东区桃源街90号,617000
CN201510912153.8,20151211,CN105479506B,20170718,B26D1/06;B26D7/02;B26D7/08;B26D5/20;,江苏绿源新材料有限公司,林永飞,连续生产线的泡沫自动切割装置及泡沫自动切割的方法,江苏省南通市城港路388号,226001
CN201510917195.0,20151211,CN105628205B,20170718,G01J3/433;G01J3/02;,吉林大学,王智宏,调幅信号整周期或半周期同步测频修正数字解调检测系统及检测方法,吉林省长春市前进大街2699号,130012
CN201510918042.8,20151214,CN105382125B,20170718,B21D53/24;,中国航空工业标准件制造有限责任公司,邓博,一种简易自动收口装置,贵州省贵阳市白云区白云南路355号,550014
CN201510315787.5,20150610,CN104859182B,20170718,B31B70/04;B31B70/88;B31B70/62;B31B70/74;,江苏万乐自动化装备有限公司,徐卫国,一种大连线纸塑复合袋生产线,江苏省镇江市丹阳市延陵镇芳草经济园,212300
CN201510919408.3,20151211,CN105424961B,20170718,G01N35/10;,中国科学院苏州生物医学工程技术研究所,周武平,用于微流控芯片进样的负压快速对接装置,江苏省苏州市科技城科灵路88号,215163
CN201510919822.4,20151209,CN105542902B,20170718,C10L10/04;,安徽中泰创展环境科技有限公司,李鹏,一种垃圾焚烧炉用除焦剂及其制备方法,安徽省安庆市潜山县经济开发区南环路3栋,246300
CN201510316009.8,20150610,CN104896595B,20170718,F24F1/00;,广东工业大学,周金平,一种安装于室内机插接式的空调压缩机启动器,广东省广州市番禺区广州大学城外环西路100号,510000
CN201510920648.5,20151211,CN105396935B,20170718,B21D28/32;B21D43/00;,四川丹甫环境科技有限公司,王东,一种用于压缩机壳体冲孔校平的机器,四川省眉山市青神县黑龙镇鸿化村,620460
CN201510927300.9,20151214,CN105421475B,20170718,E02D19/12;E02D5/18;E02D15/00;,中国建筑科学研究院,建研地基基础工程有限责任公司,一种气囊式帷幕渗漏堵漏装置和方法,北京市朝阳区北三环东路30号,100013
CN201510927456.7,20151214,CN105374212B,20170718,G08G1/01;,上海交通大学,俞嘉地,基于智能终端传感的高速公路车辆车道识别方法及系统,上海市闵行区东川路800号,200240
CN201510927605.X,20151214,CN105544980B,20170718,E04G19/00;,重庆集智创享工业设计有限公司,吴睿,便携式混凝土模板表面清理装置,重庆市渝北区龙溪街道龙华大道1889号加州百合园A幢30-1,401121
CN201510930979.7,20151215,CN105432162B,20170718,A01B39/08;A01B39/18;A01B39/20;A01B39/22;A01M21/02;,中南林业科技大学,李立君,履带式自走单株植物抚育机,湖南省长沙市韶山南路498号,410004
CN201510316302.4,20150610,CN104893039B,20170718,C08L9/06;C08L23/16;C08L23/08;C08L9/00;C08L15/00;C08K13/02;C08K3/36;C08K5/09;C08K3/22;C08K3/06;C08C19/06;,青岛科技大学,夏琳,一种环氧化天然杜仲橡胶的应用方法,山东省青岛市崂山区松岭路99号,266042
CN201510932389.8,20151215,CN105359982B,20170718,C12N5/04;A01H4/00;,河北民族师范学院,刘晓光,一种山杏组织培养基、其制备方法及应用,河北省承德市高教园区河北民族师范学院,067000
CN201510939356.6,20151216,CN105477892B,20170718,A63K3/04;,泰山医学院,张磊,一种体育比赛安全跨栏架,山东省泰安市泰山区迎胜东路2号,271000
CN201510939732.1,20151215,CN105568852B,20170718,E01D19/12;F16F15/04;,重庆交通大学,王旭,一种用于两桥/路面的防撞装置,重庆市南岸区学府大道66号,400074
CN201510316583.3,20150611,CN104851393B,20170718,G09G3/32;,长沙信元电子科技有限公司,方迪勇,一种通透型LED显示屏的电路解决方法及其电路,湖南省长沙市经开区盼盼路2号6栋,410010
CN201510940805.9,20151215,CN105437548B,20170718,B29C64/20;B29C64/227;B29C64/321;B29C64/295;B33Y30/00;,宁夏迅联科技有限公司,马宗明,一种3D打印设备,宁夏回族自治区银川市兴庆区新华东街4号金泰大厦十四层5号,750003
CN201510941703.9,20151216,CN105557188B,20170718,A01D43/06;,中北大学,陆辉山,一种抛送装置以及青饲料收获机,山西省太原市尖草坪区学院路3号,036000
CN201510316776.9,20150611,CN104907838B,20170718,B23Q1/26;,湖北汽车工业学院,邱新桥,一种两工位回转工作台,湖北省十堰市车城西路167号,442002
CN201510942142.4,20151216,CN105544832B,20170718,E04B7/00;E04G21/00;,中国建筑第二工程局有限公司,中建二局第四建筑工程有限公司,一种贝壳屋面及其施工方法,北京市西城区广安门南街42号中建二局大厦,100054
CN201510942156.6,20151216,CN105484434B,20170718,E04D7/00;,中国建筑第二工程局有限公司,中建二局第四建筑工程有限公司,大跨度锥形屋面找平层结构及其施工方法,北京市西城区广安门南街42号中建二局大厦,100054
CN201510942161.7,20151216,CN105507475B,20170718,E04B7/10;,中国建筑第二工程局有限公司,中建二局第四建筑工程有限公司,一种连续交替半圆锥面形屋面及其施工方法,北京市西城区广安门南街42号中建二局大厦,100054
CN201510316872.3,20150610,CN104963783B,20170718,F02G1/00;,摩尔动力(北京)技术股份有限公司,靳北彪,三元同轴发动机,北京市朝阳区北苑路168号中安盛业大厦24层,100101
CN201510943582.1,20151216,CN105423086B,20170718,F15B13/12;,华中科技大学,高飞,一种智能精准调平测量支座,湖北省武汉市洪山区珞喻路1037号,430074
CN201510944031.7,20151216,CN105424861B,20170718,G01N30/88;,中国动物疫病预防控制中心,田亚平,维生素B1在评估鸡蛋营养价值中的应用及评估方法,北京市朝阳区麦子店街20号楼,100125
CN201510316944.4,20150610,CN104859191B,20170718,B31B70/74;B31B170/20;,江苏万乐自动化装备有限公司,徐卫国,一种用于双层袋套袋机的防袋底折角装置,江苏省镇江市丹阳市延陵镇芳草经济园,212300
CN201510944252.4,20151216,CN105415271B,20170718,B25B27/00;,中国人民解放军后勤工程学院,重庆川庆科技发展有限公司,一种用于槽头钢管插接连接的手工操作工具,重庆市沙坪坝区大学城中国人民解放军后勤工程学院,401311
CN201510944600.8,20151217,CN105428206B,20170718,H01J61/80;,中国工程物理研究院激光聚变研究中心,康晓丽,一种使用固态烟火剂的烟火闪光灯,四川省绵阳市919信箱987分箱,621999
CN201510317618.5,20150606,CN104924547B,20170718,B29C45/36;B29C45/14;,宁波双林模具有限公司,李诚枫,一种控制嵌件注塑螺杆斜齿轮位置装置,浙江省宁波市宁海县西店镇璜溪口村,315613
CN201510946587.X,20151215,CN105537612B,20170718,B22F9/24;B22F1/00;,安徽工业大学,夏友谊,一种微结构多孔银及其制备方法,安徽省马鞍山市湖东中路59号,243002
CN201510946663.7,20151217,CN105365033B,20170718,B28B5/02;B28B3/12;,龙泉市金宏瓷业有限公司,林云峰,一种青瓷泥胚滚压机构,浙江省丽水市龙泉市青瓷产业化基地,323700
CN201510947176.2,20151217,CN105399744B,20170718,C07D487/04;,黄燕鸽,黄燕鸽,一种奥格列汀的合成方法,江苏省南京市鼓楼区和燕路泰和园01-1507,210037
CN201510318675.5,20150611,CN104961424B,20170718,C04B28/26;C04B41/50;C04B14/06;C04B24/04;,湖南交泰建材有限公司,杨建西,一种混凝土固化保护剂,湖南省长沙市望城经济开发区马桥河路5号,410000
CN201510948184.9,20151217,CN105561700B,20170718,B01D46/30;B01D46/42;B01D46/48;B08B15/00;,徐功波,徐功波,一种城市/区域空气的净化系统,山东省烟台市芝罘区开元新村A区6-2-6,264000
CN201510951228.3,20151219,CN105382618B,20170718,B23Q7/06;,湖南宇环智能装备有限公司,许亮,一种带储料的自动入料机构,湖南省长沙市长沙经开区东十一路南段18号长沙蓝色机械配套产业园,410000
CN201510952334.3,20151219,CN105443466B,20170718,F15B11/00;F15B13/02;,太原重工股份有限公司,姜浩志,用于快开缸及上辊平衡缸的钢管矫直机液压控制系统,山西省太原市万柏林区玉河街53号,030024
CN201510318720.7,20150611,CN104947096B,20170718,C23C18/36;,南京林业大学,邵伟,一种镍‑磷‑氧化石墨烯复合抗菌镀层的制备方法,江苏省南京市玄武区龙蟠路159号,210037
CN201510952415.3,20151217,CN105536641B,20170718,B01F17/16;B01F17/32;,江南大学,蒋建中,一种具有双重刺激响应性能的复合乳化剂,江苏省无锡市滨湖区蠡湖大道1800号,214122
CN201510956064.3,20151218,CN105397991B,20170718,B29C45/26;B29C45/56;,玫瑰塑胶（昆山）有限公司,朱永,一种模内自动打孔的吹塑模具,江苏省苏州市昆山市周市镇东辉路101号,215300
CN201510318776.2,20150611,CN104917294B,20170718,H02J13/00;,国网上海市电力公司,钱国,一种自动化厂站设备的复位方法,上海市浦东新区源深路1122号,200122
CN201510962051.7,20151218,CN105543676B,20170718,C22C38/04;C22C38/02;C22C38/12;C22C38/14;C22C38/08;C22C38/18;C22C38/06;C21D8/02;C21D6/00;,东北大学,南京钢铁股份有限公司,一种马氏体‑铁素体双相耐磨钢板及其制备方法,辽宁省沈阳市和平区文化路3巷11号东北大学,110819
CN201510965347.4,20151221,CN105419370B,20170718,C08L97/02;C08L5/04;C08L1/28;C08K5/053;C08J5/18;B65D65/46;,四川农业大学,吴贺君,一种基于火龙果皮的可食性包装膜及其制备方法,四川省雅安市雨城区新康路46号（四川农业大学）,625014
CN201510967066.2,20151218,CN105424948B,20170718,G01N33/98;,天津城建大学,李国燕,基于Android系统的便携式一体化酒精探测装置,天津市西青区津静公路26号,300384
CN201510319205.0,20150611,CN104917569B,20170718,H04B10/25;H04B10/2575;,上海交通大学,宫新保,针对大规模天线阵列的模数混合射频光纤传输架构,上海市闵行区东川路800号,200240
CN201510968638.9,20151222,CN105382017B,20170718,B09B3/00;,陈惊雷,陈惊雷,一种垃圾处理器,浙江省衢州市衢江区杜泽镇铜山溪西路82号6幢一单元201室,324000
CN201510969979.8,20151221,CN105371880B,20170718,G01D5/353;G01D21/02;,山东大学,中国科学院长春应用化学研究所,用于注塑制品检测的光纤光栅传感器嵌件及其制造方法,山东省济南市历下区经十路17923号,250061
CN201510319370.6,20150611,CN105076132B,20170718,A01N31/02;A01N25/30;A01P21/00;,中国农业大学,杜凤沛,一种油基型农药增效助剂及其制备方法,北京市海淀区圆明园西路2号,100193
CN201510973882.4,20151222,CN105644593B,20170718,B61L27/00;B61C17/12;,中国铁道科学研究院通信信号研究所,中国铁道科学研究院,一种适用于HXN5B型大功率机车的驼峰遥控推峰控制系统,北京市海淀区大柳树路2号中国铁道科学研究院通信信号研究所,100081
CN201510320876.9,20150611,CN104977850B,20170718,G05B13/04;,广州市香港科大霍英东研究院,张碧陶,一种基于分数阶预测器的无时滞鲁棒伺服电机控制方法,广东省广州市南沙区资讯科技园科技楼香港科大霍英东研究院,511458
CN201510974037.9,20151223,CN105569557B,20170718,E06C9/08;E06C7/08;E04H12/00;,国网山东省电力公司日照供电公司,任学良,一种便于攀爬检修的电线杆,山东省日照市东港区烟台路68号,276800
CN201510974120.6,20151222,CN105437202B,20170718,B25H7/04;,浙江新龙实业有限公司,陈伟江,汽车空调管路装配口端划线装置,浙江省绍兴市新昌县城关镇五龙岙,312500
CN201510974837.0,20151222,CN105603266B,20170718,C22C21/02;C25D3/08;C25D5/44;C25D5/50;F02F1/00;,山东汇川汽车部件有限公司,解居麟,一种用于汽车发动机的铝合金气缸套及其制备方法,山东省济宁市泗水县经济开发区泉济路1号,273200
CN201510976889.1,20151223,CN105561790B,20170718,B01D59/24;C07D273/01;,中国科学院上海高等研究院,文珂,苯并氮杂冠醚类化合物分离锂同位素的应用,上海市浦东新区海科路99号,201210
CN201510321156.4,20150611,CN104945221B,20170718,C07C21/18;C07C17/25;C07C17/383;,浙江衢州巨新氟化工有限公司,浙江衢化氟化学有限公司,"一种联产2,3,3,3‑四氟丙烯和1,3,3,3‑四氟丙烯的方法",浙江省衢州市柯城区北二道60号,324004
CN201510978617.5,20151224,CN105436713B,20170718,B23K26/38;B23K26/362;,江苏信息职业技术学院,钱云,一种新型智能化激光切割机,江苏省无锡市惠山区钱藕路1号,214153
CN201510978670.5,20151224,CN105369369B,20170718,D01D5/00;,北京化工大学,刘勇,一种离心同轴静电纺丝机,北京市朝阳区北三环东路15号,100029
CN201510321330.5,20150612,CN105045323B,20170718,G05D29/00;G05B19/048;,成都中大华瑞科技有限公司,蒋小春,智能灌浆系统,四川省成都市金牛区九里堤南路50号,610031
CN201510979537.1,20151223,CN105448481B,20170718,H01F27/14;B01D17/02;B01D17/022;,云南电网有限责任公司电力科学研究院,武汉大学,一种膜法与真空滤油机组合去除变压器油中微量水分的装置及其使用方法,云南省昆明市经济技术开发区云大西路105号,650217
CN201510980141.9,20140804,CN105434012B,20170718,A61B17/24;A61B17/50;A61B17/29;,陈军,陈军,一种气管异物钳钳体结构,山东省济宁市邹城市公园路邹城市中医院急诊科,273500
CN201510321637.5,20150612,CN104905671B,20170718,A47J27/00;A47J36/00;,浙江机电职业技术学院,沈悦,带制冷功能的电饭煲,浙江省杭州市滨江区滨文路528号,310053
CN201510980180.9,20151224,CN105397824B,20170718,B25J15/00;B25J15/02;,张哲夫,韦远炎,一种基于电磁驱动的机械手,浙江省温州市龙湾区海城街道埭岗路15号,325055
CN201510981225.4,20151224,CN105548434B,20170718,G01N30/88;G01N30/06;,上海微谱化工技术服务有限公司,张娟娟,聚苯乙烯塑料中二苯甲酮类添加剂的分离定性定量方法,上海市杨浦区国伟路135号9号楼1楼,200438
CN201510321859.7,20150612,CN104932029B,20170718,G01V8/10;,上海理工大学,朱亦鸣,一种主动式太赫兹人体安检系统装置及调整方法,上海市杨浦区军工路516号,200093
CN201510981572.7,20151223,CN105421908B,20170718,E05B83/00;E05B81/34;E05B79/22;E05B81/04;E05B77/04;,重庆怡海科技发展有限公司,红昀,一种采用棘齿抱紧及锁紧机构的特种车车门锁,重庆市九龙坡区石桥铺科创路65号渝高广场B座一单元7-1,400039
CN201510982409.2,20151223,CN105622009B,20170718,C04B28/04;C04B14/06;C04B14/10;C04B14/28;C04B103/30;C04B111/10;,东南大学,黄伟,一种不含硅灰的超高性能混凝土基体及其制备方法,江苏省南京市四牌楼2号,210096
CN201510321883.0,20150612,CN104950340B,20170718,G01V8/00;G01N21/47;,上海理工大学,彭滟,一种被动式太赫兹人体安检系统装置及调整方法,上海市杨浦区军工路516号,200093
CN201510982804.0,20151224,CN105568145B,20170718,C22C38/04;C22C38/02;C22C38/06;C22C38/18;C21D8/02;,北京科技大学,赵征志,一种具有耐腐蚀性能的汽车用冷轧超高强双相钢板及其制备方法,北京市海淀区学院路30号,100083
CN201510988485.4,20151224,CN105583371B,20170718,B22C9/22;B22C9/08;B22C9/04;B22D13/10;G01N33/20;,华中科技大学,周建新,一种物理模拟航空发动机中介机匣件铸造成形过程的模具,湖北省武汉市洪山区珞喻路1037号,430074
CN201510988702.X,20151225,CN105414730B,20170718,B23K11/11;B23K11/36;,广西大学,张建成,欧拉角球坐标系点焊器,广西壮族自治区南宁市西乡塘区大学东路100号,530004
CN201510322190.3,20150612,CN104891104B,20170718,B65G21/14;B63B27/22;,龚磊,龚磊,皮带架长度的调节方法及在船用环形皮带输送机上的应用和皮带架,湖南省益阳市沅江市沅田路1号10栋302室,413100
CN201510988823.4,20151224,CN105603872B,20170718,E01D19/10;,中交一公局第二工程有限公司,徐胜祥,智能自行式桥梁检修系统,江苏省苏州市吴中区金枫南路198号,215101
CN201510989079.X,20151222,CN105608456B,20170718,G06K9/32;,华中科技大学,白翔,一种基于全卷积网络的多方向文本检测方法,湖北省武汉市洪山区珞喻路1037号,430074
CN201510990850.5,20151224,CN105418899B,20170718,C08G61/12;H01L51/42;H01L51/46;,杨荣,杨荣,一种用于有机半导体的共轭聚合物的制备方法及其应用,浙江省宁波市余姚市小曹娥镇工业园区,315400
CN201510323042.3,20150612,CN105007130B,20170718,H04B17/318;H04L25/02;H04L25/03;,西安电子科技大学,李兵兵,一种低信噪比下LFM信号的检测方法,陕西省西安市太白南路2号西安电子科技大学,710071
CN201510991635.7,20151225,CN105422543B,20170718,F15B15/14;F15B15/20;,河海大学常州校区,钱雪松,一种内置导向油缸,江苏省常州市晋陵北路200号河海大学常州校区,213022
CN201510992516.3,20151228,CN105458461B,20170718,B23K9/10;B23K9/32;,浙江肯得机电股份有限公司,谢志峰,一种两焊接功能IGBT逆变焊机的结构,浙江省台州市路桥区疏港大道路桥段2299号,318050
CN201510324082.X,20150612,CN104931967B,20170718,G01S13/90;,西安电子科技大学,梁毅,一种改进的高分辨率SAR成像自聚焦方法,陕西省西安市太白南路2号,710071
CN201510992615.1,20151225,CN105402194B,20170718,F15B15/14;F15B15/20;,河海大学常州校区,钱雪松,一种内置导向油缸,江苏省常州市晋陵北路200号河海大学常州校区,213022
CN201510992989.3,20151224,CN105542143B,20170718,C08G64/42;,常州南京大学高新技术研究院,冯磊,含有环氧基团的脂肪族聚碳酸酯及其制备方法,江苏省常州市常武中路801号常州科教城天润大道南京大学常州高新技术研究院大楼A825室,213164
CN201510993976.8,20140714,CN105413238B,20170718,B01D17/025;C02F1/40;,崔斌,李开兴,一种油水分离器,北京市昌平区北七家镇威尼斯花园四区16-2,102209
CN201510994953.9,20151228,CN105397812B,20170718,B25J9/16;,青岛海通机器人系统有限公司,胡满,移动机器人及基于移动机器人更换产品的方法,山东省青岛市崂山区科苑纬一路1号国际创新园B座10层B3,266101
