CN201510558646.6,20150906,CN105198261B,20170718,C04B24/16;C04B22/16;C04B22/10;C04B22/14;C04B22/06;C04B16/06;,上海应用技术学院,吴蓁,一种用于自愈合聚合物水泥防水涂料的活性添加剂及其制备方法,上海市徐汇区漕宝路120号,200235
CN201510559313.5,20150902,CN105033763B,20170718,B23Q17/00;,华中科技大学,刘红奇,一种数控机床滚珠丝杠磨损状态的预测方法,湖北省武汉市洪山区珞喻路1037号,430074
CN201510560436.0,20150906,CN105197952B,20170718,C01B35/04;H01J1/304;H01J9/02;B82Y40/00;,浙江大学,刘宾虹,纳米单晶硼化镧的制备及其在电镜灯丝制备中的应用,浙江省杭州市西湖区余杭塘路866号,310058
CN201510560773.X,20150906,CN105048960B,20170718,H02S40/44;F25B27/02;F25B30/06;F25B41/06;,河海大学常州校区,白建波,基于光伏背板余热回收的吸收式热泵的复合能量利用装置,江苏省常州市晋陵北路200号河海大学常州校区,213022
CN201510561177.3,20150906,CN105031972B,20170718,B01D17/02;,宜兴市昌吉利化工有限公司,周卫强,一种混合液连续分离装置,江苏省无锡市宜兴市新建镇新丰中路140号,214253
CN201510561464.4,20150906,CN105088048B,20170718,C22C30/00;C22C30/02;C22C30/06;C22C1/04;C02F1/00;,北京科技大学,刘雄军,一种用于污水降解的高熵合金及其制备方法,北京市海淀区学院路30号,100083
CN201510562537.1,20150907,CN105180869B,20170718,G01B21/02;,上汽大众汽车有限公司,程迎潮,一种金属板材折边损失测量方法,上海市嘉定区安亭于田路123号,201102
CN201510564383.X,20150908,CN105216860B,20170718,B62D5/06;B62D5/08;B60T11/10;,江苏大学,何仁,半挂汽车列车精确转向和制动稳定性的半主动油液分流型控制装置和方法,江苏省镇江市京口区学府路301号,212013
CN201510567486.1,20150909,CN105163438B,20170718,H05B37/02;,上海西埃电器有限公司,丁赟,一种大功率光电控制器,上海市宝山区一二八纪念路878弄万达广场五号楼621室,200435
CN201510568094.7,20150909,CN105038204B,20170718,C08L77/02;C08L77/06;C08L83/04;C08K13/02;B29D7/01;,厦门新旺新材料科技有限公司,刘烈新,一种耐高温真空袋膜及其制备方法,福建省厦门市集美区后溪镇白虎岩路55号4-5F,361000
CN201510568485.9,20150909,CN105060877B,20170718,C04B35/46;C04B35/626;,福建火炬电子科技股份有限公司,吴金剑,高介电常数AG特性介电陶瓷材料及其制备方法,福建省泉州市高新技术产业园（江南园）紫华路4号,362000
CN201510568675.0,20150909,CN105128289B,20170718,B29C45/33;B29C45/40;B41J11/057;,高精科技（苏州）有限公司,冯志江,一种卷纸蜗杆及其注塑模具,江苏省苏州市工业园区通园路68号,215122
CN201510569402.8,20150909,CN105142283B,20170718,H05B37/02;,隆昌照明集团有限公司,冯富平,一种路灯管理系统,江苏省扬州市高邮市送桥镇郭集工业园区,225654
CN201510570834.0,20150910,CN105236368B,20170718,C01B25/10;,天津金牛电源材料有限责任公司,中海油天津化工研究设计院,一种二氟磷酸碱金属盐的制备方法,天津市北辰区北辰经济技术开发区双河道2号,300000
CN201510570991.1,20150910,CN105156749B,20170718,F16K31/60;F16K27/12;F16K1/36;,上海美科阀门有限公司,章成忠,新型开关截止阀,上海市嘉定区宝钱公路3858号,201807
CN201510572188.1,20150907,CN105195752B,20170718,B22F9/08;,内蒙古科技大学,张建旗,一种制备铝基合金粉体材料的方法,内蒙古自治区包头市昆都仑区阿尔丁大街7号,014000
CN201510574190.2,20150910,CN105131751B,20170718,C09D133/00;C09D175/04;C09D7/12;,北京展辰新材料有限公司,展辰新材料集团股份有限公司,一种水性高丰满清底漆及其制备方法,北京市通州区永乐经济开发区,101105
CN201510574315.1,20150910,CN105109594B,20170718,B62K3/00;,吉林大学,田美静,一种具有仿生学尾部结构的二轮平衡车,吉林省长春市前进大街2699号,130012
CN201510577441.2,20150911,CN105067468B,20170718,G01N3/56;,黄象尧,李贵东,一种磨损测试装置,广东省广州市增城区永宁街凤馨苑3-12-1103,511300
CN201510578943.7,20150912,CN105041285B,20170718,E21B43/26;,河南工程学院,田坤云,一种寒冷地层页岩油热压裂模拟实验系统,河南省郑州市新郑龙湖镇祥和路一号,451191
CN201510579703.9,20150911,CN105319317B,20170718,G01N31/12;H01M10/056;H01M10/0525;,合肥国轩高科动力能源有限公司,武行兵,一种锂离子电池电解液阻燃性能测试装置,安徽省合肥市新站区瑶海工业园纬D路7号,230000
CN201510580131.6,20150911,CN105071619B,20170718,H02K21/14;H02K3/24;,天津理工大学,信建国,一种定子绕组设有散热装置的永磁无刷电机,天津市西青区宾水西道391号天津理工大学主校区,300384
CN201510581235.9,20150914,CN105030834B,20170718,A61K35/586;A61P1/14;A61P19/02;A61P29/00;A61K35/36;A61K35/57;,河南蓝天药业有限公司,张现涛,一种治疗消化不良的药物及其制备工艺,河南省周口市项城市交通路东段,466200
CN201510581766.8,20120413,CN105289762B,20170718,B01L3/00;G01N21/64;,阿科尼生物系统公司,克里斯托弗·G·库尼,基于微阵列的样检系统,美国马里兰州,0
CN201510582120.1,20150914,CN105045285B,20170718,G05D1/10;,东南大学,陈杨杨,球面环绕编队控制的几何设计方法,江苏省南京市四牌楼2号,210096
CN201510582501.X,20150915,CN105115616B,20170718,G05D23/08;,国网山东省电力公司莱芜供电公司,国家电网公司,电气设备接头导线测温自控降温装置,山东省莱芜市鲁中西大街21号,271199
CN201510583646.1,20120613,CN105187836B,20170718,H04N19/463;H04N19/11;H04N19/593;H04N19/176;,JVC建伍株式会社,熊仓徹,图像解码装置、图像解码方法及接收装置、接收方法,日本神奈川县,0
CN201510583991.5,20150915,CN105236410B,20170718,C01B32/956;B82Y30/00;,扬州大学,朱骏,发光非晶碳化硅纳米颗粒的制备方法,江苏省扬州市大学南路88号,225009
CN201510585049.2,20150915,CN105118579B,20170718,H01B13/00;H01B1/22;H01B1/16;H01L31/0224;,苏州晶银新材料股份有限公司,包娜,用于光伏电池正面电极银浆的制备方法,江苏省苏州市高新区昆仑山路189号2号楼2楼北侧,215011
CN201510585180.9,20150915,CN105109904B,20170718,B65G15/58;B65G35/00;,浙江乔兴建设集团湖州智能科技有限公司,程惠瑜,一种带有定位张紧机构的金属丝切断机运输轨道,浙江省湖州市吴兴区杨树路18号,313000
CN201510585622.X,20150915,CN105274920B,20170718,E01C1/04;E01D18/00;,彭章义,彭章义,复合式高架桥,浙江省台州市三门县龙山路67-2,318000
CN201510585915.8,20150915,CN105087336B,20170718,C12G3/04;,广西运亨酒业有限公司,王海东,一种稔子酒及其制备方法,广西壮族自治区钦州市灵山县十里工业园大炮岭片区,535400
CN201510587504.2,20150916,CN105114366B,20170718,F04F3/00;F03G6/06;,西安工业大学,曹凯,微型太阳热能汲水泵,陕西省西安市未央区学府中路2号,710032
CN201510587985.7,20150916,CN105299676B,20170718,F23J15/06;F28F1/00;,华北电力大学,陈海平,一种基于中空微纳米多孔陶瓷膜的烟气水分余热回收装置,北京市昌平区回龙观北农路2号,102206
CN201510588283.0,20150916,CN105084170B,20170718,B66B9/08;,吴承尧,吴慧勇,楼道吊杆座椅电梯,河北省石家庄市正定县恒山西苑3#楼2单元101室,050000
CN201510589161.3,20150916,CN105134937B,20170718,F16H61/14;F16H3/10;F16H3/097;,湖南中德汽车自动变速器股份有限公司,魏英俊,一种动力补偿式动力换挡自动变速器及变速方法,湖南省衡阳市高新技术开发区35号街区,421001
CN201510593203.0,20150917,CN105178081B,20170718,D21C3/02;D21C3/22;D21C5/00;,河北吉藁化纤有限责任公司,岳福升,一种醋化级棉浆粕制备方法及其制备的浆粕,河北省石家庄市藁城区市府东路278号,052160
CN201510593526.X,20150917,CN105243731B,20170718,G07D7/206;,华中科技大学,尤新革,一种光谱自适应的多国纸币图像识别装置、系统及方法,湖北省武汉市洪山区珞喻路1037号,430074
CN201510595215.7,20150917,CN105071503B,20170718,H02J7/00;,河海大学常州校区,王小妍,便携式电子移动设备充电装置,江苏省常州市晋陵北路200号河海大学常州校区,213022
CN201510596166.9,20150918,CN105115843B,20170718,G01N3/56;,四川出入境检验检疫局检验检疫技术中心,俞凌云,编织物表面耐摩擦的仿真检验装置,四川省成都市武侯区一环路南四段28号,610000
CN201510596283.5,20150918,CN105127501B,20170718,B23D21/00;,合肥工业大学,朱华炳,用于薄壁管件的自动旋切装置及采用其进行旋切的方法,安徽省合肥市包河区屯溪路193号,230009
CN201510597199.5,20150917,CN105057351B,20170718,B21B1/26;B21B37/74;,江西洪都钢厂有限公司,郝刚,超薄型热轧窄带钢生产线及其配套工艺,江西省南昌市南昌经济技术开发区向水湖路1188号,330013
CN201510597579.9,20150918,CN105298812B,20170718,F04B43/12;,保定兰格恒流泵有限公司,李宁,一种滚轮相位可变的蠕动泵,河北省保定市国家高新区创业中心A楼,071000
CN201510598106.0,20150921,CN105195465B,20170718,B08B3/10;B08B3/12;B08B3/02;B08B3/14;B08B11/00;,同济大学,上海天粹自动化设备有限公司,一种超声波‑兆声波复合频率全自动光学元件清洗装置,上海市杨浦区四平路1239号,200092
CN201510598299.X,20150918,CN105257028B,20170718,E04H1/12;E04B1/82;E04B1/86;E06B3/70;E06B5/20;,清华大学,燕翔,一种小型可移装室内静音阁及其构建方法,北京市海淀区清华园1号,100084
CN201510598667.0,20090511,CN105193533B,20170718,A61F2/962;,奥巴斯尼茨医学公司,R·J·卡特恩,用于将支架置于输送球囊导管系统上的套管,美国佛罗里达州,0
CN201510599059.1,20150918,CN105187811B,20170718,H04N9/73;G09G3/36;,广东威创视讯科技股份有限公司,黄早珊,一种LCD屏白平衡的自动调节方法及装置,广东省广州市广州高新技术产业开发区科珠路233号,510670
CN201510599759.0,20150918,CN106369213B,20170718,F16K31/122;F16K1/34;,哈依波株式会社,李点洙,用于打开和关闭蝶形阀的液压旋转执行器,韩国庆尚南道,0
CN201510599927.6,20150921,CN105132634B,20170718,C21D1/19;C21D6/00;,舞阳钢铁有限责任公司,吴涛,一种自升式海洋平台桩腿齿条钢板的淬火方法,河南省平顶山市舞钢市湖滨大道西段,462500
CN201510600347.4,20150917,CN105179769B,20170718,F16K17/30;,成都卡斯特精密铸造有限公司,付明,一种压差柱塞自动调压阀,四川省成都市青白江区龙王镇清洁村五组,610306
CN201510600443.9,20150918,CN105226726B,20170718,H02J3/46;H02J3/16;H02J13/00;H02S50/00;,安徽立卓智能电网科技有限公司,陈超,一种光伏电站集中监控系统,安徽省合肥市肥西县繁华大道与文山路交口工投立恒工业广场C12栋,230000
CN201510600594.4,20150919,CN105133212B,20170718,D05B53/00;D05B65/00;D05B69/02;,浙江中捷缝纫科技有限公司,浙江中屹缝纫机有限公司,一种缝纫机的拨线装置,浙江省台州市玉环县大麦屿街道兴港东路198号,317600
CN201510601816.4,20150921,CN105220479B,20170718,D06M15/03;D06M11/76;D06M13/00;D06M11/46;D06M101/10;,中国丝绸博物馆,杨海亮,一种适用于纺织品文物保护的蚕丝纤维的制备方法,浙江省杭州市西湖区玉皇山路73-1号,310002
CN201510601839.5,20150921,CN105250124B,20170718,A61H9/00;A61M35/00;,宁波吉登电子科技有限公司,程茂丽,水压丰胸装置,浙江省宁波市镇海区庄市街道中官西路777号科技创业大厦七层1单元,315200
CN201510601872.8,20150921,CN105250114B,20170718,A61H1/02;A61H15/00;,宁波吉登电子科技有限公司,程茂丽,一种改进型手指按摩装置,浙江省宁波市镇海区庄市街道中官西路777号科技创业大厦七层1单元,315200
CN201510603180.7,20150921,CN105217688B,20170718,C01G41/00;,湖南欧泰稀有金属有限公司,秦寒梅,一种高纯钨酸铵的制备方法,湖南省长沙市天心区南托街道暮云工业园新兴科技产业园C3栋603,410000
CN201510603208.7,20150921,CN105149714B,20170718,B23K1/00;C09J11/04;B23K101/18;,上海交通大学,李永兵,金属板无压痕胶焊连接方法,上海市闵行区东川路800号,200240
CN201510604907.3,20150921,CN105222894B,20170718,G01J3/28;,中国科学院国家天文台,范舟,对空间物体进行自动化的无缝光谱处理和波长定标方法,北京市朝阳区大屯路甲20号A座A521室,100024
CN201510605568.0,20150922,CN105036253B,20170718,C02F1/46;,上海丁香环境科技有限公司,于亮,电化学水处理设备,上海市中国（上海）自由贸易试验区芳春路400号1幢301-406室,200000
CN201510606503.8,20150922,CN105157842B,20170718,G01J3/46;,杭州彩谱科技有限公司,中国计量学院,一种带重复性优化装置的双光路分光测色仪和优化方法,浙江省杭州市经济技术开发区学源街现代科技学院逸夫科技楼1208,310018
CN201510608292.1,20150922,CN105194859B,20170718,A63B69/40;A63B67/04;,上海理工大学,陈飒,乒乓球自动发球机,上海市杨浦区军工路516号,200093
CN201510608825.6,20110401,CN105214890B,20170718,B05C1/08;B05C11/10;B05D1/28;,阿德文尼拉企业有限公司,E.赖亚博瓦,辊涂机,美国加利福尼亚州,0
CN201510608873.5,20150921,CN105125154B,20170718,A47L25/00;,茹朝贵,王财涌,一种水晶吊灯清洁装置,广东省中山市三乡镇乌石村小桃园商住小区C区09号商铺首层,528463
CN201510609181.2,20150923,CN105155165B,20170718,D06B1/02;D06B23/20;D06B23/04;,无锡东宝机械制造有限公司,潘加龙,染色机的喷嘴结构,江苏省无锡市惠山区前洲工业园兴洲路2号,214181
CN201510609313.1,20150923,CN105235314B,20170718,B32B15/09;B32B15/20;B32B15/14;B32B27/02;B32B37/12;,常州市泛亚汽车饰件有限公司,张云,耐高温的汽车轻量化用聚酯无纺布及其制备方法,江苏省常州市武进区礼嘉镇礼坂路28-8号,213000
CN201510609666.1,20150923,CN105235332B,20170718,B32B25/10;B32B25/14;B32B25/16;B32B27/12;B32B27/32;B32B27/30;B32B29/02;B32B7/06;B32B7/12;B32B33/00;B32B37/10;B32B37/12;B60R13/02;,常州市泛亚汽车饰件有限公司,张云,汽车内饰面料复合再生泡棉压制的顶棚片材及其制备方法,江苏省常州市武进区礼嘉镇礼坂路28-8号,213000
CN201510611034.9,20150924,CN105197711B,20170718,B66B5/02;B66B5/14;,苏州润吉驱动技术有限公司,李革,一种电梯制动器用无磨损空气缓冲装置,江苏省苏州市吴江区汾湖镇康力大道799号,215213
CN201510611417.6,20150923,CN105271112B,20170718,C01B3/06;,山东大学,李倩,一种浒苔基水凝胶负载纳米金属催化硼氢化钠生产氢气的方法,山东省济南市历城区山大南路27号,250199
CN201510612239.9,20150923,CN105254989B,20170718,C08L23/08;C08K9/10;C08K9/04;C08K7/18;C08K7/06;C08K7/00;C08K3/08;,浙江瑞堂塑料科技有限公司,温原,一种抗电击穿永久抗静电型滚塑成型用聚乙烯复合材料,浙江省宁波市慈溪市胜山镇工业大道588号,315323
CN201510612588.0,20150923,CN105459624B,20170718,B41J3/407;A45D29/00;,卡西欧计算机株式会社,长尾知幸,指甲打印装置及指甲打印装置的动作控制方法,日本东京都,0
CN201510612848.4,20150923,CN105169788B,20170718,B01D33/04;B01D33/056;B01D33/46;B01D33/48;B01D33/54;B01D29/09;B01D29/64;B01D29/66;B01D29/72;,烟台开发区博森科技发展有限公司,张政华,一种负压循环带过滤机,山东省烟台市开发区金沙江路167号,264006
CN201510612967.X,20150923,CN105172543B,20170718,B60J5/04;,上海通程汽车零部件有限公司,何宝红,一种安全性高的车门防撞装置,上海市奉贤区奉城镇洪朱路18号,201499
CN201510613667.3,20150924,CN105193026B,20170718,A44C11/02;,深圳市宏拓通达电子科技有限公司,董涛,一种智能看护防拆卸锁闭系统,广东省深圳市福田区彩田路福建大厦A座903,518000
CN201510613724.8,20150923,CN105254080B,20170718,C02F9/06;E21B43/38;C02F103/10;,煤科集团杭州环保研究院有限公司,肖艳,一种煤矿井下综采工作面乳化液废水处理装置与方法,浙江省杭州市萧山区拱秀路288号,311201
CN201510613884.2,20150924,CN105127855B,20170718,B24B7/22;B24B41/00;,泉州坤泰机械精工制造有限公司,翁少华,一种自动磨底机的定位装置,福建省泉州市德化县浔中镇凤凰山工业区,362500
CN201510614582.7,20150924,CN105144925B,20170718,A01C7/06;A01C7/18;A01G13/02;,辽宁省风沙地改良利用研究所,王海新,花生覆膜单粒精量播种机,辽宁省阜新市细河区中华路东段55号,123000
CN201510614975.8,20150924,CN105350674B,20170718,E04B1/98;,扬州大学,李胜才,板式三维隔振体装置,江苏省扬州市大学南路88号,225009
CN201510616390.X,20150924,CN105140924B,20170718,H02J3/01;,上海电力学院,薛花,一种混合型有源滤波器的非线性控制器设计方法,上海市杨浦区平凉路2103号,200090
CN201510616562.3,20150924,CN105119177B,20170718,H02B11/133;H02B11/10;H02J9/04;,厦门宏发开关设备有限公司,殷国庭,一种抽屉式断路器隔离位置联锁装置,福建省厦门市集美北部工业区东林路566号,361000
CN201510616713.5,20150924,CN105108171B,20170718,B22F9/24;B82Y40/00;G01N21/65;,厦门大学,杨朝勇,一种强拉曼信号的纳米颗粒的制备方法,福建省厦门市思明南路４２２号,361000
CN201510618431.9,20150924,CN105237680B,20170718,C08F226/06;C08F222/14;C09K5/02;,大连工业大学,郭静,一种具有交联结构的固‑固相变材料的制备方法,辽宁省大连市甘井子区轻工苑1号大连工业大学,116034
CN201510618994.8,20150925,CN105114392B,20170718,F15B15/14;F15B15/20;F15B11/17;F15B13/06;B66C13/20;,圣邦集团有限公司,徐州圣邦机械有限公司,一种油缸、使用该油缸的全闭式液压系统及控制方法,浙江省温州市滨海园区滨海二路628号,325000
CN201510619491.2,20150925,CN105344505B,20170718,B05B1/34;,太原理工大学,刘邱祖,一种离心对撞式雾化矿用降尘喷嘴,山西省太原市万柏林区迎泽西大街79号,030024
CN201510620165.3,20150926,CN105129490B,20170718,B65H31/34;B65H33/04;,长沙长泰智能装备有限公司,范海波,高速精密切纸机理纸装置,湖南省长沙市雨花经济开发区新兴路268号,410116
CN201510620976.3,20150925,CN105201699B,20170718,F02M31/16;F02M37/04;,上海船舶研究设计院,李路,基于套管形式的船舶燃油预热系统及其预热方法,上海市徐汇区肇嘉浜路221号,200032
CN201510621991.X,20150928,CN105181140B,20170718,G01J3/433;G01J3/02;,吉林大学,王智宏,简化数字锁相放大器的光栅扫描型光谱仪及检测方法,吉林省长春市前进大街2699号,130012
CN201510622033.4,20150925,CN105186882B,20170718,H02M3/335;H02M1/14;,中国航天科技集团公司第九研究院第七七一研究所,付翀丽,一种基于MC34063的隔离式DC/DC变换器,陕西省西安市太白南路198号,710065
CN201510626048.8,20150928,CN105152601B,20170718,C04B28/04;C04B18/12;C04B22/14;,太原理工大学,郭育霞,一种煤矸石基矿山胶结充填材料的制备方法,山西省太原市万柏林区迎泽西大街79号,030024
CN201510627543.0,20150928,CN105251700B,20170718,B07C5/02;B25J19/00;,杭州长川科技股份有限公司,翁水才,自动分选设备的等距调节机构,浙江省杭州市滨江区滨安路1197号6幢420室,310000
CN201510628139.5,20131011,CN105123716B,20170718,A01N43/90;A01P7/02;A01N43/36;,江苏龙灯化学有限公司,罗昌炎,一种含环氧虫啶和虫螨腈的杀虫组合物,江苏省苏州市昆山经济技术开发区龙灯路88号,215301
CN201510628740.4,20150928,CN105109053B,20170718,B29C69/00;,四川德拉普环保科技有限公司,李宏,管道内壁清洁装置用无轴螺旋加工工艺,四川省绵阳市科创区创业服务中心所属孵化器D区701号,621000
CN201510629331.6,20150928,CN105150802B,20170718,B60H1/00;,安徽江淮汽车集团股份有限公司,徐金志,一种重卡空调进风结构,安徽省合肥市桃花工业园始信路669号,230601
CN201510631035.X,20120418,CN105191943B,20170718,A01N43/40;A01N53/06;A01N53/08;A01P7/04;A01N31/14;,陕西韦尔奇作物保护有限公司,张伟,一种含氟虱磺胺与拟除虫菊酯类的杀虫组合物,陕西省渭南市陕西蒲城农化基地工业园区,715500
CN201510631870.3,20150929,CN105154603B,20170718,C21B3/06;,攀枝花环业冶金渣开发有限责任公司,鲜中菊,大块重矿渣处理方法,四川省攀枝花市东区荷花池钢城大道西段257号,617022
CN201510632465.3,20150929,CN105313278B,20170718,B29C45/32;B29C45/40;,苏州优耐鑫模具科技有限公司,吴志桃,叠层式注塑模具,江苏省苏州市吴中区甪直镇柯福路9号,215111
CN201510632664.4,20150929,CN105170984B,20170718,B22F3/22;B33Y30/00;B33Y10/00;,南京师范大学,杨建飞,一种三维打印装置及其控制方法,江苏省南京市板仓街78号,210046
CN201510634046.3,20150930,CN105177273B,20170718,C21D10/00;,江苏大学,鲁金忠,一种提高关键重要构件疲劳强度的激光冲击强化方法,江苏省镇江市京口区学府路301号,212013
CN201510634236.5,20150928,CN105131677B,20170718,C09D4/02;C09D7/12;D21H19/16;D21H21/12;,洋紫荆油墨(中山)有限公司,李永超,一种防爆线优异的UV固化光油及其制备方法,广东省中山市板芙镇顺景工业区,528459
CN201510635653.1,20150930,CN105127282B,20170718,B21D28/34;B21D37/12;,苏州龙行洲实业有限公司,黄晓雷,一种保持孔精度的五金模具,江苏省苏州市太仓市黄桥村三组,215400
CN201510635794.3,20150930,CN105104318B,20170718,A01K79/00;,舟山市铁木汉家具有限公司,何岱东,一种渔业生产中笼式作业自动拔笼装置,浙江省舟山市岱山县兰秀大道359号,316200
CN201510639371.9,20150930,CN105170339B,20170718,B03D1/018;B03B1/00;B03D101/02;B03D101/04;B03D103/02;,广西大学,魏宗武,一种回收尾矿中硫氧混合矿物的浮选方法,广西壮族自治区南宁市西乡塘区大学路100号,530004
CN201510639734.9,20150928,CN105236380B,20170718,C01B25/455;,广州天赐高新材料股份有限公司,九江天赐高新材料有限公司,高纯度二氟磷酸盐的制备方法,广东省广州市黄埔区云埔工业区东诚片康达路8号,510760
CN201510640467.7,20150930,CN105198891B,20170718,C07D487/22;H01L51/46;H01L51/54;,上海应用技术学院,李向清,一种金属卟啉配合物及其制备方法和应用,上海市徐汇区漕宝路120号,200235
CN201510642421.9,20150930,CN105155127B,20170718,D04B39/08;,冯加林,冯天元,毛衫织物线圈可变针距自动对目转移缝合机,江苏省南京市玄武区邓府巷18号2幢1702室,226625
CN201510642871.8,20150930,CN105217866B,20170718,C02F9/10;C02F11/12;C02F11/18;,广州中滔环境研究院有限公司,许振成,一种泥水净化器,广东省广州市增城新塘镇西洲村南蛇湾（办公楼）,511340
CN201510643272.8,20151008,CN105113759B,20170718,E04F15/04;,李承军,李承军,地暖型模块地板及其组件,湖南省长沙市芙蓉区马王堆街道人民东路5号东方之珠北栋1308室,410016
CN201510643956.8,20150930,CN105235084B,20170718,B28D7/00;B28D5/00;,浙江辉弘光电能源有限公司,陈小力,一种硅片切割机用切削液去水装置,浙江省嘉兴市平湖市经济开发区新兴三路899号,314200
CN201510644193.9,20151008,CN105153422B,20170718,C08G73/10;C08J9/02;C08L79/08;,清华大学,郭宝华,一种聚酰亚胺泡沫材料及其制备方法,北京市海淀区北京市信箱82分箱清华大学专利办公室,100084
CN201510644757.9,20150930,CN105086907B,20170718,C09J163/00;C09J11/06;C09J11/04;,日丰企业集团有限公司,日丰科技有限公司,一种防霉密封胶及其制备方法,广东省佛山市祖庙路16号日丰大厦8楼,528000
CN201510646418.4,20150930,CN105130986B,20170718,C07D471/04;A61K31/519;A61K31/55;A61K31/4545;A61P35/00;A61P35/02;,广州科擎新药开发有限公司,蔡雄,嘧啶或吡啶并吡啶酮类化合物及其应用,广东省广州市科学城崖鹰石路25号8楼,510660
CN201510648187.0,20151009,CN105165852B,20170718,A01N43/90;A01N25/22;A01N25/30;A01P7/02;,西南大学柑桔研究所,胡军华,一种用于杀虫的植物源农药,重庆市北碚区歇马镇柑桔村15号,400712
CN201510649709.9,20151010,CN105349779B,20170718,C22B3/22;,中冶北方（大连）工程技术有限公司,李国洲,一种以海水为选矿介质的铁精矿去钾钠系统及方法,辽宁省大连市开发区同汇路16号,116600
CN201510652110.0,20151010,CN105197091B,20170718,B62B9/12;,百澧有限公司,陈美凤,婴儿车改良构造,中国台湾台南市佳里区新生路441巷58弄9号,0
CN201510653053.8,20151011,CN105270961B,20170718,B66B9/02;,陈科,陈科,运送物品的升降装置,浙江省宁波市海曙区苍松路147弄2号,315000
CN201510653279.8,20140513,CN105220541B,20170718,D06P3/70;,南通大学,王春梅,拓展聚丙烯腈基碳纤维原丝废料用途的染色方法,江苏省南通市啬园路9号,226019
CN201510655076.2,20151010,CN105206046B,20170718,G08G1/00;,东南大学,张永,基于大数据的出租车服务站选址及可行性评价方法,江苏省南京市玄武区四牌楼2号,210096
CN201510657659.9,20151013,CN105195541B,20170718,B21C23/16;C22F1/10;,北京科技大学,姚志浩,超临界电站汽轮机叶片用GH4738合金细晶坯制备方法,北京市海淀区学院路30号,100083
CN201510660604.3,20151014,CN105220959B,20170718,E05B47/00;E05B45/10;E05B11/00;,天津大学,张云,一种机电类智能防盗报警门锁,天津市南开区卫津路92号,300072
