CN201510174751.X,20150414,CN104829850B,20170718,C08J3/24;C08L5/04;A61L31/04;A61L31/14;A61K47/36;A61K9/16;,华中科技大学,王芹,一种球形海藻酸钙凝胶微粒的制备方法,湖北省武汉市洪山珞喻路1037号,430074
CN201510370413.3,20150630,CN105014504B,20170718,B24B19/00;,广西农垦糖业集团红河制糖有限公司,甘红建,压榨机榨辊轴瓦碾磨系统及碾磨方法,广西壮族自治区来宾市兴宾区蒙村镇红河农场,546128
CN201510174897.4,20150414,CN104759035B,20170718,A61N5/06;,伍建柏,伍建柏,一种利用兹阳石制做保健用品的方法,湖南省长沙市人民中路1号远东公寓18楼C座,410005
CN201510371745.3,20150630,CN105022034B,20170718,G01S7/02;,西安电子科技大学,曹运合,集中式MIMO雷达的发射OFDM波形的优化设计方法,陕西省西安市太白南路2号,710071
CN201510376086.2,20150701,CN105032662B,20170718,B05B13/04;B05B13/02;,江苏省中跃涂装设备有限公司,张伟伟,一种铲车配重喷涂机器人,江苏省盐城市亭湖区盐东镇庆丰工业园,224050
CN201510376155.X,20150701,CN105146684B,20170718,A23N5/00;,杭州吉美伟斯农业科技有限公司,柴秀洪,山核桃破壳机,浙江省杭州市杭州经济技术开发区下沙街道围垦街436号1幢1层A区,311215
CN201510175675.4,20150414,CN104832680B,20170718,F16K11/074;F16K31/53;F16K31/54;,北京科勒有限公司,黄光银,一种出水切换装置,北京市密云县果园西路27号,101500
CN201510378518.3,20150701,CN105140494B,20170718,H01M4/38;H01M4/587;H01M10/0525;H01M4/36;H01M4/52;B82Y30/00;,齐鲁工业大学,何文,一种Fe<base:Sub>3</base:Sub>O<base:Sub>4</base:Sub>/Fe/C纳米复合电池电极材料的仿生合成方法,山东省济南市长清区大学路3501号,250353
CN201510378567.7,20150701,CN104941437B,20170718,B01D53/80;B01D53/50;,江苏揽山环境科技股份有限公司,凌斌,一种前置喷雾段的喷淋脱硫塔,江苏省南京市江宁区苏源大道19号九龙湖国际企业总部园,210037
CN201510379482.0,20150630,CN104930689B,20170718,F24H1/08;,孔令斌,孔令斌,一种环型燃烧室燃油燃气锅炉,四川省泸州市龙马潭区鱼塘镇烟厂宿舍1-2-9号,646600
CN201510379770.6,20150701,CN104990820B,20170718,G01N3/38;,河海大学,吉伯海,电磁式多轴疲劳试验机,江苏省南京市江宁开发区佛城西路8号,211100
CN201510175772.3,20150413,CN104789246B,20170718,F26B17/32;F26B11/06;C10B57/00;C10B57/08;C10B53/04;,陕西煤业化工集团神木天元化工有限公司,华陆工程科技有限责任公司,一种带除尘的低阶粉煤回转干燥工艺,陕西省榆林市神木县锦界工业园区,719319
CN201510380237.1,20150702,CN105037114B,20170718,C07C43/315;C07C41/48;,成都丽凯手性技术有限公司,袁伟成,一种2‑(2‑甲氧基乙氧基)乙醛缩二醇的制备方法,四川省成都市高新区紫薇东路16号,610041
CN201510380498.3,20150702,CN104946823B,20170718,C14C11/00;C09D175/04;,河南博奥皮业有限公司,马慧勤,花纹皮革生产工艺,河南省周口市项城市产业集聚区颍河路南段,466200
CN201510381466.5,20150627,CN104957078B,20170718,A01K63/04;,刘汉佑,陈巧英,水底自移动式增氧装置,浙江省温州市瓯海区梧田街道龙霞生活区荣欣花园8幢201室,325000
CN201510381713.1,20150703,CN105054932B,20170718,A61B5/055;,华中科技大学,王秀英,一种基于磁纳米粒子一次谐波幅值的成像方法,湖北省武汉市洪山区珞喻路1037号,430074
CN201510175961.0,20150414,CN104828808B,20170718,C01B32/184;C04B35/52;C04B35/622;,北京化工大学,武德珍,一种石墨烯薄膜的制备方法,北京市朝阳区北三环东路15号,100029
CN201510382822.5,20150702,CN104915277B,20170718,G06F11/267;,天津航天机电设备研究所,徐海亭,一种基于LabVIEW主动接收型的通信调试系统及其通信调试方法,天津市滨海新区高新区滨海科技园神舟大道101号,300301
CN201510383279.0,20150630,CN104939544B,20170718,A47B88/944;,伍志勇,伍志勇,家具抽屉的前面板摆动解锁结构,广东省佛山市顺德区勒流镇东风合安工业区一路1号,528300
CN201510383577.X,20150702,CN104939437B,20170718,A43D1/00;,广州那摩荙时尚电子商务股份有限公司,路彬,一种基于不同脚型的三维鞋楦模型结构设计方法,广东省广州市白云区黄园路马务联合工业区自编D2栋401号,510000
CN201510176269.X,20150415,CN104863964B,20170718,F16C33/18;,泉州市德源轴承实业有限公司,林德庆,一种缠绕式滑动轴承的成型方法,福建省泉州市洛江区河市镇溪埔工业区,362000
CN201510383728.1,20150703,CN104960470B,20170718,B60Q9/00;B60Q5/00;E05B81/04;E05B83/36;,南京金龙新能源汽车研究院有限公司,朱世强,一种用于消除开启车门引发事故的自动防护系统,江苏省南京市溧水区经济开发区柘塘滨淮大道369号,211200
CN201510176277.4,20150413,CN104907632B,20170718,B23D79/00;,中山火炬职业技术学院,熊立贵,磨头驱动机构及制罐模头网纹表面加工设备,广东省中山市火炬开发区中山港大道60号,528400
CN201510383761.4,20150703,CN105115913B,20170718,G01N21/31;,山东省科学院海洋仪器仪表研究所,褚东志,一种高精度吸光度检测装置,山东省青岛市市南区浙江路28号,266001
CN201510383773.7,20150703,CN105048724B,20170718,H02K15/00;H02K5/16;,杭州厚达自动化系统有限公司,方勇,通用型电机卡簧装配机,浙江省杭州市余杭区天目山西路58号,310023
CN201510384746.1,20150704,CN105003578B,20170718,F16F3/00;,安徽舒城华云弹簧制造有限公司,吴基超,阶变弹力的弹簧,安徽省六安市舒城县柏林乡,231300
CN201510176349.5,20150414,CN104787069B,20170718,B61D33/00;,江苏昊邦智能控制系统股份有限公司,张汉新,一种安装舒适度可调座椅靠背的火车座椅,江苏省常州市钟楼区龙城大道2219号,213000
CN201510386111.5,20150703,CN105038926B,20170718,C10M169/04;,上海尤希路化学工业有限公司,启东尤希路化学工业有限公司,纯阳离子带钢冷轧油,上海市宝山区富联路881号,201906
CN201510388151.3,20150703,CN104925897B,20170718,C02F1/32;C02F1/72;,江苏师范大学,孟庆华,一种磁场感应式光催化反应器及其降解使用方法,江苏省徐州市铜山新区上海路101号,221116
CN201510388306.3,20150703,CN104964483B,20170718,F25B30/06;F25B41/00;,中铁第四勘察设计院集团有限公司,车轮飞,一种热回收型污水源热泵系统,湖北省武汉市武昌杨园和平大道745号,430063
CN201510176896.3,20150415,CN104788718B,20170718,C08K5/098;C08K3/22;C09J11/06;C09J11/04;,江阴市三良橡塑新材料有限公司,徐京海,一种高稳定性新癸酸钴混合盐制备方法,江苏省无锡市江阴市华士镇工业园红星路88号,214421
CN201510388861.6,20150703,CN105304919B,20170718,H01M8/04186;H01M8/16;,北京科技大学,王晓玲,一种采用液滴微流控技术提高微生物燃料电池的输出功率的实验方法,北京市海淀区学院路30号,100083
CN201510390156.X,20150702,CN105004495B,20170718,G01M3/32;,高田（长兴）汽车安全装置有限公司,徐玉堂,气体发生器出气口铝箔贴附密封性检测装置及其检测方法,浙江省湖州市长兴县午山岗农科所,313104
CN201510390235.0,20150703,CN104967258B,20170718,H02K15/00;,深圳市志杰达自动化机械有限公司,姚国良,换向器、介子及转子组装用组立机,广东省深圳市宝安区观澜街道富坑社区大富工业区华创达科技园2栋2楼东区,518000
CN201510177055.4,20150415,CN104804106B,20170718,C08B37/00;,江苏天晟药业有限公司,季浩,一种高纯度肉苁蓉多糖的纯化方法,江苏省镇江市句容宝华开发区10号,212415
CN201510390943.4,20150706,CN105046869B,20170718,G08B17/12;,北京理工大学,云南北方驰宏光电有限公司,一种基于双波段融合理论的森林防火监控系统,北京市海淀区中关村南大街5号,100081
CN201510390948.7,20150706,CN104987737B,20170718,C08L95/00;C08L63/00;C08G59/14;C04B26/26;,交通运输部公路科学研究所,曹东伟,一种聚脲改性环氧沥青及混合料,北京市海淀区西土城路8号,100088
CN201510391187.7,20150706,CN105019282B,20170718,D07B1/02;D07B7/12;,胡齐放,方佳如,一种用于快速生产葛藤皮绳索的工艺,安徽省安庆市迎江区华圣路22号,246600
CN201510393194.0,20150707,CN104931790B,20170718,G01R27/08;G08C17/02;,国网山西省电力公司电力科学研究院,芦竹茂,陶瓷绝缘子绝缘电阻的遥控步进检测装置及其检测方法,山西省太原市青年路6号,030001
CN201510177504.5,20150415,CN104762784B,20170718,D06C7/02;D06C3/00;B01D46/00;B01D53/00;B01D50/00;,浙江精宝机械有限公司,徐浩然,拉幅定型机废气热能高温净化循环使用系统,浙江省绍兴市平水镇会稽村铸铺岙浙江精宝机械有限公司,312000
CN201510393520.8,20150706,CN104957970B,20170718,A47J27/04;A47J27/16;A47J36/00;,广东美的厨房电器制造有限公司,美的集团股份有限公司,蒸汽烹饪设备及其排汽装置,广东省佛山市顺德区北滘镇永安路6号,528311
CN201510393623.4,20150702,CN105021129B,20170718,G01B11/00;,高田（长兴）汽车安全装置有限公司,李佳,气体发生器点火针装配偏转度检测方法,浙江省湖州市长兴县午山岗农科所,313104
CN201510178273.X,20150415,CN104820209B,20170718,G01S7/282;,中国民用航空总局第二研究所,吴宏刚,一种民航用多点定位的询问发射机及其询问方法,四川省成都市高新区高新技术开发区二环路南二段17号,610041
CN201510393629.1,20150707,CN104890513B,20170718,B60K26/02;,蔡姝婕,王震宇,一种防误踩汽车电子油门踏板系统,江苏省南通市如东县栟茶镇邮电巷5号17室,226400
CN201510395232.6,20150708,CN104964998B,20170718,G01N25/20;G01N25/12;,山东祥通橡塑集团有限公司,江建梁,耐灼烧输送带耐烧灼实验方法,山东省济宁市高新区凯旋路1号(祥通胶带),272000
CN201510395911.3,20150708,CN105003579B,20170718,F16F3/00;,安徽舒城华云弹簧制造有限公司,吴基超,稳定型弹簧组件,安徽省六安市舒城县柏林乡,231300
CN201510178318.3,20150415,CN104776675B,20170718,F25D23/02;,合肥华凌股份有限公司,美的集团股份有限公司,冰箱顶盖及冰箱,安徽省合肥市经济技术开发区锦绣大道,230601
CN201510395924.0,20150707,CN105071858B,20170718,H04B10/2513;,华中科技大学,唐明,一种光纤通信系统中的色散估计方法,湖北省武汉市洪山区珞喻路1037号,430074
CN201510395941.4,20150707,CN105002476B,20170718,C23C16/30;C23C16/02;,南京大学,王迪,一种衬底修饰的化学气相沉积生长大尺寸单层二硫化钼薄膜的方法,江苏省南京市鼓楼区汉口路22号,210093
CN201510178893.3,20150416,CN104777230B,20170718,G01N29/14;,哈尔滨工业大学,章欣,一种基于声发射技术的车载移动式高速铁路钢轨伤损检测方法,黑龙江省哈尔滨市南岗区西大直街92号,150000
CN201510396270.3,20150708,CN105003576B,20170718,F16F1/26;,安徽舒城华云弹簧制造有限公司,吴基超,皮卡减震板簧的制备方法,安徽省六安市舒城县柏林乡,231300
CN201510396550.4,20150708,CN105041932B,20170718,F16F1/04;,安徽舒城华云弹簧制造有限公司,吴基超,异变螺旋弹簧,安徽省六安市舒城县柏林乡,231300
CN201510396551.9,20150708,CN104984763B,20170718,B01J31/34;C02F1/30;,上海应用技术学院,张志洁,一种聚噻吩/钼酸铋复合光催化剂及其制备方法,上海市徐汇区漕宝路120号,200235
CN201510398527.9,20150707,CN104911661B,20170718,C25D7/06;C25D5/10;C25D11/38;,安徽铜冠铜箔有限公司,合肥铜冠国轩铜材有限公司,一种使用处理装置减少铜箔毛面铜粉的工艺,安徽省池州市经济技术开发区清溪大道189号,247000
CN201510398837.0,20150708,CN104929383B,20170718,E04H1/02;B05B17/08;B05B12/00;,徐亚男,徐亚男,一种利用路由管理的景观别墅及管理方法,广东省深圳市福田区福华一路6号免税商务大厦1403,518000
CN201510399075.6,20150708,CN105019367B,20170718,E01F3/00;B64D9/00;,珠海磐磊智能科技有限公司,何春旺,飞行器用停靠装置及其控制方法,广东省珠海市横琴新区宝华路6号105室-14724,519000
CN201510400806.4,20150709,CN104943240B,20170718,B31B70/84;,中山市新宏业自动化工业有限公司,彭正华,一种包装袋焊嘴机,广东省中山市火炬开发区沙边路13号,528400
CN201510178938.7,20150416,CN104777210B,20170718,G01N27/416;,中国科学院地球化学研究所,李和平,用于高压水热体系的三电极电化学测量系统及其制备方法,贵州省贵阳市观山湖区林城西路99号,550081
CN201510400868.5,20150709,CN104900194B,20170718,G09G3/3208;,京东方科技集团股份有限公司,鄂尔多斯市源盛光电有限责任公司,像素电路及驱动方法、显示装置,北京市朝阳区酒仙桥路10号,100015
CN201510402093.5,20150708,CN104949467B,20170718,F25D29/00;,合肥美的电冰箱有限公司,美的集团股份有限公司,主控板故障检测电路和冰箱,安徽省合肥市长江西路669号,230031
CN201510179849.4,20150415,CN104759651B,20170718,B23B29/32;,常州优思塔精密机械有限公司,张华,一种内置动力电机的轴向动力刀塔,江苏省常州市武进高新区西湖路120号,213164
CN201510402442.3,20150709,CN105153639B,20170718,C08L63/00;C08K7/14;C08K7/24;,河海大学,南通河海大学海洋与近海工程研究院,一种碳纳米管微球/玻璃纤维协同增强环氧复合材料的制备方法,江苏省南京市江宁区佛城西路8号,211106
CN201510403066.X,20150710,CN105003632B,20170718,F16H57/023;F16H3/42;,席昊,席昊,一种机械直接无级变速器,广东省深圳市龙岗区坂田四季花城水仙苑D601,518000
CN201510403899.6,20150710,CN104998697B,20170718,B01J37/02;B01J21/16;B01J32/00;B01J23/89;,上海纳米技术及应用国家工程研究中心有限公司,何丹农,一种整体式催化剂活性涂层的涂敷方法,上海市闵行区江川东路28号,200241
CN201510180878.2,20150416,CN105035914B,20170718,B66B11/02;B66B9/00;,株式会社日立制作所,萩原高行,带气压控制装置的电梯和其设定方法、制造方法,日本东京都,0
CN201510404977.4,20150707,CN105037440B,20170718,C07F9/6574;C08K5/5357;C08K5/3492;C08L67/02;,广州布司曼化工科技有限公司,王彦林,阻燃剂双磷酰笼状磷酸酯化合物的制备方法,广东省广州市天河区珠村东横三路6号C2A08,510000
CN201510405572.2,20150702,CN105129307B,20170718,B65G1/137;,魏淑琴,魏淑琴,智能中药取药装置,山东省青岛市市北区人民路4号青岛海慈医疗集团A楼4楼养生体检中心,266033
CN201510180927.2,20150416,CN104808210B,20170718,G01S15/89;H04N13/02;,深圳大学,徐渊,一种声纳和双目视觉成像系统的融合成像装置及方法,广东省深圳市南山区南海大道3688号,518000
CN201510405766.2,20150710,CN104974557B,20170718,C09C3/00;C09C3/06;C09C3/12;C09C3/08;C09C1/04;C09C1/36;C09C1/28;C09C1/00;C09C1/40;C09C1/24;,上海纳米技术及应用国家工程研究中心有限公司,何丹农,利用超临界二氧化碳改性超细氧化物粉体的方法,上海市闵行区江川东路28号,200241
CN201510405875.4,20150710,CN104917169B,20170718,H02H9/08;G01R27/26;,山东大学,殷鹏,用于中性点经消弧线圈接地系统的对地电容检测方法,山东省济南市历下区经十路17923号,250061
CN201510406670.8,20150712,CN105126388B,20170718,B01D15/22;,北京化工大学,杨俊佼,一种硅胶整体柱的制备方法,北京市朝阳区北三环东路15号,100029
CN201510181105.6,20150416,CN104750613B,20170718,G06F11/36;,中国科学院重庆绿色智能技术研究院,李轶,一类有界闭连通域上的循环程序终止性判断方法,重庆市北碚区方正大道266号,400714
CN201510406865.2,20150713,CN105065700B,20170718,F16K3/16;F16K31/122;,哈托利海托阀门(杭州)有限公司,江健,一种自密封式闸阀结构,浙江省杭州市桐庐县瑶琳镇工业功能区,311516
CN201510182840.9,20150417,CN104846414B,20170718,C25D11/26;H01G9/20;H01G9/042;,江苏大学,王云龙,一种TiO<base:Sub>2</base:Sub>半导体光阳极的微弧氧化制备方法,江苏省镇江市京口区学府路301号,212013
CN201510407204.1,20150713,CN105005169B,20170718,G03B5/00;,成都西纬科技有限公司,祝久军,基于OIS矢量动态加权控制的拍照防抖动装置及方法,四川省成都市高新区天华二路219号12栋3层,610041
CN201510407777.4,20150713,CN104928611B,20170718,C23C4/06;C23C4/134;C22C19/03;C22C32/00;,中国人民解放军第二炮兵工程大学,袁晓静,一种宽温域抗粘蚀固体自润滑涂层及其制备方法,陕西省西安市灞桥区同心路2号,710025
CN201510407980.1,20150713,CN105047442B,20170718,H01H1/0237;,青海大学,铁生年,一种Ag‑CuO低压触点材料及其制备方法,青海省西宁市宁大路251号,810016
CN201510183131.2,20150417,CN104815996B,20170718,B23B27/00;B23B1/00;,柳州蔚园塑料彩印包装有限责任公司,李国华,聚酯塑料件加工方法,广西壮族自治区柳州市柳江县新兴工业园利业路3号,545007
CN201510408175.0,20150710,CN105132066B,20170718,C10L5/44;,郎溪县志瑞企业信息服务有限公司,孙中,生物质燃料制备方法,安徽省宣城市郎溪县经济开发区合力安居商住楼2号2-201室,242100
CN201510408336.6,20150713,CN104985225B,20170718,B23B41/14;B23B41/16;B23B47/00;B23Q11/12;B23Q1/01;,长春理工大学,许金凯,小型超声波高速钻削数控机床,吉林省长春市朝阳区卫星路7089号,130022
CN201510183913.6,20150417,CN104742737B,20170718,B60K23/00;,北京汽车研究总院有限公司,董伟,一种分动器换挡操纵机构及汽车,北京市顺义区仁和镇双河大街99号,101300
CN201510408433.5,20150713,CN105098272B,20170718,H01M10/44;,惠州亿纬锂能股份有限公司,袁中直,一种安全的锂二次电池充电方法,广东省惠州市仲恺高新区惠风七路36号,516006
CN201510408478.2,20150710,CN105044766B,20170718,G01V1/04;G01M7/02;,合肥工业大学,安徽新视野科教文化传播有限责任公司,用于联动的地震模拟平台的同步状态检测装置,安徽省合肥市屯溪路193号,230009
CN201510408715.5,20150713,CN105065046B,20170718,E21D23/04;,辽宁工程技术大学,张强,一种液压支架邻架间柔性防护装置,辽宁省阜新市中华路47号,123000
CN201510184120.6,20150417,CN104826491B,20170718,B01D53/90;B01D53/56;B01D46/54;,成都易态科技有限公司,高麟,金属间化合物多孔基体复合滤芯元件及其制备方法,四川省成都市高新西区西芯大道4号A202,611731
CN201510409388.5,20150713,CN104988285B,20170718,C21C7/10;C21C7/072;C21C7/068;C21C7/06;,北京科技大学,郭汉杰,一种单管式多功能真空精炼系统及其方法,北京市海淀区学院路30号,100083
CN201510409417.8,20150713,CN104941651B,20170718,B01J23/80;C02F1/32;C02F101/30;,北京科技大学,李妍,一种含铜的氧化锌/石墨烯量子点催化剂及制备方法,北京市海淀区学院路30号,100083
CN201510410718.2,20150714,CN105165512B,20170718,A01G17/00;,广西壮族自治区林业科学研究院,曹艳云,台湾桤木控偏冠四季扦插快繁方法,广西壮族自治区南宁市西乡塘区邕武路23号,530002
CN201510411057.5,20150714,CN105019816B8,20170718,E06C1/30;E06C1/387;E06C7/08;E06C7/06;E06C7/42;E06C7/50;H02G1/02;,徐毓艺,徐培钟,电力维修梯,重庆市长寿区长寿路96号,401200
CN201510184379.0,20150417,CN104744717B,20170718,C08J7/04;C09D133/14;C09D7/12;B05D7/24;C08F220/36;C08F220/28;C08F220/58;,西安科技大学,李赛,一种光固化制备磷酰胆碱仿生涂层的方法,陕西省西安市雁塔路58号,710054
CN201510411726.9,20150714,CN105150825B,20170718,B60K6/26;B60K6/38;B60W20/10;,中国人民解放军装甲兵技术学院,王加雪,一种多轴驱动重型车辆混合动力装置及其控制方法,吉林省长春市经开区花园路1号,130117
CN201510412548.1,20150714,CN105370797B,20170718,F16G13/04;F16G15/00;,株式会社椿本链条,佐藤利文,无声链及无声链传动装置,日本大阪,0
CN201510184767.9,20150417,CN104802167B,20170718,B25J9/16;,东南大学,冯李航,基于MAPLESIM的Delta机器人快速建模方法,江苏省南京市玄武区四牌楼2号,210096
CN201510414600.7,20150715,CN105147515B,20170718,A61H35/04;,沈挺,沈挺,鼻腔冲洗器,上海市长宁区中山西路800弄55号紫云大厦2楼C座,200051
CN201510415314.2,20150715,CN105155292B,20170718,D06N3/14;D06N3/00;C08L75/04;C08K9/04;C08K3/34;D06M15/564;D06M11/79;D06M101/38;,浙江锦尚合成革有限公司,田树松,一种环保型仿真皮合成革的制备方法,浙江省湖州市长兴县和平镇回车岭工业集中区,313103
CN201510184893.4,20150420,CN104851956B,20170718,H01L33/48;H01L33/50;,绍兴文理学院,谭永胜,一种近紫外激发白光LED光源,浙江省绍兴市越城区环城西路508号,312000
CN201510415995.2,20150715,CN105116383B,20170718,G01S7/282;G01S7/38;,电子科技大学,邵怀宗,产生FDA雷达的发射波束的方法、装置及FDA雷达,四川省成都市高新区（西区）西源大道2006号,611731
CN201510416372.7,20150716,CN105004687B,20170718,G01N21/31;G01N21/01;,江苏大学,张荣标,一种用于COD检测的定容进液计量方法与装置,江苏省镇江市京口区学府路301号,212013
CN201510416734.2,20150716,CN105021582B,20170718,G01N21/64;G01N1/40;,广西大学,陆建平,用固相萃取‑原子荧光光谱法测定大米中的痕量砷的方法,广西壮族自治区南宁市西乡塘区大学路100号,530004
CN201510184992.2,20150420,CN104874702B,20170718,B21F1/00;B21F99/00;,四川星达铜业有限公司,彭德均,双零线快速过线器,四川省德阳市中江县南华镇二环路西四段59号一楼,618000
CN201510416763.9,20150715,CN105070069B,20170718,G08G1/07;,河海大学,张丽丽,一种支持时间调整和紧急情况处理的交通灯控制方法,江苏省南京市江宁区佛城西路8号,211100
CN201510418252.0,20150716,CN105090305B,20170718,F16F1/06;B29C45/14;B29C45/26;,嘉善三方电力器材有限公司,魏康军,一种复合材料中空弹簧及制备方法和制备模具,浙江省嘉兴市嘉善县经济开发区天山路9号,314100
CN201510185276.6,20150417,CN104777689B,20170718,G02F1/1362;G02F1/1343;G02F1/1345;,京东方科技集团股份有限公司,王强涛,阵列基板及显示装置,北京市朝阳区酒仙桥路10号,100015
CN201510418892.1,20150716,CN105270446B,20170718,B61L27/00;,株式会社日立制作所,李栋,列车管理系统,日本东京,0
CN201510421307.3,20150717,CN105275705B,20170718,F02N11/10;,通用汽车环球科技运作有限责任公司,Y.A.高奈姆,评估用于内燃发动机的起动机的方法和装置,美国密执安州,0
CN201510421319.6,20150902,CN105083706B,20170718,B65D23/10;,广东紫丁香实业股份有限公司,梁国全,新型连体安装方式的圈套结构,广东省中山市小榄镇华成路1号,528400
CN201510185720.4,20150420,CN104875984B,20170718,B65D90/22;,中国石油化工股份有限公司青岛安全工程研究院,中国石油化工股份有限公司,储罐气相连通方法,山东省青岛市市南区延安三路218号,266071
CN201510421575.5,20150717,CN105003077B,20170718,E04G21/04;,中国建筑第二工程局有限公司,中建电力建设有限公司,一种密闭空间混凝土浇筑装置及施工方法,北京市西城区广安门南街42号中建二局大厦,100054
CN201510421740.7,20150718,CN104979790B,20170718,H02G7/14;H02G7/12;,国网山东蓬莱市供电公司,王晓涵,一种相间间隔棒弹簧阻尼装置,山东省烟台市蓬莱市钟楼西路355号,265600
CN201510422031.0,20150719,CN105060072B,20170718,B66B9/08;,成都易禧科技管理发展有限公司,林海,一种楼梯通道顶板上的螺旋升降共享型座位式智能化入户电动电椅装置的安装方式和使用方法,四川省成都市高新区天府大道高新孵化园,610000
CN201510185757.7,20150420,CN104826254B,20170718,A62C2/10;,浙江省建筑设计研究院,钱杰,升降式消烟挡烟垂壁,浙江省杭州市下城区安吉路18号,310000
CN201510422195.3,20150717,CN105060150B,20170718,B66D1/26;,中联重科股份有限公司,陈宇,卷筒装置和起重机的起升机构,湖南省长沙市岳麓区银盆南路361号,410013
CN201510422277.8,20150717,CN105012345B,20170718,A61K33/38;A61P31/04;A61P31/10;A61P31/12;A01N59/16;A01P1/00;A01P3/00;,李远平,李远平,一种散射银离子化合物的制备方法,江苏省南京市高新开发区星火路10号鼎业百泰生物大楼C座501-1室,210032
CN201510422378.5,20150711,CN105110623B,20170718,C03B33/06;,李根铭,李根铭,废旧显像管自动切割机,江西省赣州市石城县清华南大道工业园西区一号,342700
CN201510185980.1,20150420,CN104818804B,20170718,E04C5/12;E04C5/08;E04H12/16;E01D19/14;E01D101/28;,北京交通大学,朱尔玉,一种抗扭转松脱夹片式锚具组装件体系,北京市海淀区西直门外上园村3号,100044
CN201510423566.X,20150715,CN104959907B,20170718,B24B37/005;B24B37/013;B24B37/04;,合肥京东方光电科技有限公司,京东方科技集团股份有限公司,研磨装置和研磨方法,安徽省合肥市新站区铜陵北路2177号,230012
CN201510425567.8,20150720,CN105061392B,20170718,C07D319/20;,上海现代哈森（商丘）药业有限公司,王英利,一种硫酸胍生合成方法,河南省商丘市梁园区永安街12号,476000
CN201510426705.4,20150720,CN105038329B,20170718,C09C1/36;C09C3/10;C09C3/06;,攀钢集团钛业有限责任公司,肖勇丽,一种二氧化钛的打浆分散方法,四川省攀枝花市金沙江大道东段1491号,617063
