CN201710067715.2,20170207,CN107042986A,20170815,B65G17/40;,苏州环球集团科技股份有限公司,黄伟达,一种改进倍速链,江苏省苏州市吴中区胥口镇石中路188号,215164
CN102017000264413,20170421,CN107043749A,20170815,C12N5/0783;,北京奥康华医学检验所有限公司,卢戌,一种肿瘤浸润T淋巴细胞的分离诱导方法,北京市顺义区裕华路28号北京空港科技园B区2号楼东1层,101300
CN102017000232832,20170411,CN107043903A,20170815,C22F1/06;C22C23/00;C22C32/00;C22C29/06;,北京交通大学,于文波,定向织构化Ti<base:Sub>2</base:Sub>AlC‑Mg基复合材料及其热挤压制备方法,北京市海淀区西直门外上园村3号,100044
CN102017000069261,20170208,CN107045276A,20170815,G04B19/253;,精工电子有限公司,铃木重男,日历机构、机芯以及钟表,日本千叶县,0
CN102017000268043,20170422,CN107043381A,20170815,C07D487/22;C09K19/40;,桂林理工大学,孔翔飞,苯并菲十二烷氧基桥连异辛烷氧基苯基卟啉金属Zn配合物的合成方法,广西壮族自治区桂林市七星区建干路12号,541004
CN102017000218689,20170405,CN107042587A,20170815,B28C5/42;,徐金榜,周宏,双卧轴强制搅拌斗及搅拌车,山东省烟台市莱州市沙河镇沙河路501号,261432
CN201710106732.2,20090312,CN107043418A,20170815,C07K16/26;C12N15/17;C07K14/62;G01N33/68;G01N33/74;,奥塔哥创新有限公司,克里斯托弗·约瑟夫·彭伯顿,生物标记物,新西兰丹尼丁,0
CN102017000068564,20170208,CN107046234A,20170815,H02B1/048;H05K5/00;,菲尼克斯电气公司,S·吉费尔斯,用于将功能单元固定在设备壁上的安装架,德国勃郎贝克,0
CN102017000164264,20170320,CN107043533A,20170815,C08L77/00;C08K3/08;,深圳军创节能环保科技有限公司,王锋,一种尼龙复合材料及其制备方法,广东省深圳市福田区梅林街道中康路雕塑家园2130,518000
CN102017000236954,20170412,CN107046285A,20170815,H02J3/00;,国家电网公司,国网河南省电力公司郑州供电公司,一种基于混合量测的配电网状态评估方法,北京市西城区西长安街86号,100031
CN102017000183507,20170324,CN107046362A,20170815,H02M1/32;,苏州汇川联合动力系统有限公司,刘畅,一种高压母线电容的复合式主动放电方法以及系统,江苏省苏州市吴中区越溪天鹅荡路52号,215000
CN102017000271092,20170424,CN107045465A,20170815,G06F11/22;G06F3/14;,郑州云海信息技术有限公司,孙海鹏,一种服务器诊断结果图文化显示的方法及装置,河南省郑州市郑东新区心怡路278号16层1601室,450000
CN102017000249901,20170417,CN107042008A,20170815,A62C37/10;F16K27/12;F16K41/04;F16K31/02;,陕西安益机电有限公司,于志敏,一种电控气体驱动装置,陕西省宝鸡市陈仓区千渭李家崖,721300
CN102017000157077,20170316,CN107042048A,20170815,B01D50/00;,华南理工大学,广东埃森环保科技有限公司,一种重力热管式除雾方法及除雾装置,广东省广州市天河区五山路381号,510640
CN102017000069425,20170208,CN107044346A,20170815,F02C7/06;F02K3/06;,通用电气公司,R.S.加尼格,高负载事件期间的轴承外座圈固位,美国纽约州,0
CN201710066531.4,20170207,CN107043273A,20170815,C04B38/02;C04B28/00;C04B111/20;C04B111/27;C04B111/28;C04B111/40;,马鞍山十七冶工程科技有限责任公司,雷团结,一种地聚物发泡轻集料混凝土及其制备方法,安徽省马鞍山市雨山区天门大道中段528号,243000
CN102017000156901,20170316,CN107042370A,20170815,B23K35/30;B23K35/40;,南京航空航天大学,王少刚,一种高Cr含量Ni基耐高温合金焊丝及制备工艺,江苏省南京市白下区御道街29,210016
CN201710067003.0,20170207,CN107045597A,20170815,G06F21/31;G06F21/45;,株式会社理光,佐久间刚,信息处理装置、认证方法以及信息处理系统,日本东京都,0
CN102017000218901,20170405,CN107044743A,20170815,F25B30/06;F28D15/02;,广东工业大学,王璋元,一种利用微通道环路热管的太阳能热泵系统,广东省广州市东风东路729号,510000
CN102017000149164,20170224,CN107042330A,20170815,B23C3/06;B23Q5/36;B23Q3/08;,浙江太阳股份有限公司,朱宝锦,一种加工曲轴扇形定位面及分组打印面的一体式数控铣床,浙江省绍兴市杭州湾上虞工业园区朝阳三路（浙江太阳股份有限公司）,312369
CN102017000186312,20170327,CN107043265A,20170815,C04B35/66;C04B35/047;C04B35/622;C04B35/63;C04B35/64;,孙光,郭全营,一种冶金、有色熔炼炉用不烧镁铬砖及其制备方法,辽宁省丹东市振兴区花园街道万达广场A座1403,118000
CN102017000068488,20170208,CN107043536A,20170815,C08L83/04;C08L95/00;C08L9/06;C08K13/02;C08K3/04;C08K3/22;C08K3/26;C08K5/09;C08K5/12;C08K5/18;C08K5/40;A43B13/04;,南京东亚橡塑制品有限公司,葛胜超,一种低硬度拖鞋鞋底材料的制备方法,江苏省南京市溧水区永阳街道秦淮路34号,211299
CN102017000068200,20170208,CN107044910A,20170815,G01M13/00;G01N3/12;G01N3/04;,江苏神通阀门股份有限公司,张逸芳,阀门试压装置,江苏省南通市启东市南阳工业园区三号基地,226232
CN102017000278058,20170425,CN107046241A,20170815,H02B1/30;H02B1/20;H02B1/32;,川开电气有限公司,张兵,核电站用直流开关柜,四川省成都市双流县协和街道华府大道二段1158号,610213
CN201710101576.0,20170224,CN107044267A,20170815,E21B33/03;,加加力重钢江苏有限公司,李圣根,一种光杆密封器,江苏省镇江市扬中市油坊镇长旺村,212000
CN102017000222441,20170407,CN107045417A,20170815,G06F3/0484;G06F3/14;H04M1/725;G09G5/02;,广东欧珀移动通信有限公司,陈永兴,屏幕色温调节方法、装置及其设备,广东省东莞市长安镇乌沙海滨路18号,523860
CN102017000070603,20170209,CN107046769A,20170815,H05K1/09;H05K3/38;,JX金属株式会社,三木敦史,印刷配线板用积层体、印刷配线板的制造方法及电子机器的制造方法,日本东京都,0
CN102017000129311,20170306,CN107044287A,20170815,E21D11/00;E21D11/10;C04B28/14;,刘冲,刘冲,煤矿井底车场及轨道大巷的加固方法,山西省阳泉市矿区桃北西路西区8号楼1门,045000
CN102017000116165,20170301,CN107046289A,20170815,H02J3/24;,国电南瑞科技股份有限公司,国家电网公司华东分部,计及安控策略和一次调频特性的电网稳态频率估算方法,江苏省南京市江宁区诚信大道19号,211106
CN102017000236177,20170412,CN107044071A,20170815,D21H21/20;D21H17/54;D21H17/06;,镇江市天亿化工研究设计院有限公司,朱红兵,一种湿强剂的生产方法,江苏省镇江市千秋桥街16号,212000
CN102017000140785,20170310,CN107045037A,20170815,G01N31/12;,同济大学,陈永全,一种悬挂式单液滴燃烧系统,上海市杨浦区四平路1239号,200092
CN102017000259601,20170420,CN107041777A,20170815,A61B17/34;,温州医科大学附属第二医院、温州医科大学附属育英儿童医院,徐雷,一种全自动穿刺针定位装置,浙江省温州市鹿城区学院西路109号,325000
CN102017000158021,20170316,CN107046733A,20170815,H04W74/08;H04B10/116;,中山大学,林培嵩,基于信道预约机制的可见光全双工连续传输随机接入方法,广东省广州市新港西路135号中山大学,510275
CN102017000131160,20170307,CN107046781A,20170815,H05K5/00;H05K5/02;H05K7/10;E04B9/00;D06F58/00;,浙江美尔凯特集成吊顶有限公司,沈业勇,集成在吊顶上的组合电器,浙江省嘉兴市秀洲区王店镇东西一路北侧,314011
CN102017000210320,20170331,CN107045674A,20170815,G06Q10/06;,北京国电通网络技术有限公司,国网安徽省电力公司,基于可量化指标体系的供应商评价方法,北京市丰台区航丰路一号时代财富天地大厦28层,100070
CN102017000133126,20170308,CN107042979A,20170815,B65G1/04;B65G1/137;,江苏华章物流科技股份有限公司,华聚良,一种穿梭车翻爪控制方法,江苏省南京市江宁经济技术开发区丹阳大道88号18栋,211153
CN102017000199782,20170330,CN107041810A,20170815,A61F11/00;A61N1/36;,中山大学孙逸仙纪念医院,广州嘿麦医疗科技有限公司,一种基于纯音刺激的耳鸣治疗系统及治疗仪,广东省广州市沿江西路107号,510120
CN102017000219127,20170406,CN107043745A,20170815,C12N5/0775;,中国科学院理化技术研究所,牛忠伟,一种可体外保持骨髓间充质干细胞多能性的方法,北京市海淀区中关村东路29号,100190
CN102017000070082,20170209,CN107045271A,20170815,G03G15/00;G03G21/16;,佳能株式会社,垣谷昌基,成像装置和片材供给设备,日本东京,0
CN102017000219806,20170406,CN107044258A,20170815,E21B6/04;,张家港保税区永大机械有限公司,李涛,一种多频液压旋转冲击钻,江苏省苏州市张家港保税区广东路11号,215634
CN102017000251294,20170418,CN107042946A,20170815,B65D81/05;B65D85/34;B65D81/36;B65D25/06;,李志东,李志东,一种带有保护功能的柿子承载移动箱,山东省青岛市市南区燕儿岛路57号102,266073
CN102017000124850,20170303,CN107044194A,20170815,E04D3/35;,筑成联合资产管理有限公司,高晴,一种屋面板,北京市海淀区万寿路乙15号院C座9层,100036
CN102017000261232,20170420,CN107042863A,20170815,B62M1/12;,王小东,王小东,一种把手转动型前后驱动自行车,陕西省西安市高新区唐延南路11号逸翠园I都会3号楼3单1412室,710000
CN102017000216519,20170405,CN107043835A,20170815,C21B5/00;C21B7/00;,大峘集团有限公司,徐广龙,一种喷煤总管防堵塞装置及其工作方法,江苏省南京市江宁区天元东路368号,211112
CN102017000185897,20170324,CN107045861A,20170815,G09G3/36;,惠科股份有限公司,重庆惠科金渝光电科技有限公司,差分信号传输电路和显示装置,广东省深圳市宝安区石岩街道水田村民营工业园惠科工业园,518000
CN102017000157084,20170316,CN107042868A,20170815,B62M25/04;,珠海蓝图控制器科技有限公司,刘春生,一种自行车指拨变速器,广东省珠海市金湾区航空新城规划展馆三楼312-43房,519090
CN102017000130967,20170307,CN107042093A,20170815,B01J20/24;B01J20/28;B01J20/30;C02F1/28;C02F101/20;,四川大学,杜开峰,一种复合磁性羟基磷灰石大球吸附材料的制备方法,四川省成都市武侯区一环路南一段24号,610065
CN102017000131838,20170307,CN107046774A,20170815,H05K3/00;H05K3/28;H05K3/40;,惠州中京电子科技有限公司,冯佳骥,一种改善PCB防焊冒油的方法,广东省惠州市仲恺高新区陈江镇中京路1号,516029
CN102017000273562,20170424,CN107046134A,20170815,H01M4/73;,重庆远风机械有限公司,杨军,蓄电池大型板栅浇铸设备,重庆市万州区五桥百安大道1111号,404120
CN102017000158778,20170317,CN107041830A,20170815,A61H7/00;A45D44/00;,济南沙之聚商贸有限公司,王建,一种新式美容仪,山东省济南市历下区解放东路５９号院内西二层－Ａ１４,250014
CN102017000132911,20170307,CN107042309A,20170815,B22F3/115;B22F3/03;B28B1/24;B28B7/28;,长沙理工大学,杨现锋,一种水溶性型芯部件及其制备方法,湖南省长沙市天心区万家丽南路2段960,410114
CN102017000249732,20170417,CN107044675A,20170815,F24C15/20;F21V33/00;F21V19/00;F21V29/71;F21V29/70;F21V29/89;F21Y115/10;,全南县智护力工业产品设计有限公司,不公告发明人,一种油烟机上的照明灯,江西省赣州市全南县解放桥临时水果市场,341800
CN102017000127866,20170306,CN107045345A,20170815,G05D1/02;,吉林大学,王帅,基于互联网的履带车辆远程控制及自动驾驶系统,吉林省长春市前进大街2699号,130012
CN102017000173004,20170322,CN107045670A,20170815,G06Q10/06;G06Q50/04;,浙江工业大学,范菁,基于特征的工厂制造流程差别检测方法,浙江省杭州市下城区潮王路18号浙江工业大学科技处,310014
CN102017000186459,20170324,CN107044941A,20170815,G01N3/24;,中国科学院金属研究所,李阁平,一种广泛适用于微型样品的单剪切性能测试方法,辽宁省沈阳市沈河区文化路72号,110015
CN102017000156862,20170316,CN107045093A,20170815,G01R31/08;,西安理工大学,焦尚彬,基于快速S变换的小电流单相接地故障选线方法,陕西省西安市金花南路5号,710048
CN102017000156138,20170315,CN107042234A,20170815,B21B1/16;B21B37/00;B21B37/74;B21B38/00;,中冶华天工程技术有限公司,蒲春雷,基于棒材全流程大数据采集的智能化工艺生产线及生产方法,安徽省马鞍山市湖南西路699号,243005
CN201710099948.0,20170223,CN107043567A,20170815,C09D7/12;C09D7/02;C09D133/04;,徐晨毓,徐晨毓,一种纳米二氧化钛改性方法以及应用该改性纳米二氧化钛的涂料的制备方法,浙江省舟山市定海临城定沈路285号浙江省舟山中学,316000
CN102017000158205,20170316,CN107043660A,20170815,C11D10/02;,长沙协浩吉生物工程有限公司,严超,一种酵素洗碗机专用洗涤剂的配制方法,湖南省长沙市开福区东风路街道德雅路91号（原砚瓦池28号楼）402房,410005
CN102017000187733,20170327,CN107044455A,20170815,F15B1/02;F15B21/14;,华侨大学,林添良,一种液压蓄能器压力主动控制系统及控制方法,福建省泉州市丰泽区城东,362000
CN102017000200622,20170330,CN107044991A,20170815,G01N24/08;,南昌大学,张锦胜,一种基于CoFeB纳米探针筛选厌氧菌中药抑制剂的方法,江西省南昌市红谷滩新区学府大道999号,330031
CN102017000156518,20170316,CN107045048A,20170815,G01N33/18;G01N27/02;G01D21/02;H04N7/18;,广西精工海洋科技有限公司,宋建强,一种养殖水水质在线监测系统,广西壮族自治区北海市银海区福成镇西村北海海洋产业科技园科研二路以东、海滨路以西以北,536000
CN102017000251651,20170418,CN107042901A,20170815,B65B11/38;B65B25/00;,成都三可实业有限公司,杜国先,一种片状口香糖包装机的折纸装置,四川省成都市新都区新都工业开发区新力路14号,610500
CN102017000181422,20170324,CN107041627A,20170815,A47B13/00;A47B9/00;A47B97/00;,江苏工程职业技术学院,刘春辉,一种可自由升降高度的办公桌,江苏省南通市青年中路87号,226000
CN102017000129634,20170125,CN107044320A,20170815,F01N3/20;F02B1/12;F02B37/00;F02M26/06;,福特环球技术公司,J·克默林,用于HCCI操作的自动点火内燃发动机及操作所述类型内燃发动机的方法,美国密歇根州,0
CN201710100428.7,20170223,CN107042099A,20170815,B01J20/281;B01J20/28;B01J20/30;C07K1/22;,南昌大学,付金衡,特异吸附c‑Myc标签单域重链抗体的免疫亲和材料,江西省南昌市红谷滩新区学府大道999号,330031
CN102017000264000,20170421,CN107041305A,20170815,A01H4/00;A01N3/00;,山东省农作物种质资源中心,颜廷进,一种蕙兰种质资源离体保存及保存后恢复生长的方法,山东省济南市工业北路202号,250100
CN201710066298.X,20170207,CN107045214A,20170815,G02F1/017;,三菱电机株式会社,西川智志,光调制器,日本东京,0
CN201710066494.7,20170207,CN107041285A,20170815,A01G31/00;A01H4/00;A01G9/10;,高久双,高久双,一种霍山石斛圆球茎直播实生苗的方法,安徽省六安市金安区东河口镇四红村粉坊组,230001
CN102017000157490,20170316,CN107046502A,20170815,H04L12/741;,杭州迪普科技股份有限公司,王朝,一种转发表生成方法及装置,浙江省杭州市滨江区通和路68号中财大厦6楼,310051
CN102017000249120,20170417,CN107042265A,20170815,B21D37/10;B21D37/16;B21D39/03;B21D43/00;,常州信息职业技术学院,陆孟雄,一种发动机隔热板冲压模具,江苏省常州市武进区鸣新中路22号常州信息职业技术学院,213164
CN102017000152334,20170305,CN107042374A,20170815,B23K37/00;B23K37/047;,张红卫,赵浩,一种升降式手动托盘车自动化焊接装置,浙江省嘉兴市南湖区城南路237号,314001
CN102017000216381,20170405,CN107044270A,20170815,E21B33/13;E21F16/00;,李卫忠,李卫忠,煤矿探放水套管止水方法及止水套管,山西省晋城市泽州县巴公镇三八煤矿家属院224号,048000
CN201710101975.7,20170224,CN107041617A,20170815,A45D20/12;A45D2/36;,安徽师范大学,叶品,带卷发功能的吹风机,安徽省芜湖市弋江区九华南路189号科技服务部,241002
CN102017000189354,20170327,CN107045049A,20170815,G01N33/18;G08C17/02;,南宁市茂宏信息技术有限公司,不公告发明人,水质监控系统,广西壮族自治区南宁市青秀区越秀路1号凯悦国际15号楼4单元702号,530000
CN102017000160167,20170317,CN107044829A,20170815,G01B11/16;,中国地震局地壳应力研究所,刘爱春,一种基于曲边三角形的高精度光纤光栅形变传感器,北京市海淀区西三旗安宁庄路1号,100085
CN102017000241279,20170413,CN107043400A,20170815,C07F15/06;C09K11/06;,桂林理工大学,张淑华,"一种荧光材料4‑(N,N′‑双(4‑羧基苄基)氨基)苯磺酸钴配合物及合成方法",广西壮族自治区桂林市七星区建干路12号,541004
CN102017000184234,20170324,CN107045280A,20170815,G05B11/42;,清华大学,梁斌,分数阶PID控制器的有理化实现方法,北京市海淀区清华园,100084
CN102017000242178,20170414,CN107041723A,20170815,A47L13/58;,陈学琴,陈学琴,磁扣连接旋转活动销自锁升降侧轴柱筒拖把清洗甩干器,安徽省芜湖市镜湖区平安山庄16-1-502,241001
CN102017000251662,20170418,CN107043836A,20170815,C21B5/00;C21B5/02;C21B5/04;,王冰,王冰,一种高炉炼铁的方法,安徽省铜陵市铜官山区商南新村61栋301号,244000
CN102017000254321,20170418,CN107046541A,20170815,H04L29/06;H04L9/08;,深圳市法马新智能设备有限公司,刘刚,一种无线收发加密通信方法及其装置,广东省深圳市宝安区西乡街道三围社区奋达高新科技园C栋4楼北,518000
CN102017000274426,20170424,CN107041776A,20170815,A61B17/326;A61B17/115;,芜湖商环科技有限公司,商晶晶,一种推进自锁装置和包皮环切器，以及其组装方法和使用方法,安徽省芜湖市芜湖经济技术开发区科创中心D园402,241007
CN102017000252944,20170418,CN107043712A,20170815,C12N1/16;C12R1/865;,哈尔滨生物制品二厂有限责任公司,马兰,一种同时富集铁锌微量元素酵母的制备方法,黑龙江省哈尔滨市利民经济技术开发区利民东二大街欣盛路,150525
CN102017000195765,20170329,CN107044275A,20170815,E21B43/24;E21B43/30;F24J3/08;,中国石油大学（华东）,孙致学,利用深层地热资源热采页岩气方法及系统,山东省青岛市黄岛区长江西路66号,266580
CN102017000208103,20170331,CN107041526A,20170815,A23L19/00;A23L33/10;A23L33/125;A23L2/02;A23L2/52;,珠海市古春堂凉茶有限公司,周永青,一种冰糖雪梨雪耳糖水及其制备方法,广东省珠海市碧涛路37号古春堂店面,519000
CN102017000160139,20170317,CN107043230A,20170815,C04B26/04;,北京艺高世纪科技股份有限公司,刘卫东,一种耐擦洗内墙干粉涂料,北京市顺义区中关村科技园区顺义园印刷产业基地中心路16号,101300
CN102017000192615,20170328,CN107045829A,20170815,G09B25/02;,广东省机械研究所,郝明,一种用于机械制造示教设备的组合式工件及其使用方法,广东省广州市黄埔区大沙地东319号保利中誉广场主楼209房,510799
CN102017000202120,20170330,CN107042682A,20170815,B41C1/05;,胡金钱,胡金钱,一种激光加工公章的设备,浙江省杭州市西湖区名仕家园10幢2单元302室,310012
CN102017000068525,20170208,CN107045678A,20170815,G06Q10/08;G10L15/22;,陈东,陈东,自动批量快速配货系统及方法,云南省昆明市五华区科高路水逸康路小区8幢8单元304室,650000
CN102017000069765,20170208,CN107044299A,20170815,E21F17/18;C09D5/00;G01N33/00;,深圳凯达通光电科技有限公司,不公告发明人,一种用于瓦斯泄漏的报警器,广东省深圳市南山区粤海街道南海大道2225号海王大厦708,518000
CN102017000071708,20170209,CN107044887A,20170815,G01J5/34;G01V8/20;,深圳通感微电子有限公司,刘文上,人体探测装置和方法,广东省深圳市福田区红荔西路与景田路交界西北角鲁班大厦2号塔楼24D1,518000
CN102017000247515,20170417,CN107043556A,20170815,C09C1/02;C09C3/00;C09C3/04;C09C3/10;D21H17/69;D21H17/67;,华东理工大学,王彦华,一种粒径分布窄的重钙的制备方法,上海市徐汇区梅陇路130号,200237
CN102017000131767,20170307,CN107043101A,20170815,C01B32/184;B01J20/20;B01J20/28;,中国科学院上海硅酸盐研究所,黄富强,一种三维多孔石墨烯泡沫材料及其制备方法和应用,上海市长宁区定西路1295号,200050
CN102017000186413,20170324,CN107045024A,20170815,G01N30/02;G01N30/06;,云南中烟工业有限责任公司,曾婉俐,卷烟滤嘴对主流烟气中杀菌剂截留量的气相色谱‑串联质谱检测方法,云南省昆明市五华区红锦路367号,650231
CN102017000183385,20170324,CN107044371A,20170815,F02M61/14;F02F11/00;,中国北方发动机研究所（天津）,王增全,一种用于气缸盖的喷油器密封结构及安装方法,天津市北辰区永进道96号,300400
CN102017000205815,20170331,CN107043962A,20170815,D01F9/12;D01F9/08;,郑州大学,上媛媛,一种螺旋结构石墨烯‑碳纳米管复合纤维的制备方法,河南省郑州市高新区科学大道100号,450001
CN102017000070727,20170209,CN107044849A,20170815,G01C9/26;,施塔比拉测量工具古斯塔夫乌尔里希公司,G.卡拉比斯,水平仪,德国安怀勒阿姆特里费尔斯,0
CN102017000091000,20170220,CN107046596A,20170815,H04M1/725;H04M1/2745;G06F3/0488;,阿里巴巴集团控股有限公司,吴栋,智能终端数据的查询方法及装置,英属开曼群岛大开曼资本大厦一座四层847号邮箱,0
CN102017000118927,20170301,CN107041859A,20170815,A61K8/9789;A61K8/86;A61K8/21;A61K8/24;A61K8/25;A61K8/34;A61K8/46;A61K8/49;A61Q11/00;,广东金山百草健康产业有限公司,张景耀,一种牛大力牙膏的配方,广东省江门市开平市翠山湖新区环翠西路2号2座3层1卡,529300
CN102017000262803,20170420,CN107041985A,20170815,A61M11/00;A61M31/00;,成都倍瑞科技有限公司,彭剑,一种手持式人工智能雾化器,四川省成都市高新区（西区）西芯大道5号,611730
CN102017000191743,20170328,CN107042024A,20170815,B01D17/022;B32B5/14;B32B5/08;B32B5/26;,北京化工大学,丁玉梅,一种熔体纳米纤维超高效吸油棉,北京市朝阳区北三环东路15号,100029
CN102017000229151,20170410,CN107044715A,20170815,F24F11/00;,青岛海尔空调器有限总公司,崔俊,空调系统及用于空调系统的控制方法,山东省青岛市崂山区海尔路1号海尔工业园,266101
CN102017000096248,20170222,CN107045282A,20170815,G05B13/04;G05D3/12;,天长市天尚清洁能源有限公司,李永军,基于单片机模糊控制算法的太阳能自动跟踪系统及方法,安徽省滁州市天长市经济开发区经三路东天滁路北,239300
CN102017000186489,20170324,CN107043862A,20170815,C22B30/04;C22B5/10;,中南大学,刘维,一种As<base:Sub>2</base:Sub>O<base:Sub>3</base:Sub>还原制备金属砷的方法,湖南省长沙市岳麓区麓山南路932号,410083
CN102017000195844,20170329,CN107042566A,20170815,B27L3/00;B27K3/00;B27K3/52;B27K5/04;B27K5/06;B27K9/00;,阜南县环宇柳木工艺制品有限公司,徐学朋,一种杞柳的软化去皮方法,安徽省阜阳市阜南县黄岗镇耿岗村,236300
CN102017000215645,20170404,CN107041208A,20170815,A01D46/247;,淄博职业学院,聂海燕,一种滚轮人工助力非接触式机械手樱桃采摘器,山东省淄博市高新技术产业开发区高创园A座313室,255086
CN102017000125457,20170304,CN107046778A,20170815,H05K3/46;H05K1/16;,吉安市满坤科技有限公司,乐伦,一种埋入式电容印制电路板的制作方法,江西省吉安市井冈山经济技术开发区火炬大道191号,343000
CN201710067323.6,20170207,CN107042514A,20170815,B25J11/00;,国网浙江新昌县供电公司,长沙理工大学,一种具有爬行纠偏的输电线路绝缘子清扫爬杆机器人,浙江省绍兴市新昌县城关镇十九峰路289号,312500
CN102017000185517,20170326,CN107041598A,20170815,A43D11/00;,瑞安市旭腾机械有限公司,方纯洁,一种鞋子TPU内衬加工设备,浙江省温州市瑞安经济开发区高新路255号,325200
CN102017000227801,20170410,CN107041425A,20170815,A23C20/02;,张宏梅,张宏梅,一种久香豆腐配方及其制备方法,天津市蓟县桑梓镇瑞庄村2区4排6号,300000
CN102017000223089,20170407,CN107041372A,20170815,A01N43/86;A01N39/04;A01P13/00;,安徽蓝田农业开发有限公司,陈浩,一种含噁嗪草酮和二甲四氯钠的除草剂组合物及其应用,安徽省合肥市樊洼路8号丰乐小区7#403,230031
CN102017000191509,20170328,CN107042017A,20170815,A63F13/25;A63F13/24;A63F13/327;A63F13/35;A63F13/70;A63F13/822;,封越,封越,一种线上线下共生的狼人杀游戏系统,广东省广州市番禺区洛溪新城芳华花园洛涛居10幢之一501房,511400
CN102017000129607,20170306,CN107044885A,20170815,G01J1/56;G01J1/42;,温州大学,王艳伟,一种测量激光聚焦强度的装置及使用方法,浙江省温州市瓯海区东方南路38号温州市国家大学科技园孵化器温州大学,325000
CN102017000186512,20170324,CN107043857A,20170815,C22B7/04;C22B1/24;C22B1/02;C21B13/00;,江苏省冶金设计院有限公司,宋文臣,处理提钒尾渣和铜渣的系统与方法,江苏省南京市大光路大阳沟44号,210007
CN102017000131437,20170307,CN107043415A,20170815,C07K16/02;C07K1/36;C07K1/34;C07K1/18;,尤丽康（江苏）生物医药有限公司,付强,一种卵黄免疫球蛋白的提取方法,江苏省连云港市灌云县经济开发区树云路北侧（规划新民南路西侧）（中小企业园内）,222000
