CN102017000066072,20170206,CN107041847A,20170815,A61K8/02;A61K8/9794;A61K8/81;A61K8/73;A61K8/37;A61K8/365;A61Q3/00;A61Q17/02;,金华市名仕科技股份有限公司,徐洪泉,一种具有驱蚊功能的指甲贴膜及其制备方法,浙江省金华市磐安工业园区（尖山镇夹溪路199号）,322312
CN102016001117333,20161207,CN107042168A,20170815,B05B1/22;B05B1/34;,欧亚瑟有限公司,雷纳德·维斯勒梅尔,水喷嘴,德国赫斯特尔-里森贝克D-48477，泰克伦博格街161号,0
CN201710049726.8,20170123,CN107042015A,20170815,A63F9/02;,刘秋来,刘秋来,一种稳固打靶装置,浙江省绍兴市新昌县七星街道合新村21号,312599
CN102017000018813,20170111,CN107041498A,20170815,A23L2/38;A23L2/60;A23L31/00;A23L33/10;A23L33/105;,成都中医药大学,四川省通江山霸王野生食品有限公司,一种复方香菇饮料及其制备方法,四川省成都市温江区柳台大道1166号,611130
CN102016001039336,20161121,CN107041893A,20170815,A61K33/42;A61K31/6615;A61P17/02;,深圳市用必法生物科技有限公司,戴跃生,一种植酸混合物和烧伤液,广东省深圳市南山区蛇口新街73号港湾工业区G座一楼,518000
CN102017000038692,20170119,CN107042757A,20170815,B60K17/04;B60K17/16;B60K17/346;,福特全球技术公司,戴伦·斯皮拉,差速器安装系统,美国密歇根州迪尔伯恩市,0
CN102016000082274,20160205,CN107042629A,20170815,B29C64/153;B29C64/357;B33Y10/00;B33Y40/00;,新会江裕信息产业有限公司,李致淳,立体打印方法,广东省江门市新会区今古洲开发区江裕路18号江裕科技园,529141
CN102016001224956,20161227,CN107046767A,20170815,H05K1/09;C25D3/56;C25D9/08;,福田金属箔粉工业株式会社,真锅久德,覆铜层压板用处理铜箔、覆铜层压板及使用其的印刷电路板,日本京都府京都市,0
CN102016000998007,20161111,CN107045236A,20170815,G02F1/1362;G02F1/1343;,三星显示有限公司,金元浩,液晶显示设备,韩国京畿道,0
CN102016000082716,20160205,CN107045979A,20170815,H01L21/336;H01L21/762;H01L21/28;,中芯国际集成电路制造(上海)有限公司,中芯国际集成电路制造(北京)有限公司,半导体结构的形成方法,上海市浦东新区张江路18号,201203
CN102016000082722,20160205,CN107045618A,20170815,G06K9/00;G06N3/08;,北京陌上花科技有限公司,张默,一种人脸表情识别方法及装置,北京市海淀区丹棱街6号中关村金融大厦SOHO3Q,100080
CN102016001008170,20161116,CN107042978A,20170815,B65G1/04;,余达辉,余达辉,一种货物架存储装置中的转动设备,浙江省宁波市慈溪市逍林镇破山村周塘东街199号,315321
CN102017000017321,20170111,CN107045121A,20170815,G01S11/02;,北京科技大学,张晓彤,一种近场超宽带信号相位差测距方法及系统,北京市海淀区学院路30号,100083
CN102016001234917,20161227,CN107042694A,20170815,B41J2/165;,精工爱普生株式会社,平本刚己,记录装置和保管方法,日本东京都,0
CN102016000942266,20161102,CN107041571A,20170815,A41B11/00;,有杨,有杨,一种防脱船袜,北京市海淀区丹棱街甲一号欧美汇六层,100190
CN102016001080639,20161130,CN107045706A,20170815,G06Q50/06;G06Q10/06;,国网江苏省电力公司,国网江苏省电力公司检修分公司,智能变电站二次安全措施操作票自动生成方法,江苏省南京市北京西路20号,210024
CN102016001002884,20111209,CN107041547A,20170815,A23L33/00;A23L33/19;A23C9/15;C07K14/79;,MJN 美国控股有限责任公司,D.巴纳瓦拉,包含热不稳定乳蛋白的组合物及其制备方法,美国伊利诺伊州,0
CN102016000081932,20160205,CN107046703A,20170815,H04W48/06;H04W72/08;,华为技术有限公司,庄宏成,接入控制方法和基站,广东省深圳市龙岗区坂田华为总部办公楼,518129
CN102016001004526,20161111,CN107046152A,20170815,H01M10/42;H01M10/12;H01M4/14;,中广核工程有限公司,沈阳东北蓄电池有限公司,核电站用铅酸蓄电池及其正极防腐方法,广东省深圳市大鹏新区鹏飞路大亚湾核电基地工程公司办公大楼,518124
CN201710042104.2,20170120,CN107044759A,20170815,F25D23/02;F25D29/00;,青岛海尔股份有限公司,夏恩品,门体组件及具有该门体组件的冰箱,山东省青岛市崂山区海尔路1号海尔工业园,266101
CN201580067040.0,20151111,CN107046814A,20170815,H01B7/00;H01B7/17;H01B11/06;H01B13/00;H05K9/00;,星电株式会社,近藤快人,电缆组件和电缆组件生产方法,日本大阪府八尾市,0
CN102017000014183,20100112,CN107046470A,20170815,H04L12/14;H04M15/00;H04M15/28;H04M15/30;H04W4/24;,华为终端有限公司,袁之泉,手机上网流量统计及显示方法、装置及手机,广东省深圳市龙岗区坂田华为基地B区2号楼,518129
CN102016000084031,20160206,CN107046006A,20170815,H01L23/14;H01L21/48;,合肥威迪变色玻璃有限公司,刘钧,柔性基板结构及其形成方法，柔性电子器件,安徽省合肥市合肥新站区武里山路安徽鑫昊等离子显示器件有限公司103号厂房,230000
CN201610080828.1,20160205,CN107045436A,20170815,G06F9/30;G06F12/02;,龙芯中科技术有限公司,孟小甫,访问处理方法和装置,北京市海淀区中关村环保科技示范园龙芯产业园2号楼,100095
CN102016000814825,20160909,CN107046610A,20170815,H04N1/00;,富士施乐株式会社,宫森慎也,终端装置、诊断系统和诊断方法,日本东京,0
CN102016000083834,20160205,CN107043173A,20170815,C02F9/02;C02F9/10;,海南立昇净水科技实业有限公司,陈忱,可分质供水的净水器,海南省海口市美兰区顺达路13号,571126
CN102016000944976,20161102,CN107045891A,20170815,G11C16/26;G11C16/20;G11C16/34;,三星电子株式会社,尹铉竣,非易失性存储器装置及其操作方法,韩国京畿道,0
CN102016001261004,20161230,CN107043086A,20170815,B81C3/00;H01L21/762;,台湾积体电路制造股份有限公司,辛建宁,用于将一对半导体衬底粘合在一起的方法,中国台湾新竹科学工业园区新竹市力行六路八号,0
CN201610081789.7,20160206,CN107042859A,20170815,B62K15/00;,李建伟,李建伟,折叠坐椅自行车及其制造工艺,广东省深圳市南山区前海路鼎太风华J3-1002,518052
CN201580051035.0,20150922,CN107046798A,20170815,A47J31/44;,QBO咖啡有限责任公司,W·巴尔考,奶泡机,瑞士瓦利塞伦,0
CN201710064079.8,20170204,CN107044450A,20170815,F04D29/66;,日本电产株式会社,有马久美子,风扇马达,日本京都府京都市,0
CN102016001020974,20161115,CN107045883A,20170815,G11C13/00;,台湾积体电路制造股份有限公司,李嘉富,RRAM电路以及RRAM行形成的方法,中国台湾新竹,0
CN102016001214587,20161226,CN107044223A,20170815,E05B37/02;E05B15/00;,芜湖金安泉锁业有限公司,周江洪,密码锁,安徽省芜湖市新芜经济开发区南次二路1958号（芜湖勃鸿塑业有限公司内）,241100
CN102016001272977,20161223,CN107045277A,20170815,G04F7/08;,劳力士有限公司,皮埃尔-阿兰·格雷米格,用于计量和显示时间单位分数的装置,瑞士日内瓦,0
CN102016000167802,20160323,CN107041966A,20170815,A61L26/00;,陈明鸿,陈澄伟,溶剂挥发成形水凝胶基质的组成配方及其制备方法,中国台湾新竹县竹北市生医路二段16号3F,0
CN102017000038222,20170119,CN107043540A,20170815,C08L83/07;C08L83/05;C08L83/12;C08L83/06;C08K3/36;C08K5/5445;,安徽星鑫化工科技有限公司,王中立,一种透明硅胶端子套的基础胶料及其制备方法,安徽省六安市霍邱县户胡镇,237451
CN102016001110764,20161206,CN107041336A,20170815,A01K67/02;,衡阳茂晨农业开发有限公司,尹忠,美国青蛙的繁育方法,湖南省衡阳市衡阳县演陂镇演陂桥村勒马山组,421206
CN102016001216800,20161226,CN107042061A,20170815,B01D53/78;B01D53/50;B01D53/26;B01D45/06;B01D53/00;B01D53/14;,中国华电科工集团有限公司,华电环保系统工程有限公司,一种应用于燃煤电厂消除烟囱白烟的方法及装置,北京市丰台区汽车博物馆东路6号院盈坤世纪A座11层,100160
CN102016000984687,20161109,CN107041258A,20170815,A01G9/24;A01G9/14;E04D13/18;H02S40/20;H02S20/22;,许庚振,卢鸿智,太阳能温室的制造方法,中国台湾台北市信义区松山路439号3楼,0
CN102016001075457,20161129,CN107046690A,20170815,H04W16/14;,西南交通大学,梁宏斌,一种认知Femtocell网络混合频谱接入方法,四川省成都市二环路北一段111号西南交通大学科技处,610031
CN102016000089499,20160217,CN107046721A,20170815,H04W72/04;H04W72/12;,中兴通讯股份有限公司,张雯,传输信息的方法及装置,广东省深圳市南山区科技南路55号,518057
CN102016000195259,20160331,CN107045689A,20170815,G06Q30/02;G06Q20/06;,深圳市星电商科技有限公司,文世龙,电子红包中广告信息的加载方法和系统,广东省深圳市前海深港合作区前湾一路鲤鱼门街1号前海深港合作区管理局综合办公楼A栋201室（入驻深圳市前海商务秘书有限公司）,518000
CN102016000820010,20160913,CN107046018A,20170815,H01L23/538;H01L21/48;,杨秉荣,杨秉荣,玻璃基板封装及其制造方法,中国台湾新竹市,0
CN102016001220265,20161226,CN107044303A,20170815,F01D15/12;,熵零技术逻辑工程院集团股份有限公司,靳北彪,一种动力产生方法、动力系统,北京市朝阳区北苑路168号中安盛业大厦24层,100101
CN102016000081917,20160205,CN107045398A,20170815,G06F3/041;G06F1/16;,宏达国际电子股份有限公司,黄伯勤,触控面板总成及可携式电子装置,中国台湾桃园市,0
CN102016001146713,20161213,CN107041979A,20170815,A61M1/28;,上海市杨浦区中心医院,冯雪芳,肾内科腹膜透析管,上海市杨浦区腾越路450号,200090
CN201610080158.3,20160205,CN107044399A,20170815,F04B33/00;F04B39/10;F04B39/12;F04B39/00;,双馀实业有限公司,王罗平,内藏储气式的打气筒,中国台湾台中市北屯区文心路4段696号18楼之1,0
CN102016000082288,20160205,CN107045447A,20170815,G06F9/445;G06F9/52;,阿里巴巴集团控股有限公司,寇睿,一种数据对象的标签显示方法和装置,英属开曼群岛大开曼资本大厦一座四层847号邮箱,0
CN102016000978384,20161107,CN107041653A,20170815,A47D1/00;,阿特萨纳公司,大卫·索佐,儿童用辅助座椅,意大利科莫,0
CN102016000832278,20160919,CN107041971A,20170815,A61L27/52;A61L27/56;A61L27/58;A61L27/50;A61L27/26;B33Y10/00;B33Y80/00;,盐城工业职业技术学院,王曙东,一种基于三维打印的蚕丝蛋白/明胶支架材料及其制备方法,江苏省盐城市盐都区城南新区解放南路285号,224000
CN102016000813662,20160909,CN107046404A,20170815,H03F1/26;H03F1/32;H03F3/217;,联发科技股份有限公司,王文杰,D类放大器及用于执行D类放大的方法,中国台湾新竹市新竹科学工业园区笃行一路一号,0
CN102016000943628,20161102,CN107046405A,20170815,H03F1/34;H03F3/70;,美国亚德诺半导体公司,谭志超,使用高级相关的电平移动的增益增强,美国马萨诸塞州,0
CN201580056658.7,20151208,CN107046812A,20170815,G06F12/00;,华为技术有限公司,李夫路,一种数据保存方法和装置,广东省深圳市龙岗区坂田华为总部办公楼,518129
CN201710043641.9,20170119,CN107043016A,20170815,B65G47/90;B65G47/54;,柏涛涛,柏涛涛,一种应用于物料码垛机上的物流包裹输送机构,安徽省滁州市琅琊区凤凰西路紫薇西村62幢307室,239000
CN201710041244.8,20170117,CN107043693A,20170815,C12M1/38;C12M1/36;C12M1/34;C12M1/04;C12M1/02;C12M1/00;H01M2/02;H01M4/92;C12R1/89;,西安交通大学,何雅玲,一种自吸氧式管式光生物反应器,陕西省西安市碑林区咸宁西路28号,710049
CN102016000438603,20160617,CN107041668A,20170815,A47G21/02;A47G21/04;B23P15/00;,有进可莱贝思株式会社,金锺镛,餐具制造方法,韩国首尔,0
CN201710044624.7,20170119,CN107043532A,20170815,C08L77/00;C08L81/06;C08K7/14;C08K5/54;C08L75/08;C08K7/06;C08K3/36;A43B21/20;,佛山星期六科技研发有限公司,林建江,一种简便成型的耐磨天皮及其制备方法,广东省佛山市南海区桂城街道庆安路2号佛山星期六鞋业股份有限公司厂区车间第四层,528251
CN201710041579.X,20170120,CN107042949A,20170815,B65D81/32;,谢福鑫,林挺煌,独立储存混合罐,中国台湾苗栗县公馆乡福德村89之2号,0
CN102016000082245,20160205,CN107046713A,20170815,H04W72/04;H04L5/00;,中兴通讯股份有限公司,石靖,下行控制信道的确定方法及装置、终端、基站,广东省深圳市南山区科技南路55号,518057
CN102017000003753,20170104,CN107042813A,20170815,B60S1/48;B60S1/46;,法雷奥系统公司,G.卡洛特,机动车辆的冲洗流体分配装置和擦拭系统,法国勒梅尼勒圣但尼,0
CN102016001262279,20161230,CN107045587A,20170815,G06F19/00;G06F17/30;,北京光年无限科技有限公司,陈宾,一种用于机器人的交互输出方法以及机器人,北京市石景山区石景山路3号玉泉大厦四层常青藤青年创业工作室193号,100000
CN102016001146038,20161213,CN107041337A,20170815,A01K67/02;,曾琼,曾琼,一种鹿的养殖方法,广东省惠州市博罗县杨村镇大井管理区,516157
CN102016001252063,20100120,CN107041948A,20170815,A61K38/18;A61K48/00;A61P17/02;A61P11/00;A61P1/04;,北京三有利科技发展有限公司,中国人民解放军兰州军区兰州总医院,细胞生长因子治疗溃疡性疾病和肺纤维化疾病的应用,北京市石景山区石景山路3号玉泉大厦816室,100049
CN102016000083830,20160206,CN107044819A,20170815,G01B7/02;,泰科电子（上海）有限公司,程达伟,一种移动物体运动位置的感测方法及系统,上海市浦东新区中国（上海）自由贸易试验区英伦路999号15幢一层F、G部位,200131
CN102016000082191,20160205,CN107045508A,20170815,G06F17/30;G06F9/445;,腾讯科技（深圳）有限公司,张兴华,应用程序的处理方法和装置,广东省深圳市福田区振兴路赛格科技园2栋东403室,518000
CN102016000083750,20160206,CN107041883A,20170815,A61K31/4015;A61K38/21;A61K38/08;A61K31/497;A61P1/16;A61P31/14;,中国医学科学院医药生物技术研究所,彭宗根,丙型肝炎病毒辅助受体CD36的特异性抑制剂在制备防治丙型肝炎病毒感染药物中的应用,北京市东城区天坛西里1号,100050
CN102016001260947,20161230,CN107043565A,20170815,C09D5/34;,上海墙特节能材料有限公司,肖斌,一种防静电的无机干粉内墙腻子及其应用,上海市青浦区久业路178号第2幢、第3幢厂房,201712
CN102016001187426,20161220,CN107043495A,20170815,C08L23/22;C08L83/07;C08L91/06;C08L61/24;C08K3/22;C08K5/098;C08K3/04;,吴中区穹窿山师匠新材料技术咨询服务部,查林珍,一种阻尼减震降噪材料及其制备方法和用途,江苏省苏州市吴中区穹窿山风景管理区松海路258号7幢123,215000
CN102016000082767,20160205,CN107042018A,20170815,A63F13/577;A63F13/55;,腾讯科技（深圳）有限公司,邹铭,控制对象的空间位置确定方法和装置,广东省深圳市福田区振兴路赛格科技园2栋东403室,518000
CN201710064269.X,20170204,CN107043513A,20170815,C08L51/00;C08K13/02;C08K5/09;C08K3/38;C08K3/34;C08K5/41;C08K5/17;C08K5/103;C08F285/00;C08F212/08;C08F255/02;C08F220/18;C08J7/06;C08J7/04;C08J9/24;,株式会社JSP,高木翔太,复合树脂发泡颗粒、复合树脂发泡颗粒成形体以及复合树脂发泡颗粒的制造方法,日本东京都,0
CN102016001221547,20161226,CN107043314A,20170815,C05G3/04;C05G3/00;,贵州大学,陈肖虎,一种共混材料包膜的菠菜专用缓释肥及其制备方法,贵州省贵阳市花溪区花溪大道南段,550025
CN102016000898447,20161014,CN107045556A,20170815,G06F17/50;,台州市德嘉机电科技有限公司,重庆大学,螺旋曲面磨削过程中的磨削力预测方法,浙江省台州市路桥区珠光街201号,318050
CN102016000084371,20160206,CN107046430A,20170815,H04B1/3827;G06K9/00;G06K9/62;G10L15/22;A44C9/00;,上海心麦智能科技有限公司,徐新意,一种带有控制手势识别和语音开关按钮的智能戒指,上海市徐汇区宜山路829号6幢550室,200000
CN102017000015923,20170110,CN107045190A,20170815,G02B21/34;G02B21/00;G02B21/36;,亿观生物科技股份有限公司,林建明,样品承载模块与可携式显微镜装置,中国台湾台北市大安区罗斯福路3段171号11楼之1,0
CN102016001131128,20161209,CN107042869A,20170815,B62M25/08;,株式会社岛野,原宣功,自行车变速系统,日本大阪府,0
CN102016001254097,20161230,CN107045738A,20170815,G07C1/10;G07C9/00;,天津神工科技有限公司,尚先锋,一种幼儿园门禁监控装置,天津市滨海新区华苑产业区鑫茂科技园AB座四层B单元1号,300384
CN201610080889.8,20160205,CN107042338A,20170815,B23D59/00;,仕兴机械工业股份有限公司,林秋香,用于锯切机具的工件挡板调整机构,中国台湾台中市神冈区神洲里大洲路86号,0
CN102016001248757,20161229,CN107046561A,20170815,H04L29/08;G06K9/00;G06K9/40;G06K9/46;,北京奇虎科技有限公司,孙鹏,一种基于掌纹数据的业务处理方法和装置,北京市西城区新街口外大街28号D座112室（德胜园区）,100088
CN102017000018793,20170110,CN107046421A,20170815,H03L7/099;,马维尔国际贸易有限公司,O·布尔格,全数字锁相环及其控制方法,巴巴多斯圣米加勒,0
CN102016000921637,20161021,CN107045586A,20170815,G06F19/00;G06F17/30;G10L15/22;,松下知识产权经营株式会社,远藤充,控制方法以及控制装置,日本大阪府,0
CN102016000879749,20161008,CN107045879A,20170815,G11C7/10;,阿尔特拉公司,M·胡顿,集成电路中的状态可见性和操纵,美国加利福尼亚州,0
CN102016000671981,20160815,CN107045484A,20170815,G06F13/16;G06F3/06;,爱思开海力士有限公司,金志烈,数据存储装置,韩国京畿道,0
CN102016001113957,20161206,CN107045664A,20170815,G06Q10/06;G06Q50/06;,国家电网公司,国网河南省电力公司经济技术研究院,基于灰色理论的特高压直流来电与省内电源关联分析方法,北京市西城区西长安街86号,100000
CN201710041292.7,20100616,CN107043491A,20170815,C08L23/12;C08L23/08;C08F110/06;C08F210/16;C08F4/649;C08F4/658;C08F4/651;,巴塞尔聚烯烃意大利有限责任公司,G.科利纳,制备抗冲击性丙烯聚合物组合物的方法,意大利米兰,0
CN102017000036941,20170119,CN107046783A,20170815,H05K5/06;H02N2/18;G08C17/02;,深圳市无电通科技有限公司,刘远芳,防水无源无线控制器和控制系统及其应用,广东省深圳市宝安区西乡街道前进二路桃源居南面深圳市智汇创新中心A座607室,518126
CN201710045862.X,20170121,CN107041800A,20170815,A61F2/44;,张洪剑,张洪剑,新型分体式人工椎骨装置,上海市杨浦区长海路168号长海医院,0
CN102016000084091,20160206,CN107045242A,20170815,G02F1/155;,合肥威迪变色玻璃有限公司,刘钧,电致变色结构及其形成方法,安徽省合肥市合肥新站区武里山路安徽鑫昊等离子显示器件有限公司103号厂房,230000
CN102016001259988,20161230,CN107042914A,20170815,B65B51/06;C09J7/02;,芜湖研高粘胶新材料有限公司,甘露,一种封箱胶带,安徽省芜湖市鸠江区鸠江经济开发区富强路30号,241000
CN102016001256588,20161230,CN107046223A,20170815,H01S3/098;H01S3/063;,中国科学院西安光学精密机械研究所,程光华,一种转弯锁模波导激光器,陕西省西安市高新区新型工业园信息大道17号,710119
CN102016000948798,20161102,CN107043406A,20170815,C07K7/02;A61K47/64;,财团法人工业技术研究院,李昂,化合物、连接子‑药物、及配体‑药物耦合体,中国台湾新竹县,0
CN102016001152374,20161214,CN107042848A,20170815,B62D33/02;B60R19/20;B60R19/48;C02F1/00;,福特全球技术公司,杰西·亚力山卓·佩纳·卡西米罗,用于皮卡车的集水系统,美国密歇根州迪尔伯恩市,0
CN102017000014225,20170109,CN107044486A,20170815,F16C32/06;,中原工学校信息商务学校,吴媛媛,竖直方向使用的直驱精密气体静压导轨副,河南省郑州市南龙湖宜居教育园双湖大道2号,451191
CN102016000830329,20160918,CN107046179A,20170815,H01Q15/00;,北京邮电大学,毕科,一种可调介电超表面,北京市海淀区西土城路10号北京邮电大学92号信箱,100876
CN201510515550.1,20150820,CN107044784A,20170815,F28C3/12;,山东新开元环保科技有限公司,李玉山,β建筑石膏粉的冷却塔,山东省临沂市河东开发区顺达路中段路东,276001
CN102017000035953,20170117,CN107042843A,20170815,B62D21/15;B62D25/08;,本田技研工业株式会社,竹田智哉,汽车车身结构,日本东京都,0
CN102016001184412,20161220,CN107042393A,20170815,B23P15/24;,柳州通为机械有限公司,袁玮骏,一种汽车减震器顶胶盖模具型腔加工方法,广西壮族自治区柳州市柳江县新兴工业园乐业路9号（柳州市巨象起重设备有限公司内北面车间）,545000
CN201710043388.7,20170121,CN107041234A,20170815,A01G1/04;,深圳市达利时实业有限公司,徐前进,食用菌栽培气动掏瓶系统,广东省深圳市龙岗区平湖镇辅城坳歧岭工业区凤歧路20号,518000
CN102017000015433,20170110,CN107044949A,20170815,G01N15/08;,山东大学,管延华,一种测定混凝土表面硅烷涂层吸水率的装置及其使用方法,山东省济南市经十路17923号,250061
CN102016001218242,20161226,CN107043235A,20170815,C04B28/04;C04B28/02;C04B38/08;,常州大学,徐海珣,一种憎水性气凝胶复合水泥基功能梯度材料的制备方法,江苏省常州市武进区滆湖路1号,213164
CN102017000005180,20170104,CN107044174A,20170815,E04B1/98;E04B9/00;E04B9/06;E04B9/24;E04B9/04;,李宝龄,李宝龄,一种可二次泄爆的泄爆吊顶,中国台湾高雄县,0
CN102016001053547,20161125,CN107042819A,20170815,B60W10/06;B60W20/00;,大众汽车有限公司,J.里林,用于使内燃机运行的方法和控制装置以及机动车,德国沃尔夫斯堡,0
CN102016001252829,20161230,CN107044557A,20170815,F16K31/04;F16K31/122;F15B1/02;F15B1/24;F15B11/16;F15B15/22;F15B21/08;,大连大高阀门股份有限公司,姜松志,适用于主蒸汽隔离阀的气液联动驱动装置,辽宁省大连市甘井子区姚家路272号大连大高阀门股份有限公司,116037
CN201710044102.7,20170119,CN107045463A,20170815,G06F11/10;G06F21/79;,力旺电子股份有限公司,黄柏豪,具有纠错码的存储器架构以及其操作方法,中国台湾新竹市,0
CN102016001151234,20130708,CN107046558A,20170815,H04L29/08;G06F17/30;,江苏凌空网络股份有限公司,徐蔚,一种可佩戴的部件,江苏省镇江市镇江新区丁卯南纬四路36号1幢4楼,212000
CN201610081454.5,20160205,CN107043637A,20170815,C10G45/08;,中国石油化工股份有限公司,中国石油化工股份有限公司石油化工科学研究院,一种提高汽油加氢脱硫选择性的方法,北京市朝阳区朝阳门北大街22号,100728
CN102016001031354,20161118,CN107042626A,20170815,B29C61/00;,安徽伊法拉电气有限公司,戴文忠,高压电力管钢丝扩张机,安徽省亳州市亳芜现代产业园汤王大道与纬三路交叉口,236800
CN102016001263356,20161230,CN107044711A,20170815,F24F11/00;,TCL集团股份有限公司,许子虎,空调的控制方法及装置,广东省惠州市仲恺高新技术开发区十九号小区,516006
CN102016001218189,20161226,CN107043998A,20170815,D04H17/00;D04H1/08;D04H1/70;D01G11/00;,深圳市恒锋环境资源控股有限公司,罗洪坚,废旧羊毛制品制备毛毡的设备及制备工艺,广东省深圳市罗湖区南湖街道嘉宾路深华商业大厦办公1810单元,518000
CN102016001076675,20161129,CN107046556A,20170815,H04L29/08;H04L29/06;G07C9/00;,深圳智乐信息科技有限公司,张哲文,一种验证的方法及系统,广东省深圳市南山区沙河街道侨城东路锦绣花园一期倚海阁28B,518000
CN102016001090382,20161201,CN107046461A,20170815,H04L5/00;H04W56/00;,北京三星通信技术研究有限公司,三星电子株式会社,V2X终端时频同步的发送和接收处理方法及装置,北京市朝阳区太阳宫中路12号楼18层,100028
CN102017000012721,20170106,CN107046649A,20170815,H04N21/234;H04N21/44;H04N21/472;H04N21/482;G06T7/529;,天津大学,苏育挺,一种电视台标删除检测方法,天津市南开区卫津路92号,300072
CN102016001187512,20161221,CN107043085A,20170815,B81B7/00;B81B7/02;,台湾积体电路制造股份有限公司,朱家骅,半导体器件和封装件及其制造方法,中国台湾新竹,0
CN102016001045982,20161122,CN107046652A,20170815,H04N21/431;H04N21/414;,乐视控股（北京）有限公司,乐视致新电子科技（天津）有限公司,一种视频抖动修正方法、装置及电子设备,北京市朝阳区姚家园路105号3号楼10层1102,100025
CN102016000896892,20161014,CN107044230A,20170815,E05B73/00;,马伊内蒂有限公司,M.马伊内蒂,具有警报液体的防入店行窃板,意大利维琴察,0
CN102016000533432,20160708,CN107044800A,20170815,F41B15/04;,于长荣,于长荣,一种抓捕器,黑龙江省克山县工商银行家属楼1单元301于淑圆转于长荣,161600
CN102016001151103,20161214,CN107041343A,20170815,A01K80/00;,五河县茂源水蛭生态养殖专业合作社,张奎,一种人工养殖水蛭捕捞方法,安徽省蚌埠市五河县小溪镇藕塘村127号,233300
CN102016001114212,20161207,CN107043171A,20170815,C02F5/08;C02F5/10;C02F9/08;C02F103/06;,杭州火焰山温泉度假有限公司,杨胜祥,一种温泉水软化组合物及其应用,浙江省杭州市临安市潜川镇塔山村泥塘坞1号,311313
CN102016001026210,20161118,CN107043509A,20170815,C08L33/00;C08L69/00;C08L77/00;C08L101/00;C08L33/04;C08K5/092;C08K3/08;C08K5/378;,安徽伊法拉电气有限公司,戴文忠,T型线夹护罩料及其制备方法,安徽省亳州市亳芜现代产业园汤王大道与纬三路交叉口,236800
