CN201710294222.2,20170428,CN107046683A,20170815,H04W4/22;H04W76/00;,努比亚技术有限公司,王海婴,一种紧急呼叫方法和移动终端,广东省深圳市南山区高新区北环大道9018号大族创新大厦A区6-8层、10-11层、B区6层、C区6-10层,518000
CN102017000412209,20170605,CN107045219A,20170815,G02F1/1333;,合肥芯福传感器技术有限公司,赵照,一种适用于超宽温域的LCD显示屏系统,安徽省合肥市高新区创新产业园二期F1栋1405室,230031
CN201710362972.9,20170522,CN107041245A,20170815,A01G7/06;A01N37/36;A01P21/00;,湖南农业大学,湖南省烟草公司邵阳市公司新宁县分公司,一种同时提高作物氮素利用效率和抗镉胁迫能力的方法,湖南省长沙市芙蓉区农大路1号,410000
CN102017000341596,20170516,CN107041654A,20170815,A47D7/00;,赵椿,赵椿,一种婴儿俯卧趴床,浙江省衢州市柯城区巨化滨二村11幢203室,324000
CN201710291314.5,20170428,CN107045133A,20170815,G01S19/37;,上海华测导航技术股份有限公司,宋连凯,一种获取天线相位中心参数的方法,上海市青浦区徐泾镇高泾路599号C座,200233
CN201710295649.4,20170428,CN107042549A,20170815,B27C5/00;B27G3/00;,重庆宜居门业有限公司,黄昭和,木材切割装置,重庆市九龙坡区巴福镇西和村九社,401329
CN201710304312.5,20170503,CN107044036A,20170815,D06F39/12;D06F37/22;,无锡小天鹅股份有限公司,郑汉卿,洗衣机,江苏省无锡市国家高新技术开发区长江南路18号,214028
CN102017000317531,20170508,CN107041172A,20170815,A01B39/18;,山东临沂烟草有限公司,刘文涛,背负式烟草中耕除草机,山东省临沂市兰山区柳青街道智圣路3号,276000
CN102017000384239,20170526,CN107045148A,20170815,G01V3/12;G01V3/08;,无锡华测电子系统有限公司,顾敏,一种探地雷达,江苏省无锡市蠡园开发区06-4D地块（滴翠路100号)2幢401室,214072
CN102017000406335,20170602,CN107044845A,20170815,G01C1/00;G01C9/34;,深圳市瑞芬科技有限公司,鲁鹏,一种倾角仪,广东省深圳市宝安区福永街道大洋开发区福安工业城二期厂房1栋第四层,518000
CN102017000454315,20170614,CN107043939A,20170815,C23G3/00;C23C22/00;,沈婉珍,沈婉珍,一种不锈钢阀门用酸洗钝化装置,浙江省宁波市余姚市黄家埠镇黄家埠村邵家11队,315464
CN102017000370540,20170523,CN107045870A,20170815,G10L15/05;G10L25/78;,南京理工大学,张二华,一种基于特征值编码的语音信号端点检测方法,江苏省南京市孝陵卫200号,210094
CN102017000434247,20170609,CN107041184A,20170815,A01C7/08;A01C7/20;A01C5/06;,青岛普兰泰克机械科技有限公司,孙钦华,手扶式小区穗行播种机,山东省青岛市城阳区长城路89号青岛博士创业园19号楼,266000
CN102017000390341,20170527,CN107041443A,20170815,A23F3/34;,刘振,刘振,一种紫薯叶茶的制备工艺,安徽省阜阳市界首市西城办事处力行街5号2栋2单元7户,236502
CN102017000376854,20170525,CN107041619A,20170815,A45D44/16;A45D44/02;,盛泽明,盛泽明,一种用于理发店内长发承载装置,山东省青岛市崂山区文张村102号,266101
CN102017000462056,20170619,CN107044000A,20170815,D05B3/12;D05B71/00;D05B69/30;,阜宁县鑫虎机械有限公司,李运政,一种防卡针的钉扣机,江苏省盐城市阜宁县陈良镇旭新村四组,224400
CN201710361509.2,20170522,CN107041341A,20170815,A01K67/033;,吉林省养蜂科学研究所（吉林省蜂产品质量管理监督站、吉林省蜜蜂遗传资源基因保护中心）,李志勇,一种蜜蜂人工授精针头拉制方法及其拉制器,吉林省吉林市丰满街园林路47号,132108
CN102017000312954,20170505,CN107042429A,20170815,B24B5/04;B24B5/35;B24B41/06;B24B41/02;,郁海新,郁海新,一种家用净水器不锈钢筒体旋转式抛光装置,上海市杨浦区复旦大学电子信息学院考研组邯郸路220号,200433
CN102017000422567,20170607,CN107042581A,20170815,B28B19/00;B28B17/00;,中国联合装备集团安阳机械有限公司,张双军,一种新型复合墙板面板安装装置,河南省安阳市高新区长江大道东段北侧,455000
CN201710278714.2,20170425,CN107041515A,20170815,A23L13/40;A23L13/70;,山东如康清真食品有限公司,曹晨,一种牛肉腌制方法,山东省德州市齐河县表白寺镇济北高铁枢纽经济协作区纬五路1号,253109
CN102017000407758,20170602,CN107043020A,20170815,B65G47/91;,深圳市同创精密自动化设备有限公司,武勇,一种摆料机的角度自动调节装置,广东省深圳市宝安区沙井街道庄村路50号A栋9层,518000
CN102017000339419,20170515,CN107041712A,20170815,A47L9/00;A47L5/02;A47L9/12;,意诺科技有限公司,袁源,一种清洁设备的收纳装置以及清洁设备,四川省成都市高新区天府大道北段28号1栋1单元30层7号,610000
CN102017000471758,20170620,CN107042720A,20170815,B44B11/02;B08B1/04;B08B5/02;,陈燕飞,陈燕飞,一种新型寿山石雕刻刀,福建省福州市晋安区鼓山镇樟林村樟林138号,350000
CN102017000379885,20170525,CN107042404A,20170815,B23P19/06;,山西建筑工程有限公司,张海云,一种扣件维修装置,山西省太原市小店区军民路17号,030006
CN102017000369427,20170523,CN107043096A,20170815,C01B25/37;B01J27/18;B01J35/08;B01J35/10;C02F1/30;B82Y40/00;B82Y30/00;C02F101/34;C02F101/38;,河南科技学院,王雪静,一种纳米球形Ag<base:Sub>3</base:Sub>PO<base:Sub>4</base:Sub>及其制备方法和应用,河南省新乡市华兰大道东,453000
CN102017000340767,20170512,CN107045793A,20170815,G08G1/087;,北方工业大学,周慧娟,一种有轨电车的平交路口协同控制系统,北京市石景山区晋元庄路5号,100144
CN201710342022.X,20170516,CN107044809A,20170815,F42B33/06;,中国人民解放军65196部队,曹海庆,低火焰温度条件下引信烧毁方法,辽宁省铁岭市铁岭县腰堡镇65196部队,112600
CN102017000312871,20170505,CN107044676A,20170815,F24C15/20;,武汉理工大学,甘念重,一种基于龙卷风效应的复合净化型抽油烟机,湖北省武汉市珞狮路122号武汉理工大学,430070
CN102017000330294,20170511,CN107043443A,20170815,C08F291/04;C08F291/12;C08F279/02;C08F283/00;C08F212/08;C08F220/14;C09J151/04;C09J151/08;,佛山市高明大都化工有限公司,郭松华,一种多用粘结胶,广东省佛山市高明区沧江工业园西园,528521
CN102017000373505,20170524,CN107042239A,20170815,B21B35/02;B21B15/00;B21C47/30;B21B45/02;B21B45/06;B23K26/38;B23K26/24;C21D8/02;C25F7/00;C25F1/06;,北海诚德镍业有限公司,张芮,一种可在线切换多等级不锈钢带材的连轧连退洗生产系统,广西壮族自治区北海市铁山港区四号路与七号路交汇处,0
CN102017000404642,20170601,CN107043781A,20170815,C12N15/84;C12N15/66;A01H5/00;C12Q1/68;C12N15/11;,四川农业大学,钦鹏,一种含有地塞米松诱导系统的表达载体及其应用,四川省成都市温江区惠民路211号,611130
CN102017000366569,20150709,CN107042081A,20170815,B01J2/12;,山东华屹重工有限公司,周洪亮,一种滚筒式生物有机肥造粒机,山东省济宁市任城区长沟镇长沟村,272000
CN102017000461892,20170619,CN107045455A,20170815,G06F9/48;G06F9/50;,华中科技大学,谢雨来,一种基于负载预测的Docker Swarm集群资源调度优化方法,湖北省武汉市洪山区珞喻路1037号,430074
CN201710304518.8,20170503,CN107044294A,20170815,E21D20/02;,刘军,刘德芝,一种锚固剂自动填入装置,安徽省六安市寿县大顺镇官塘村刘中队,232213
CN102017000398143,20170531,CN107043176A,20170815,C02F9/02;,湖南蓝石头环保设备有限公司,王玉峰,中继型餐饮废水排放设备,湖南省长沙市望城经济技术开发区沿河路二段118号,410000
CN102017000472288,20170621,CN107043612A,20170815,C09K3/14;,启东镭尚机电有限公司,钱瀛涛,一种机械设备用研磨剂,江苏省南通市启东市海复镇复兴街34号,226000
CN102017000436281,20170612,CN107041501A,20170815,A23L2/39;A23L33/00;,安徽明珍堂养生品有限公司,陈家胜,一种调理平和体质的养生固体饮料及其制备方法,安徽省宣城市宁国市人民路丹桂公寓明珍堂养生馆,242300
CN102017000380032,20170525,CN107043305A,20170815,C05G3/00;C05G3/04;,东至县珊瑚生态农业发展有限公司,不公告发明人,一种有机肥,安徽省池州市东至县水务局门面南竹桂雨专卖店,247200
CN201710305034.5,20170503,CN107041993A,20170815,A61M25/09;A61M25/00;A61L31/10;A61L31/08;A61L31/14;,北京灵泽医药技术开发有限公司,刘锐,一种医用导丝及医用管路,北京市平谷县兴谷工业开发区M2-5区8号,100000
CN102017000375279,20170524,CN107044121A,20170815,E02D5/68;,响水县金桥化工设备制造有限公司,冯金桥,一种钢护筒的表面防护减震装置,江苏省盐城市响水县经济开发区工业园金桥化工设备,224600
CN201710293494.0,20170428,CN107045478A,20170815,G06F11/36;,福建星瑞格软件有限公司,林禹,一种轻量级线程分析与运行可视化方法,福建省福州市鼓楼区软件大道89号福州软件园F区5号楼20-21层,350000
CN102017000397761,20170531,CN107043359A,20170815,C07D249/12;,江苏七洲绿色化工股份有限公司,安静,一种丙硫菌唑中间体的制备方法,江苏省苏州市张家港市乐余镇工业集中区（七洲）,215621
CN201710303257.8,20170503,CN107041551A,20170815,A23L33/10;A23L33/105;A23C9/13;,贵阳中医学院,田维毅,丁香提取液、丁香酸奶及其制备方法,贵州省贵阳市南明区市东路50号,550000
CN201710282040.3,20170426,CN107041308A,20170815,A01H4/00;,江苏农林职业技术学院,钱枫,一种樱草根组培繁殖方法,江苏省镇江市句容市文昌东路19号,212400
CN102017000431378,20170609,CN107042625A,20170815,B29C51/34;B29C51/36;B29C51/10;,安徽擎天伟嘉装备制造有限公司,王一风,一种凹模压空成形装置,安徽省滁州市全椒县经济开发区标准化厂房3期,239500
CN102017000309332,20170504,CN107041573A,20170815,A41B11/02;A41B11/00;,海宁汉德袜业有限公司,王雪霞,3D豆跑步袜,浙江省嘉兴市海宁市周王庙镇博儒桥村（博儒桥村经济合作社旁）,314407
CN102017000460402,20170617,CN107041533A,20170815,A23L21/12;A23L19/00;A23L19/10;A23L25/00;A23L33/10;A23L33/185;,丹凤县商山红葡萄酒有限公司,罗铁柱,一种葡萄风味的混合果酱及其制备方法,陕西省商洛市丹凤县商镇桃园村,726207
CN201710283676.X,20170426,CN107045778A,20170815,G08C17/02;G10L21/0216;G10L25/51;H04M1/725;H04R3/00;,兰州交通大学,李强,一种多功能噪音抵消系统,甘肃省兰州市安宁区安宁西路118号,730000
CN201710301903.7,20170502,CN107046288A,20170815,H02J3/01;,广东工业大学,张淼,一种混合型谐波抑制器的结构及其控制方法,广东省广州市越秀区东风东路729号,510062
CN102017000375289,20170524,CN107042987A,20170815,B65G21/12;,响水县金桥化工设备制造有限公司,冯金桥,一种新型输送机,江苏省盐城市响水县经济开发区工业园金桥化工设备,224600
CN102017000417116,20170522,CN107042202A,20170815,B07B1/42;B07B1/28;,无锡商业职业技术学院,王吴光,可调频振动筛,江苏省无锡市惠山区钱胡公路809号,214153
CN201710292451.0,20170428,CN107045446A,20170815,G06F9/44;G06F21/62;,上海斐讯数据通信技术有限公司,王伟,移动设备的软件管理方法及系统,上海市松江区思贤路3666号,201616
CN102017000391922,20170527,CN107044048A,20170815,D06H1/00;,苏州盛达织带有限公司,张建明,一种具有废屑收集功能的打标流水线,江苏省苏州市吴中区甪直镇机场路2号,215100
CN102017000400397,20170531,CN107041273A,20170815,A01G17/00;A01G9/10;,合肥市禾兴生态养殖科技有限公司,范子辉,一种桂花仿野生溪边种植方法,安徽省合肥市肥东县肥东经济开发区燎原路东、公园路北文一国际B23幢2604室,230000
CN102017000416854,20170606,CN107045824A,20170815,G09B23/22;,长春中国光学科学技术馆,杜丹,伽利略望远镜原理模拟装置,吉林省长春市净月开发区永顺路1666号长春中国光学科学技术馆,130117
CN102017000430408,20170609,CN107041713A,20170815,A47L9/00;A47L9/28;,湖北科技学院,吴超,一种遥控吸尘机器人,湖北省咸宁市咸安区咸宁大道88号,437100
CN201710293733.2,20170428,CN107041728A,20170815,A61B3/12;A61B3/14;G02B27/01;,浙江唯见科技有限公司,张国军,一种基于近眼显示系统测视网膜运动的装置及方法,浙江省金华市四联路398号网络经济中心16楼,321000
CN201710282293.0,20170426,CN107044919A,20170815,G01N1/10;,孙飞,孙飞,采样器及采样系统,江苏省徐州市丰县师寨镇古庙128号,221000
CN102017000374972,20170524,CN107044082A,20170815,E01C11/24;C04B28/00;C04B22/12;C04B111/27;,云南省交通规划设计研究院,郑少鹏,一种环保型陶粒混凝土融冰化雪路面及制备方法,云南省昆明市拓东路石家巷9号,650051
CN201710357828.6,20170519,CN107041954A,20170815,A61K48/00;A61P35/00;A61P37/04;,镇江市第一人民医院,王胜军,HOXA1在制备抗肿瘤药物中的用途,江苏省镇江市电力路8号,212002
CN102017000451759,20170615,CN107046788A,20170815,H05K7/02;,合肥嫩芽科技有限公司,吴彰福,一种插入式线槽,安徽省合肥市经济技术开发区翠微路12号东海星城六期25栋1512,230000
CN201710290663.5,20170428,CN107042253A,20170815,B21D26/027;,浙江大学,高一聪,一种防止反胀破裂的自适应充液拉伸成形方法,浙江省杭州市西湖区余杭塘路866号,310058
CN102017000370468,20170523,CN107043692A,20170815,C12M1/34;C12M1/107;C12M1/02;,河南美丽乡村环保科技有限公司,张建松,一种倾斜排渣沼气装置,河南省许昌市禹州市韩城办西街村,461670
CN102017000403731,20170601,CN107042748A,20170815,B60J3/02;,十堰坤钰渝明汽车零部件有限公司,罗文伟,一种汽车遮阳板,湖北省十堰市经济开发区龙门工业园吉林路259号,442000
CN201710282243.2,20170426,CN107042363A,20170815,B23K26/38;B23K26/70;B23K26/122;,广东工业大学,佛山市铬维科技有限公司,一种加工大功率半导体激光器热沉叠片的装置及方法,广东省广州市越秀区东风东路729号大院,510062
CN201710346783.2,20170517,CN107044361A,20170815,F02K9/56;F02K9/42;,西北工业大学,范玮,一种带有补燃装置的脉冲爆震火箭发动机及控制方法,陕西省西安市碑林区友谊西路127号,710072
CN201710357143.1,20170519,CN107046581A,20170815,H04L29/08;H04L12/26;H04L29/06;G06F11/30;,北京奇艺世纪科技有限公司,杜洋,一种服务运行状态的监测方法、装置及服务器,北京市海淀区北一街2号鸿城拓展大厦10、11层,100080
CN102017000330744,20170511,CN107044687A,20170815,F24F1/00;F24F3/16;F24F13/28;,北京都蓝科技有限公司,阿音起,光催化空气消毒净化器,北京市丰台区西南四环西路188号十八区10号楼2层202室(园区),100070
CN102017000427415,20170608,CN107042108A,20170815,B01J23/644;B01J32/00;C07C45/38;C07C47/54;,杭州电子科技大学,刘娟娟,Pt/BiOCl‑金属氧化物作为催化剂将苯甲醇催化氧化制备苯甲醛的方法,浙江省杭州市下沙高教园区2号大街,310018
CN201710290410.8,20170428,CN107043523A,20170815,C08L67/02;C08L23/08;C08K3/04;,上海自立塑料制品有限公司,孙海晶,PET高聚物土工格室片材及其制备方法,上海市嘉定区南翔工业区美裕路755号,201802
CN201710301055.X,20170502,CN107041322A,20170815,A01K29/00;,中国人民解放军军事医学科学院基础医学研究所,王常勇,非人灵长类视觉及认知功能研究系统,北京市海淀区太平路27号,100850
CN201710350643.2,20170518,CN107043160A,20170815,C02F3/28;C02F3/34;C02F101/30;C02F101/34;,大连理工大学,张耀斌,一种基于磁铁矿和活性炭强化的两相厌氧处理装置与工艺,辽宁省大连市高新园区凌工路2号,116024
CN102017000436641,20170612,CN107046446A,20170815,H04B17/15;H04B17/29;,陕西西北铁道电子有限公司,胡敏惠,一种BTM设备检测系统及方法,陕西省西安市雁塔区高新区高新路80号望庭国际3幢30014室,710000
CN102017000469391,20170620,CN107046662A,20170815,H04R3/00;,北京贝能达信息技术股份有限公司,黄海,轨道交通广播多通道噪声检测音量控制器及控制方法,北京市大兴区北京经济技术开发区科创十四街9号1号楼4层,100176
CN102017000366253,20170523,CN107044799A,20170815,F41B7/08;F41B9/00;,山东英才学院,杨文,一种儿童用多功能玩具水枪,山东省济南市高新技术产业开发区英才路2号,250104
CN201710286825.8,20170427,CN107044509A,20170815,F16H1/22;E01H1/05;,王海维,王海维,用于马路隔离栏地面清扫装置的传动连接架,吉林省长春市双阳区奢岭街道办事处办公楼内410室,130600
CN201710347321.2,20170517,CN107045585A,20170815,G06F17/50;G06F17/18;B21B37/28;,北京科技大学,宋勇,一种轧制模型自学习系数确定方法,北京市海淀区学院路30号,100083
CN201710354841.6,20170518,CN107042471A,20170815,B24B57/02;,合肥彩虹蓝光科技有限公司,尹立平,一种用于LED芯片减薄过程中铜抛光液供给设备,安徽省合肥市合肥新站区工业园内,230011
CN102017000367406,20170523,CN107043648A,20170815,C11B1/02;C11B1/04;C11B3/16;,北京鑫科创油莎豆科技发展有限公司,吴庆玉,一种微生物发酵法制备油莎豆油的方法以及油莎豆油产品,北京市昌平区科技园火炬路21号401-58号,100001
CN201710284032.2,20170426,CN107043241A,20170815,C04B33/13;,揭阳恒成陶瓷科技有限公司,陈鹏杰,一种新型滑石瓷及其制备方法,广东省揭阳市揭东区新亨镇英花村岭仔,515548
CN201710305742.9,20170503,CN107041756A,20170815,A61B5/154;,柴广云,柴广云,一种新型采血装置,河北省沧州市吴桥县沟店铺乡后都墨王村,061000
CN102017000392244,20170527,CN107042618A,20170815,B29C45/44;B29C45/32;B29L31/56;,张家港市天江精密模具制造有限公司,陈祝君,一种深螺纹瓶盖的注塑模具,江苏省苏州市张家港市塘桥镇镇南张家港市天江精密模具制造有限公司,215611
CN201710352077.9,20170518,CN107046546A,20170815,H04L29/06;G06F9/455;,郑州云海信息技术有限公司,吕广杰,一种网络安全控制方法及装置,河南省郑州市郑东新区心怡路278号16层1601室,450000
CN102017000337710,20170515,CN107041407A,20170815,A21D13/062;A21D2/36;A21D2/18;A21D2/14;,安徽安亳食品有限公司,宋运杰,一种秋葵饼干及其制备方法,安徽省亳州市利辛县经济开发区德通绿色食品科技园,236700
CN102017000392853,20170527,CN107042466A,20170815,B24B29/08;B24B29/00;B24B41/00;,重庆市永川区益锐机械有限责任公司,王文革,铜杆高速抛光机,重庆市永川区胜利路办事处永钢村皂角村民小组,402168
CN102017000497088,20170626,CN107043348A,20170815,C07D213/30;,刘瑞海,刘瑞海,一种4‑吡啶甲醇的合成方法,江苏省徐州市沛县沛城东风西路148号,221000
CN102017000449343,20170614,CN107046396A,20170815,H02S20/10;F24J2/52;C09D133/00;C09D175/04;C09D7/12;C09D5/08;,江苏德溢利新材料科技有限公司,施新波,一种渔用轻质环保型地桩,江苏省镇江市扬中市三茅街道翠竹北路666号,212200
CN102017000383658,20170526,CN107045323A,20170815,G05B19/05;,江苏理工学院,赵良,一种基于数字信号处理的运动控制系统及控制方法,江苏省常州市中吴大道1801号,213001
CN201710353463.X,20170518,CN107042459A,20170815,B24B27/033;B24B47/22;B24B47/16;B24B55/06;,南昌诺义弘科技有限公司,不公告发明人,一种五金板的高性能除锈设备,江西省南昌市红谷滩新区红谷中大道1568号红谷凯旋商业办综公楼及商业六301-10室（第3层）,330038
CN201710363248.8,20170522,CN107046467A,20170815,H04L9/32;,广东工业大学,李倩,一种基于读写器、标签和数据库的三方验证方法及系统,广东省广州市越秀区东风东路729号大院,510062
CN102017000465949,20170619,CN107043868A,20170815,C22C9/06;C22C9/00;C22C1/02;,师新虎,师新虎,一种铜基稀散元素合金材料,陕西省铜川市新区坡头街道办坡头村,727100
CN201710359177.4,20170519,CN107046500A,20170815,H04L12/715;H04L12/761;H04L12/801;,合肥工业大学,合肥工大先行微电子技术有限公司,一种应用于层次化片上网络的两级拆分路由器及其路由算法,安徽省合肥市包河区屯溪路193号,230009
CN201710279232.9,20170425,CN107041197A,20170815,A01C21/00;A01C5/06;A01C15/00;A01C15/16;A01G25/09;,习水县草地生态畜牧业发展中心,王明,一种草地施肥工艺,贵州省习水县农牧局第二办公区三楼,564600
CN102017000325180,20170510,CN107042630A,20170815,B29C64/20;B29C64/245;B33Y30/00;,合肥开目管理咨询合伙企业(有限合伙),杨周旺,一种高度易扩展且高精度的3D打印机,安徽省合肥市高新区望江西路800号合肥创新产业园D8楼702室,230000
CN102017000377318,20170525,CN107043083A,20170815,B67C7/00;B08B9/32;,江苏普华盛包装科技有限公司,李沈荣,大桶水吹罐旋生产线,江苏省苏州市张家港市乐余镇人民路287号江苏普华盛包装科技有限公司,215600
CN102017000341623,20170516,CN107041708A,20170815,A47K11/10;A46B9/00;,邬晨燚,邬晨燚,一种翻折马桶刷,浙江省嘉兴市海宁市周王庙镇石井村邬家帮岸上54号,314407
CN102017000427262,20170608,CN107046105A,20170815,H01L51/52;H01L51/56;,京东方科技集团股份有限公司,成都京东方光电科技有限公司,OLED显示基板、制作方法、封装结构及显示装置,北京市朝阳区酒仙桥路10号,100015
CN201710280607.3,20170426,CN107045551A,20170815,G06F17/30;,湖南人文科技学院,周桃云,一种湘绣图像基因构建以及湘绣图像数字化处理方法,湖南省娄底市娄星区氐星路486号,417000
CN102017000331493,20170511,CN107043786A,20170815,C12N15/867;C12N5/10;,合肥知恩生物技术有限公司,曹齐树,一种分泌表达蛋白的稳定细胞株构建方法,安徽省合肥市高新区国家大学科技园创业孵化中心A区502室,230000
CN102017000373217,20170524,CN107043803A,20170815,C12Q1/06;C12Q1/24;,中检科（北京）实验室能力评价有限公司,孙英健,药品中霉菌和酵母菌总数计数能力验证样品及其制备方法,北京市大兴区亦庄经济技术开发区荣华南路11号,100000
CN102017000373790,20170524,CN107044124A,20170815,E02D9/02;,深圳宏业基岩土科技股份有限公司,张领帅,取钢绞线钢筋钢管的三叉钻头,广东省深圳市南山区深圳湾科技生态园一区2栋B座9层9B03号房,518000
CN102017000446168,20170614,CN107043566A,20170815,C09D5/34;,合肥易美特建材有限公司,朱明静,一种新型腻子粉及其制备方法,安徽省合肥市经开区桃花工业园紫蓬路好运锦绣年华1#楼405室,230000
CN201710306096.8,20170504,CN107045720A,20170815,G06T7/00;,深圳硅基智能科技有限公司,王娟,用于识别眼底图像病变的人工神经网络及系统,广东省深圳市宝安区新安街道留芳路6号庭威产业园3#4楼C区,518000
CN201710279846.7,20170426,CN107043476A,20170815,C08L3/02;C08L1/02;A23L3/3562;,苏州苏米欧贸易有限公司,黄衡,一种干燥剂用淀粉组合物,江苏省苏州市苏州高新区马运路298号（兴华科技园605A室）,215000
CN102017000313928,20170505,CN107046545A,20170815,H04L29/06;H04W24/04;,国网安徽省电力公司经济技术研究院,中国电力工程顾问集团华东电力设计院有限公司,一种利用电路交换实现IMS网络省地用户本地自存活的方法,安徽省合肥市怀宁路1599号,230022
CN102017000466075,20170619,CN107042589A,20170815,B28D1/00;B28D7/04;B28D7/00;B24B19/22;B24B29/02;B24B41/06;B24B47/12;B24B47/04;B24B41/02;B24B41/00;,山东蓝河新能源技术有限公司,刘海勇,一种石英台台面自动化加工设备,山东省济南市高新区新宇路西侧世纪财富中心AB座1048,250000
CN102017000444031,20170613,CN107044097A,20170815,E01F15/02;E01F9/619;E01F9/669;E01H3/04;,金陵科技学院,钱霞,一种自动清洁的城市分隔护栏,江苏省南京市江宁区格致路100号,211169
CN102017000423719,20170607,CN107043824A,20170815,C12Q1/68;C12N15/113;,中南大学湘雅二医院,江冰,青光眼诊断分子标记物lncRNAsT342877、试剂盒及应用,湖南省长沙市芙蓉区人民中路139号,410011
CN102017000312226,20170505,CN107045144A,20170815,G01V1/30;,西南石油大学,杨巍,一种基于CEEMD的高精度频散AVO属性计算方法,四川省成都市新都区新都大道8号,610500
CN102017000468263,20170620,CN107043344A,20170815,C07D209/14;C09K11/06;A61K31/404;A61P35/00;,齐鲁工业大学,谭学杰,联苯乙酮腙‑N‑甲基‑3‑吲哚甲醛西弗碱的制备、结构和用途,山东省济南市长清区大学路3501号齐鲁工业大学,250353
CN102017000454563,20170616,CN107041504A,20170815,A23L3/44;,粉嫩公主生物科技有限公司耒阳分公司,刘燕,一种冻干食品加工用脱水装置,湖南省衡阳市耒阳市五里牌办事处青麓居委会东二路北段,421899
CN102017000392095,20170527,CN107045229A,20170815,G02F1/13357;G02F1/133;G02B6/00;,深圳市国显科技有限公司,陈永求,一种LCM液晶显示模组,"广东省深圳市龙岗区坪地街道坪东社区同富路9号厂房C,D",518000
CN102017000455667,20170615,CN107045339A,20170815,G05B23/02;,中国人民解放军军事医学科学院卫生装备研究所,天津工业大学,基于服务端的制氧装备远程故障诊断专家系统及诊断方法,天津市河东区万东路106号,300161
CN102017000407152,20170602,CN107045288A,20170815,G05B13/04;,贵州电网有限责任公司电力科学研究院,张锐锋,一种机炉协调控制系统中压力拉回控制的补偿控制方法,贵州省贵阳市南明区解放路32号,550002
