CN201710041945.1,20170120,CN107043422A,20170815,C07K16/40;C12N15/13;A61K39/395;A61P27/02;A61P19/02;A61P29/00;A61P9/10;A61P41/00;G01N33/573;,成都康弘生物科技有限公司,柯潇,抗补体因子D的人源化Fab和人源化抗体及其用途,四川省成都市金牛区蜀西路36号,610036
CN102016001262333,20161230,CN107045088A,20170815,G01R31/00;G01R19/00;,国网天津武清供电有限公司,国家电网公司,一种供电线路停电点判断方法,天津市武清区雍阳西道673号,301700
CN102017000013115,20170109,CN107042468A,20170815,B24B37/00;B24B37/34;B24B37/27;B24B15/04;,天津市天油油泵油嘴制造有限公司,刘东晔,一种座面研磨机,天津市东丽区金钟街新中村大街1号,300000
CN102016000084076,20160205,CN107043770A,20170815,C12N15/113;C12N15/11;C12Q1/68;,华中农业大学,郭爱珍,一组结核病相关的外周血淋巴细胞miRNA及其应用,湖北省武汉市洪山区狮子山街1号,430070
CN102016000816615,20160912,CN107045690A,20170815,G06Q30/02;,福特全球技术公司,奥利弗·莱伊,用于利用专用短程通信进行广告的方法和设备,美国密歇根州迪尔伯恩市,0
CN102016000897020,20161014,CN107042921A,20170815,B65B63/04;B65B43/30;B65B3/04;,温州市伟牌机械有限公司,柯雄伟,一种全自动面膜包装机,浙江省温州市平阳县万全镇宋桥村郑宋大道709-795号,325000
CN102016001085235,20161130,CN107045884A,20170815,G11C13/00;,台湾积体电路制造股份有限公司,陈祈材,非易失性存储器单元,中国台湾新竹市新竹科学工业园力行六路8号,0
CN201610080202.0,20160205,CN107044566A,20170815,F16L3/10;,第一防蚀管业有限公司,郑福耀,管类悬吊托座,中国台湾屏东县东港镇大同路451号,0
CN102016001002021,20161115,CN107044631A,20170815,F22D1/50;,河南中烟工业有限责任公司,王正伟,一种热力除氧器排放的余热回收系统,河南省郑州市郑东新区榆林南路16号,450000
CN201710042963.1,20170120,CN107042870A,20170815,B63B1/10;B63H21/17;G01D21/00;,上海琛岫自控科技有限公司,不公告发明人,一种太阳能、风能混合发电的双体船,上海市松江区茸梅路139号1幢,201600
CN102016000991468,20161111,CN107041896A,20170815,A61K36/424;A61K9/48;A61P3/06;,湖北洪森生物科技有限公司,洪传林,一种辅助降血脂保健胶囊及其制备方法,湖北省荆门市沙洋县经济开发区五洋路,438000
CN102016001075838,20161130,CN107043707A,20170815,C12N1/14;C12R1/645;,广州市瑞硒康生物科技有限公司,程双根,一种富硒蛹虫草培植方法,广东省广州市番禺区沙湾镇龙岐村西环路西侧太公岗1号3楼,511400
CN102017000039325,20170119,CN107044792A,20170815,F28D21/00;,东莞市丰瑞德温控技术有限公司,罗晓平,一种高效大换热量分体式热交换器,广东省东莞市塘厦镇石鼓桥蛟中路178号A栋1-3楼B面,523000
CN102016001225290,20161227,CN107044830A,20170815,G01B11/24;,江苏量淘数据技术有限公司,李云鹏,分布式多目立体视觉系统及目标提取方法,江苏省常州市新北区华山路8号-5号楼1-2,213022
CN102016000083271,20160205,CN107044666A,20170815,F24C15/20;F24F5/00;,珠海格力电器股份有限公司,连园园,抽油烟机,广东省珠海市前山金鸡西路六号,519070
CN102016000234390,20160417,CN107042705A,20170815,B41J11/00;,南京翰骞数码科技有限公司,罗胜,喷墨打印装置用烘干装置及喷墨打印装置,江苏省南京市溧水经济开发区秀山西路,211200
CN102017000066114,20170206,CN107042840A,20170815,B62D1/16;,株式会社万都,李起炯,用于车辆的安装组件,韩国京畿道平泽市浦升面晩湖里343-1,0
CN201710058807.4,20170123,CN107046108A,20170815,H01L51/56;,三星显示有限公司,朴世勋,用于制造显示装置的装置和方法,韩国京畿道龙仁市,0
CN102016000083869,20160205,CN107046459A,20170815,H04L5/00;H04W72/04;H04L27/00;,上海贝尔股份有限公司,阿尔卡特朗讯,用于利用缩短的传输时间间隔进行通信的方法和装置,上海市浦东新区金桥宁桥路388号,201206
CN102016000084498,20160206,CN107045063A,20170815,G01N33/68;,华中农业大学,陈颖钰,肺结核相关血清标识蛋白TIMP-1及其应用,湖北省武汉市洪山区狮子山街1号,430070
CN102016000091929,20160205,CN107042123A,20170815,B01L3/00;G01N33/569;,李榕生,李榕生,被测样品液驱动用构件易于卸除的艾滋病诊断用装置,浙江省宁波市海曙区联丰路169弄39号604室,315010
CN102016001077409,20161130,CN107041918A,20170815,A61K36/8884;A61P9/10;A61K35/62;A61K35/646;,孙领弟,孙领弟,一种治疗中风的中药配方,山东省潍坊市坊子区九龙街办北眉二村267号,261206
CN102016001220998,20161226,CN107043715A,20170815,C12N1/20;A23L2/38;C12R1/25;C12R1/23;C12R1/225;C12R1/01;,山东奥博森医药科技有限公司,晏卫东,一种活性益生菌冻干粉及其制备方法,山东省济南市高新区大正路1777号济南药谷产业园11号楼,250100
CN102016000926097,20161024,CN107045620A,20170815,G06K9/00;G06K9/34;,富士通天株式会社,松本裕生,图像处理设备和图像处理方法,日本国兵库县,0
CN201710063642.X,20170203,CN107045262A,20170815,G03F7/16;,东京毅力科创株式会社,佐藤好友,基板处理方法和基板处理装置,日本东京都,0
CN102017000014865,20170109,CN107042965A,20170815,B65F1/14;,钦州市第二中学,谢汶睿,壁挂式可调口径垃圾袋支架,广西壮族自治区钦州市扬帆北大道,535099
CN201710046155.2,20170120,CN107042016A,20170815,A63F13/2145;A63F13/98;,广州市陆兴动漫科技有限公司,杨全富,游戏机及游戏设备,广东省广州市番禺区大龙街市新路新水坑村段49号H座二楼,510000
CN102016001166040,20161216,CN107045560A,20170815,G06F17/50;,朗姆研究公司,穆罕默德·德里亚·特泰克,通过表面动力学模型优化进行蚀刻轮廓匹配的方法和装置,美国加利福尼亚州,0
CN102017000016020,20170110,CN107046104A,20170815,H01L51/52;H01L51/56;,广东欧珀移动通信有限公司,靳勇,OLED封装结构及其制备方法,广东省东莞市长安镇乌沙海滨路18号,523860
CN102016000083779,20160205,CN107045513A,20170815,G06F17/30;,北京迅奥科技有限公司,王飞,网页标题去噪,北京市海淀区西四环北路15号依斯特大厦506室,100097
CN102016000084065,20160205,CN107046718A,20170815,H04W72/04;H04L1/18;H04L5/00;,上海贝尔股份有限公司,刘勇,配置缩短的PUCCH的方法和装置,上海市浦东新区金桥宁桥路388号,201206
CN102017000013516,20170109,CN107045616A,20170815,G06K7/10;,东软集团股份有限公司,何正光,扫描引擎的扫描方法及扫描装置,辽宁省沈阳市浑南新区新秀街2号,110179
CN102016000962768,20161028,CN107043935A,20170815,C23C28/00;,通用电气公司,B.A.纳加拉,修理燃气涡轮构件的热屏蔽涂层的方法和所得的构件,美国纽约州,0
CN102016000092268,20160205,CN107045059A,20170815,G01N33/569;B01L3/00;,李榕生,李榕生,易于拆解的应用了廉价材料的亚型猪流感检测用装置,浙江省宁波市海曙区联丰路169弄39号604室,315010
CN102016001146199,20161213,CN107043088A,20170815,C01B3/38;C01B3/40;C01B3/48;C01B3/56;C10B53/00;C10G1/00;,神雾科技集团股份有限公司,蔡先明,利用垃圾制备氢气的系统和方法,北京市昌平区马池口镇神牛路18号,102200
CN102016000968201,20161106,CN107044720A,20170815,F24F11/02;G08C17/02;H04W4/00;H04N7/18;,青岛道一空优科技有限公司,郭金昌,一种空气优化五种维度装置的移动控制系统,山东省青岛市莱西市龙口中路8号,266600
CN102016000082646,20160205,CN107043312A,20170815,C05G3/02;C05G3/04;A01C21/00;A01B79/02;A01G13/00;,徐跃,徐跃,一种生物有机液肥及其制备和应用,辽宁省沈阳市皇姑区长江南街3号20楼3-3,110031
CN201710042644.0,20170120,CN107044129A,20170815,E02D19/04;E02D29/16;,中国葛洲坝集团第六工程有限公司,李汉涛,一种分块拼装式无底单壁钢套箱围堰及其施工方法,云南省昆明市官渡区新亚洲体育城星都国际总部基地商务办公区19栋,650206
CN102016000082752,20160205,CN107045980A,20170815,H01L21/336;H01L21/28;H01L29/78;,中芯国际集成电路制造(上海)有限公司,中芯国际集成电路制造(北京)有限公司,晶体管的形成方法,上海市浦东新区张江路18号,201203
CN102017000066055,20170206,CN107042773A,20170815,B60N2/02;B60R21/0132;B60R21/0134;,罗伯特·博世有限公司,H·弗赖恩施泰因,用于设定用于操控车辆安全装置的操控信号的方法和控制设备,德国斯图加特,0
CN102017000037381,20170118,CN107042198A,20170815,B06B3/00;,皮钧,皮钧,一种基于导波线的二维超声振动加工装置,福建省厦门市集美集源路悦海园181-401,361000
CN102016001257499,20161230,CN107046337A,20170815,H02K1/27;H02K1/16;H02P23/14;,浙江众邦机电科技有限公司,荆汝宝,一种永磁电机及其控制方法,浙江省台州市临海市江南街道七一河路181号,317000
CN201710056864.9,20170126,CN107045535A,20170815,G06F17/30;,艾玛迪斯简易股份公司,E·马诺,数据库表索引,法国比奥,0
CN201710063647.2,20170203,CN107045255A,20170815,G03B21/20;,中国电子科技集团公司第五十五研究所,吴金华,一种薄型液晶投影显示LED偏光光源,江苏省南京市中山东路524号,210016
CN201710045711.4,20170121,CN107044521A,20170815,F16H41/04;F16H41/24;,熵零技术逻辑工程院集团股份有限公司,靳北彪,一种能量调整系统,北京市朝阳区北苑路168号中安盛业大厦24层,100101
CN102016000081875,20160205,CN107041947A,20170815,A61K38/17;A61K49/00;A61P1/16;A61P11/00;A61P13/12;A61P9/00;A01K67/027;A01K67/02;,何玉龙,何玉龙,FSTL1在肝脏等组织抗纤维化的稳态调节中的保护作用与应用,江苏省苏州市中国苏州工业园区仁爱路199号苏州大学唐仲英血液学研究中心,215123
CN102016001067792,20161128,CN107041190A,20170815,A01C11/02;,于宪臣,于宪臣,一种移栽机以及其苗盘传送装置和苗盘传送方法,黑龙江省哈尔滨市南岗区第二方圆里15号二单元501,150008
CN201710064304.8,20170204,CN107044240A,20170815,E05F15/622;,斯泰必鲁斯股份有限公司,M·林克,筒状驱动设备,德国科布伦茨,0
CN102016001262243,20161230,CN107044760A,20170815,F25D25/02;,广东格兰仕集团有限公司,中山格兰仕日用电器有限公司,安装快捷的果菜盒滚轮装置,广东省佛山市顺德区容桂大道南25号,528300
CN102016000082135,20160205,CN107045504A,20170815,G06F17/30;,百度在线网络技术（北京）有限公司,刘照卿,提供与功能组件相关联的搜索建议项的方法与装置,北京市海淀区上地十街10号百度大厦,100085
CN201710042680.7,20170120,CN107043978A,20170815,D02G3/40;D01D5/24;D01D5/34;A24D3/10;,广州市白云区鑫球纤维制品厂,邱籼钧,一种多用途双层空芯复合多股丝及其制造方法及应用,广东省广州市白云区嘉禾街长红村田岭路3号,510000
CN201710041017.5,20170120,CN107045299A,20170815,G05B19/042;G05D1/02;,沈阳建筑大学,王似巍,一种汽车手自一体转向指示系统,辽宁省沈阳市浑南新区浑南东路9号,110168
CN102016001223063,20161227,CN107041378A,20170815,A01N59/00;A01N59/16;A01P1/00;C02F1/50;,扬州大学,张娅,一种氧化钇‑石墨烯复合纳米抑菌材料、制备与应用,江苏省扬州市大学南路88号,225009
CN102016001165913,20161216,CN107046158A,20170815,H01P3/00;H01P11/00;,株式会社藤仓,上道雄介,终端装置以及终端方法,日本东京都,0
CN102016001179355,20161219,CN107046346A,20170815,H02K9/04;H02K5/20;H02K5/22;H02K5/16;,四川宏华电气有限责任公司,何楠楠,一种直驱式绞车电机,四川省成都市金牛高科技产业园迎宾大道信息园东路99号,610000
CN102016000082141,20160205,CN107045506A,20170815,G06F17/30;G06K9/62;,阿里巴巴集团控股有限公司,姜晓燕,评估指标获取方法及装置,英属开曼群岛大开曼资本大厦一座四层847号邮箱,0
CN102016001114885,20161207,CN107044362A,20170815,F02K9/95;F02K9/96;,西安近代化学研究所,朱佳佳,一种低羽焰特征发动机,陕西省西安市雁塔区丈八东路168号,710065
CN102017000013795,20170109,CN107046761A,20170815,H05K1/02;H05K3/46;,三星电机株式会社,朴永誧,印刷电路板,韩国京畿道水原市,0
CN102016000695573,20160819,CN107046047A,20170815,H01L27/32;H01L51/56;G09F9/33;,广东聚华印刷显示技术有限公司,李哲,印刷型电致发光器件的像素单元及其制备方法和应用,广东省广州市广州中新广州知识城凤凰三路17号自编五栋388,510000
CN102016000999325,20161114,CN107042238A,20170815,B21B31/07;B21B31/08;,无锡市乾泰金属构件厂,顾卫,一种用于生产异型铜带的轧辊用轴承架,江苏省无锡市惠山区玉祁街道玉西村,214000
CN102016001262668,20161230,CN107045741A,20170815,G07C9/00;B60L11/18;,深圳市沃尔核材股份有限公司,深圳市沃尔新能源电气科技股份有限公司,一种充电枪电磁锁系统、其控制方法及充电枪,广东省深圳市坪山新区兰景北路沃尔工业园,518118
CN201710064652.5,20170204,CN107045460A,20170815,G06F9/54;G06F15/173;G06F3/14;,溥美公司,迪诺·克里斯·卡洛斯,跨平台注释同步,美国加利福尼亚州,0
CN201710064164.4,20170204,CN107044861A,20170815,G01D5/347;G01D5/38;,株式会社三丰,加藤庆显,光电式编码器,日本神奈川县,0
CN102016000082652,20160205,CN107046457A,20170815,H04L5/00;H04W72/04;H04L29/08;,中国移动通信集团公司,夏亮,业务信息的发送方法、接收方法及终端,北京市西城区金融大街29号,100032
CN102016001254603,20161230,CN107045363A,20170815,G05D27/02;,衡阳泰豪通信车辆有限公司,王峰,一种用于通信指挥车的智能控制平台,湖南省衡阳市高新技术产业开发区芙蓉路46号,421000
CN102016001224105,20161227,CN107043751A,20170815,C12N5/09;,上海纳米技术及应用国家工程研究中心有限公司,何丹农,一种缺氧环境下细胞快速复氧的方法,上海市闵行区江川东路28号,200241
CN102016000083946,20160206,CN107044980A,20170815,G01N21/84;,中国科学院高能物理研究所,钱森,一种大面积PMT的光耦合扫描测试装置和方法,北京市石景山区玉泉路19号乙院,100049
CN102016001257571,20161230,CN107045477A,20170815,G06F11/36;,上海富聪金融信息服务有限公司,王鲲,一种可进行多维度检测的质量评估平台,上海市浦东新区中国（上海）自由贸易试验区乳山路227号3楼E-291室,200120
CN102016000092235,20160205,CN107042126A,20170815,B01L3/00;,李榕生,李榕生,采用PDMS材质基片的微流控芯片装置,浙江省宁波市海曙区联丰路169弄39号604室,315010
CN102016000082194,20160205,CN107046706A,20170815,H04W48/16;,中兴通讯股份有限公司,陆婷,接入方法、UE的能力和/或操作特征的确定方法及装置,广东省深圳市南山区科技南路55号,518057
CN102016000081928,20160205,CN107046473A,20170815,H04L12/24;H04W24/04;,华为技术有限公司,王新发,无线网络运维方法及装置,广东省深圳市龙岗区坂田华为总部办公楼,518129
CN201580039610.5,20150504,CN107046808A,20170815,F23B90/00;,西门子公司,H.埃克特,用于燃烧正电性金属的合金的方法,德国慕尼黑,0
CN102016001253854,20161230,CN107044612A,20170815,F21S9/03;F21V23/00;F21V31/00;F21V33/00;H02S20/32;F21W131/103;,南京菱亚汽车技术研究院,张靓,除雾霾路灯,江苏省南京市软件大道106号蓝筹谷大厦A幢12楼,210012
CN201710063255.6,20170126,CN107044144A,20170815,E02F3/42;,神钢建机株式会社,上田浩司,工程机械的液压驱动装置,日本广岛县广岛市,0
CN102016001253650,20161230,CN107043716A,20170815,C12N1/20;A01N63/00;A01P7/04;C12R1/07;,中国农业科学院植物保护研究所,张杰,一种苏云金芽胞杆菌及其应用,北京市海淀区圆明园西路2号,100094
CN102016000934126,20161101,CN107046379A,20170815,H02M11/00;,松下知识产权经营株式会社,山冈正拓,变换器、电力传输系统及控制器,日本大阪府,0
CN201710054700.2,20170124,CN107046475A,20170815,H04L12/24;H04N7/18;,三菱电机大楼技术服务株式会社,佐藤秀平,楼宇设备管理系统,日本东京都,0
CN102016000082953,20160205,CN107046725A,20170815,H04W72/12;H04W72/14;,上海贝尔股份有限公司,阿尔卡特朗讯,上行授权的传输方法及设备,上海市浦东新区金桥宁桥路388号,201206
CN102016001146680,20161213,CN107045559A,20170815,G06F17/50;,广西交通科学研究院,黎力韬,基于成桥初始状态的桥梁技术状态劣化评估方法,广西壮族自治区南宁市西乡塘区高新二路６号,530007
CN102016000083923,20160206,CN107046449A,20170815,H04J3/06;,华为技术有限公司,吕京飞,用于时间同步的方法和时钟,广东省深圳市龙岗区坂田华为总部办公楼,518129
CN102016001077905,20161130,CN107041288A,20170815,A01G31/02;,恩施清江茶业有限责任公司,恩施土家族苗族自治州农业科学院,一种浸入式水肥自供一体育苗机,湖北省恩施土家族苗族自治州恩施市芭蕉侗族乡寨湾村草子坝组,445000
CN102016001225206,20161227,CN107046629A,20170815,H04N5/64;H04N5/44;H04N5/63;,康佳集团股份有限公司,王得喜,一种分体电视机及其控制方法,广东省深圳市南山区高新技术产业园区科技南十二路28号康佳研发大厦23层,518053
CN201710063863.7,20170204,CN107046040A,20170815,H01L27/12;H01L21/77;,株式会社半导体能源研究所,松田慎平,半导体装置及电子设备,日本神奈川,0
CN102016001146516,20161213,CN107041479A,20170815,A23K50/75;A23K10/30;A23K10/37;A23K10/26;A23K20/174;A23K20/26;,周易,周易,一种鸡饲料,广东省惠州市博罗县罗阳镇西区环城路12号,516120
CN201710062319.0,20170207,CN107041318A,20170815,A01K5/02;A01K7/02;A01K5/00;G05B19/042;G01D21/02;,宁波设会物联网科技有限公司,曹建胜,一种喂料器的喂料启动探测系统,浙江省宁波市高新区菁华路188号（甬港现代铭楼）B座807-3室,315000
CN201710040527.0,20170120,CN107046111A,20170815,H01M2/10;B60K1/04;,惠州市亿能电子有限公司,刘飞,一种具有实体结构的电池系统及其生产工艺,广东省惠州市仲恺高新技术产业开发区惠台工业园区56号小区,516006
CN102016000998104,20161108,CN107043070A,20170815,B66C19/00;B66C5/04;,中铁一局集团电务工程有限公司,左传文,一种城市轨道交通供电系统设备安装专用的龙门架,陕西省西安市灞桥区纺园二路与灞柳二路交界处,710038
CN102016000084720,20160206,CN107045825A,20170815,G09B23/28;,复旦大学附属华山医院,崔西栋,喉显微手术模拟操作支架,上海市乌鲁木齐中路12号,200031
CN102016000630024,20160804,CN107044871A,20170815,G01F1/10;,河南工业大学,毛广卿,一种散料流量测量装置,河南省郑州市郑州高新技术产业开发区莲花街,450001
CN201710043149.1,20170119,CN107045033A,20170815,G01N30/88;,常州磐诺仪器有限公司,杨任,一种空气中苯系物在线监测气象色谱仪,江苏省常州市西太湖科技产业园长扬路9号,213145
CN102016001259595,20161230,CN107042025A,20170815,B01D21/26;B01D21/24;C02F1/00;,广东新环机电装备制造有限公司,黄桂华,一种清污除砂机,广东省中山市黄圃镇大雁工业区魁中路2号,528429
CN102016001219269,20161226,CN107046210A,20170815,H01R13/52;H01R13/527;H01R13/635;,张家港市大能塑料制品有限公司,袁庆,一种防漏电触电插座,江苏省苏州市张家港市塘桥镇何桥村,215611
CN102016000082536,20160205,CN107045511A,20170815,G06F17/30;,阿里巴巴集团控股有限公司,周俊,一种目标特征数据的挖掘方法和装置,英属开曼群岛大开曼资本大厦一座四层847号邮箱,0
CN102016000083661,20160205,CN107044938A,20170815,G01N3/12;,襄阳东昇机械有限公司,叶超,一种螺母焊接强度压力试验机,湖北省襄樊市高新技术产业开发区汽车工业园风神路,441058
CN102016000092269,20160205,CN107045060A,20170815,G01N33/569;G01N27/26;G01N27/327;B01L3/00;,李榕生,李榕生,包含电磁辅助构件的易拆解的亚型猪流感多通道检测装置,浙江省宁波市海曙区联丰路169弄39号604室,315010
CN102016001253466,20161230,CN107045752A,20170815,G07F9/00;G06Q30/02;G07F11/00;,富士电机株式会社,八幡贵志,自动售货机系统,日本神奈川县川崎市,0
CN201580064191.0,20151208,CN107046809A,20170815,G06F3/06;,三菱电机株式会社,永井宏和,控制系统以及控制装置,日本东京,0
CN201610080496.7,20160205,CN107041855A,20170815,A61K8/9789;A61K8/31;A61K8/92;A61Q19/00;A61P31/02;A61P17/02;A61P7/04;A61P29/00;,惠连旺,惠连旺,一种纯天然滋养皮肤的护肤品基质配方及制备方法,河北省唐山市滦县茨榆坨镇大石佛庄三村9排21号,063700
CN102016000665951,20160812,CN107044159A,20170815,E03D9/00;,埃丽卡·里奇韦·库克,埃丽卡·里奇韦·库克,一种预先润湿的、用于保护抽水马桶的防护衬垫,美国加利福利亚州,0
CN102016001223437,20161227,CN107043759A,20170815,C12N9/42;C12N15/56;C12N15/81;C12N1/19;C12R1/84;,中国农业科学院饲料研究所,姚斌,一种高催化效率纤维素酶突变体及其编码基因和应用,北京市海淀区中关村南大街12号,100081
CN102016000082212,20160205,CN107045197A,20170815,G02B26/08;G02B6/42;,苏州旭创科技有限公司,于登群,光路控制系统及光模块,江苏省苏州市工业园区星湖街328号创意产业园12-A3,215123
CN201710061586.6,20170126,CN107046755A,20170815,H05B37/02;H05B33/08;F21V23/04;F21V23/00;F21Y115/10;,松下知识产权经营株式会社,安藤保,照明操作装置及照明装置,日本大阪府,0
CN201710041935.8,20170120,CN107043854A,20170815,C22B7/00;C22B15/00;C22B13/02;C22B19/30;C22B19/20;,梁瑞兵,梁超,多种有色金属物料的综合回收设备及工艺,湖南省郴州市永兴县城关镇大桥路13号,423399
CN102017000014209,20170109,CN107043286A,20170815,C05G1/00;C05G3/00;,南京市蔬菜科学研究所,刁春武,一种适用于阳台蔬菜芝麻菜的栽培基质及其制备方法,江苏省南京市江宁区横溪镇南京市蔬菜科技园,211155
CN102016000998189,20161114,CN107041722A,20170815,A47L13/12;A47L13/42;A61L2/10;F21V33/00;F21Y115/10;,宁波洒哇地咔电器有限公司,叶全波,一种多功能拖地装置,浙江省宁波市余姚市阳明街道方桥工业园区育才东路129号,315455
CN102017000015008,20170109,CN107041779A,20170815,A61B17/50;A61B1/267;,史秀华,史秀华,吸盘式气管镜用取物器,山东省济宁市古槐路89号,272000
CN102016001257437,20161230,CN107046271A,20170815,H02H1/00;H02H7/26;,国网天津市电力公司,国家电网公司,一种适用于直流线路保护的低通数字滤波方法,天津市河北区五经路39号,300010
CN102016001153096,20161212,CN107042768A,20170815,B60L11/18;G06Q10/04;,蔚来汽车有限公司,黄丹萍,基于用户行为习惯的主动加电调度方法,中国香港中环夏悫道12号美国银行中心52室,0
CN102017000015374,20170110,CN107042051A,20170815,B01D53/04;C10L3/10;,杨皓,曲思霖,一种甲烷化制LNG液化前预净化防止冻堵工艺,四川省成都市青羊区金泽路118号13栋4单元301,610074
CN102016000828736,20160918,CN107042945A,20170815,B65D81/02;B65D85/20;,罗斯勒IP有限责任公司,沃夫冈·索勒,用于长形物体的弹性保护罩,德国赫尔根斯维勒卢波尔泽街53号,0
CN102016000519036,20160704,CN107046520A,20170815,H04L29/06;H04W4/16;H04W8/18;,三星电子株式会社,宋成旭,用于提供众包服务的方法和设备,韩国京畿道水原市,0
CN102017000011758,20170109,CN107041280A,20170815,A01G25/00;E03B3/28;,郭凯彤,郭凯彤,一种沙漠取水灌溉系统,江苏省徐州市泉山区夹河街26号徐州一中高一（2）班,221008
CN102016001152328,20161214,CN107044374A,20170815,F03B1/04;F03B11/00;,李静波,李静波,水轮发电机,广东省广州市白云区石井金碧新城45栋1505号邝向荣转,510430
CN201610080455.8,20160205,CN107046122A,20170815,H01M4/139;H01M4/04;H01M10/0525;,大荔德飞新能源科技有限公司,刘琪,一种锂离子电池负极极片的预处理方法,陕西省渭南市大荔县官池镇南科技产业园区,710000
CN102016000926049,20161024,CN107046387A,20170815,H02P21/18;H02P21/22;H02P25/03;H02P27/08;,东南大学,黄允凯,一种永磁同步电机的变PID参数电流环启动方法,江苏省南京市江宁区东南大学路2号,211189
CN201610079612.3,20160205,CN107046280A,20170815,H02H9/04;,广西新全通电子技术有限公司,黄丽琼,一种基于RFID技术的防雷设备,广西壮族自治区南宁市衡阳东路7号糖业大厦13层,530001
CN102016000082385,20160205,CN107045480A,20170815,G06F12/0891;,北京京东尚科信息技术有限公司,北京京东世纪贸易有限公司,基于Spring表达式语言来读取和写入缓存存储器的方法和装置,北京市海淀区杏石口路65号西杉创意园西区11C楼东段1-4层西段1-4层,100080
CN102016000301762,20160509,CN107044431A,20170815,F04D25/08;F04D27/00;F04D29/52;E01H1/08;,苏州宝时得电动工具有限公司,焦石平,吹吸装置,江苏省苏州市工业园区东旺路18号,215123
CN201610081614.6,20160205,CN107044352A,20170815,F02D29/00;F02D29/04;F04B49/06;E02F9/20;,贵州詹阳动力重工有限公司,王锐军,一种电喷发动机挖掘机电控系统及控制方法,贵州省贵阳市小河区中曹路97号,550006
CN102016000875551,20160930,CN107046723A,20170815,H04W72/04;H04W52/04;,天工方案公司,D.S.里普雷,用于载波聚合的双工耦合器,美国马萨诸塞州,0
CN102016001262317,20161230,CN107043001A,20170815,B65G43/08;B65G47/24;,湖南先步信息股份有限公司,胡炎良,小型化多功能装配平台,湖南省长沙市高新技术产业开发区M0组团3栋3楼,410000
